platform,operator,channel_id,channel_name,video_id,video_title,published_date,duration_sec,views,likes,comments
YouTube,еҲҳдҝҠй’Ұ,UChhBhc7qJ42rgzAIPe9z6Cg,LittleDrama,BfyanrUU7fY,She discovered her boyfriend's secretрҹҳ®#shorts #shortdrama #mustwatch,2026-06-09,103,1089,14,0
YouTube,еҲҳдҝҠй’Ұ,UChhBhc7qJ42rgzAIPe9z6Cg,LittleDrama,WDV2fyv_rBI,He is the boss of this prisonвҳ пёҸрҹҳұ#shorts #shortdrama #film,2026-06-09,146,1047,22,0
YouTube,еҲҳдҝҠй’Ұ,UChhBhc7qJ42rgzAIPe9z6Cg,LittleDrama,MFqyMMpibCc,He purchased this necklace with absolute strengthрҹ“ҝрҹҳҺ#shorts #shortdrama #mustwatch,2026-06-02,89,1861,35,0
YouTube,еҲҳдҝҠй’Ұ,UChhBhc7qJ42rgzAIPe9z6Cg,LittleDrama,aqlXHbc9mRc,The most taboo love triangle: How should I choose between these two brothers?вқӨпёҸрҹӨ”,2026-05-28,1580,396,5,0
YouTube,еҲҳдҝҠй’Ұ,UChhBhc7qJ42rgzAIPe9z6Cg,LittleDrama,cD1VGmZaWdY,He has different feelings for himрҹҳ®вқӨпёҸ#shortdrama #love #shorts,2026-05-27,60,1722,17,1
YouTube,еҲҳдҝҠй’Ұ,UChhBhc7qJ42rgzAIPe9z6Cg,LittleDrama,hzj2is-Lcu4,She caused a commotion in the cockpit just to make the plane turn aroundвңҲпёҸрҹҳұ#shortdrama #shorts,2026-05-27,37,9717,41,1
YouTube,еҲҳдҝҠй’Ұ,UChhBhc7qJ42rgzAIPe9z6Cg,LittleDrama,QTycjHqghy8,"""Sleep with me before my 30th birthday, or I'll DIE!"" The Alpha King's Cursed Bride.рҹҗәрҹ‘°",2026-05-26,1017,326,4,0
YouTube,еҲҳдҝҠй’Ұ,UChhBhc7qJ42rgzAIPe9z6Cg,LittleDrama,j6-gbK-mXg0,"Escape from the scumbag ex, embrace the cold CEO, I know you love meрҹҳҺрҹҢ№Seducing Mr. Larsen",2026-05-25,1235,161,2,0
YouTube,еҲҳдҝҠй’Ұ,UChhBhc7qJ42rgzAIPe9z6Cg,LittleDrama,SLFEEEUrShU,His special petрҹҗҚрҹ•·пёҸ#shortdrama #shorts #pet,2026-05-25,53,4958,16,0
YouTube,еҲҳдҝҠй’Ұ,UChhBhc7qJ42rgzAIPe9z6Cg,LittleDrama,o6uMw3ce2Dk,She almost ended up with her ex-husband's father-in-lawрҹҳұвқӨпёҸ#shorts  #love  #shortdrama,2026-05-25,57,72,1,0
YouTube,еҲҳдҝҠй’Ұ,UChhBhc7qJ42rgzAIPe9z6Cg,LittleDrama,4sOjsKMrvas,"He Is Desperately Searching For a Genius Hacker, Unknowing She Is Actually His New Wife!рҹҳ®рҹҳҶ",2026-05-21,1188,173,4,0
YouTube,еҲҳдҝҠй’Ұ,UChhBhc7qJ42rgzAIPe9z6Cg,LittleDrama,kkzz8sL2S6s,"A forbidden love sparked by a car accident: Uncle, what are you doing here?рҹҢ№рҹҡ—Full Movie",2026-05-19,1288,242,2,0
YouTube,еҲҳдҝҠй’Ұ,UChhBhc7qJ42rgzAIPe9z6Cg,LittleDrama,QTHTjvmIpE4,BillionaireвҖҷs Fake Flash Marriage to a Village Girl Turns Real Loveрҹҳ®рҹҢ№Country Gal to CEO's Bride,2026-05-19,1971,150,1,0
YouTube,еҲҳдҝҠй’Ұ,UChhBhc7qJ42rgzAIPe9z6Cg,LittleDrama,akxLgH_DCks,"He was originally my husband's uncle, but everything changed after that nightрҹҳ®вңЁ",2026-05-18,1414,100,1,0
YouTube,еҲҳдҝҠй’Ұ,UChhBhc7qJ42rgzAIPe9z6Cg,LittleDrama,BR-ChF2LAO4,My homeless husband from a whirlwind marriage turned out to be the king of the mafia!рҹҳұвӣ“пёҸ,2026-05-18,1723,2128,19,0
YouTube,еҲҳдҝҠй’Ұ,UChhBhc7qJ42rgzAIPe9z6Cg,LittleDrama,sXNj7ZTbeZo,"The prince ruined my reputation, should I save him now?рҹӨ”#shortdrama #shorts #prince",2026-05-17,86,889,7,0
YouTube,еҲҳдҝҠй’Ұ,UChhBhc7qJ42rgzAIPe9z6Cg,LittleDrama,BPhRGpYgIGc,What should I do? I kissed the prince in front of the whole schoolрҹҳ°#shorts #shortdrama,2026-05-17,50,1773,10,0
YouTube,еҲҳдҝҠй’Ұ,UChhBhc7qJ42rgzAIPe9z6Cg,LittleDrama,YxzjZmXFc_w,She kicked the school bully to the groundрҹҳҶрҹҳҶ#shorts #funny #schoolbully,2026-05-16,88,16235,266,1
YouTube,еҲҳдҝҠй’Ұ,UChhBhc7qJ42rgzAIPe9z6Cg,LittleDrama,gAlk_TX-KJw,"The school bully harasses classmates, and the new transfer student steps in to helpрҹҳ®вңЁ#shorts #fyp",2026-05-16,57,3677,70,1
YouTube,еҲҳдҝҠй’Ұ,UChhBhc7qJ42rgzAIPe9z6Cg,LittleDrama,UnHTys50wgg,"I saved a classmate out of righteousness, yet I became the target of the school bullyрҹҳ°#shorts #film",2026-05-16,101,2284,88,1
YouTube,еҲҳдҝҠй’Ұ,UChhBhc7qJ42rgzAIPe9z6Cg,LittleDrama,YVOEnz4NXX0,She is actually willing to marry a beggarрҹҳ®вқӨпёҸ#shortdrama  #love #begger #shorts,2026-05-15,107,1311,19,0
YouTube,еҲҳдҝҠй’Ұ,UChhBhc7qJ42rgzAIPe9z6Cg,LittleDrama,_3s6WpVj_R4,Loving Lucifer: He is my nightmare and my only escapeрҹ–ӨрҹҢ№Lucifer's Bride,2026-05-13,1691,38549,420,9
YouTube,еҲҳдҝҠй’Ұ,UChhBhc7qJ42rgzAIPe9z6Cg,LittleDrama,GmuXbRQgLNI,"""You're Just My Prey!"" When the Cold Lucifer Meets His Innocent Bride, He Loses Control!рҹ‘°рҹҳҲ",2026-05-12,1609,57319,469,9
YouTube,еҲҳдҝҠй’Ұ,UChhBhc7qJ42rgzAIPe9z6Cg,LittleDrama,xw_G15u8Sks,"When the target is my first love, the mission is doomedвқӨпёҸрҹ”ҘThe Hitwoman Full Movie",2026-05-11,1587,379,8,0
YouTube,еҲҳдҝҠй’Ұ,UChhBhc7qJ42rgzAIPe9z6Cg,LittleDrama,PlAi7WV12b4,"Dumped by the Beta, Claimed by the Alpha Brother!рҹҳ®рҹҢ№Claimed by My Ex's Alpha Brother",2026-05-08,1363,6781,91,0
YouTube,еҲҳдҝҠй’Ұ,UChhBhc7qJ42rgzAIPe9z6Cg,LittleDrama,ErqtPWrOJRo,вңЁрҹҢ№Forbidden Love: I Think I Fell for My Dad's Friend | How to Break a DILF,2026-04-27,1392,128550,747,9
YouTube,еҲҳдҝҠй’Ұ,UChhBhc7qJ42rgzAIPe9z6Cg,LittleDrama,AnIXGFPN5YE,"рҹ”ҘвқӨпёҸThought it was a contractual marriage, but the gangster boss took it seriously!",2026-04-23,1707,1323,18,0
YouTube,еҲҳдҝҠй’Ұ,UChhBhc7qJ42rgzAIPe9z6Cg,LittleDrama,lWYfMClow00,I Was Forced to Live With My Ultimate Rival... Now I'm His Secret Nanny! рҹ§№вңЁ,2026-04-21,1519,41127,238,2
YouTube,еҲҳдҝҠй’Ұ,UChhBhc7qJ42rgzAIPe9z6Cg,LittleDrama,9xd3HFI33yM,вқӨпёҸрҹҢ№Dancing with the devil: The CEO's ultimate temptation and absolute possession!,2026-04-19,1285,30751,123,2
YouTube,еҲҳдҝҠй’Ұ,UChhBhc7qJ42rgzAIPe9z6Cg,LittleDrama,wJbucGeh8s8,Provoked the city's most dangerous man! The crazy boss spoils me to the heavens?!рҹҢ№рҹҢ№,2026-04-17,1472,78996,520,2
YouTube,еҲҳдҝҠй’Ұ,UChhBhc7qJ42rgzAIPe9z6Cg,LittleDrama,uB9BmvA_Pdo,вӣ“пёҸThe assassin I saved by chance is none other than my fiancГ©'s brother | Love Is a Dangerous Dance,2026-04-15,1606,2941,24,0
YouTube,еҲҳдҝҠй’Ұ,UChhBhc7qJ42rgzAIPe9z6Cg,LittleDrama,GwuLLisKSEo,"рҹҘІI died, but I was rebornвҖ”all to make my husband get the punishment he deservesвӣ“пёҸ",2026-04-14,1052,480,3,0
YouTube,еҲҳдҝҠй’Ұ,UChhBhc7qJ42rgzAIPe9z6Cg,LittleDrama,OF1tB60Smwc,"рҹ’”I loved him for ten years, only to find he saw me as nothing but a toolрҹҘҖ",2026-04-14,879,1007,9,0
YouTube,еҲҳдҝҠй’Ұ,UChhBhc7qJ42rgzAIPe9z6Cg,LittleDrama,rMiVwfdruNg,рҹҳ®The father she has been searching for four years turns out to be the world's largest arms dealerрҹ”Ҙ,2026-04-13,1281,2270,26,0
YouTube,еҲҳдҝҠй’Ұ,UChhBhc7qJ42rgzAIPe9z6Cg,LittleDrama,SgboOoBM8hM,рҹ”ҘIвҖҷm actually a wealthy manрҹҳҺbut I can be a poor guy if thatвҖҷs what you likeрҹҢ№,2026-04-13,449,3093,10,2
YouTube,еҲҳдҝҠй’Ұ,UChhBhc7qJ42rgzAIPe9z6Cg,LittleDrama,Q7up90bZUN8,рҹ”ҘрҹҰ№вҖҚвҷӮпёҸForbidden Love: I Fell in Love with the Mafia Boss | Monster in His Eyes,2026-04-12,1071,4184,28,0
YouTube,еҲҳдҝҠй’Ұ,UChhBhc7qJ42rgzAIPe9z6Cg,LittleDrama,hU5Scv_ahsI,"рҹҰ№вҖҚвҷӮпёҸвқӨпёҸEveryone fears him, but I want to get close to him | Monster in His Eyes",2026-04-11,1271,13100,77,3
YouTube,еҲҳдҝҠй’Ұ,UChhBhc7qJ42rgzAIPe9z6Cg,LittleDrama,MGiLsMs1I8Q,рҹҳ®вқӨпёҸLove at first sight вҖ” the domineering love of the Mafia boss | In the Palm of His Hand,2026-04-10,775,15599,51,1
YouTube,еҲҳдҝҠй’Ұ,UChhBhc7qJ42rgzAIPe9z6Cg,LittleDrama,zXCsRrlxFBg,рҹ’”рҹҘІMy boyfriend sold me to the boss of the mafia | In the Palm of His Hand,2026-04-09,853,5726,41,0
YouTube,еҲҳдҝҠй’Ұ,UChhBhc7qJ42rgzAIPe9z6Cg,LittleDrama,HUdgYk62Zq4,"вңЁрҹҳҺMy three brothers are top tycoons | After Divorce, I'm Spoiled by Three Brothers",2026-04-08,1372,1204,19,0
YouTube,еҲҳдҝҠй’Ұ,UChhBhc7qJ42rgzAIPe9z6Cg,LittleDrama,jWgUCYSEnYg,"рҹҳ®I only found out I was a rich girl after my divorce | After Divorce, I'm Spoiled by Three Brothers",2026-04-08,1339,2740,39,3
YouTube,еҲҳдҝҠй’Ұ,UChhBhc7qJ42rgzAIPe9z6Cg,LittleDrama,-mKFkm6BKzA,рҹҳ®A Secret I CanвҖҷt Let My Brother Know вҖ“ My Secret Crush | I'm In Love With My Brother's Best Friend,2026-04-06,802,3405,26,0
YouTube,еҲҳдҝҠй’Ұ,UChhBhc7qJ42rgzAIPe9z6Cg,LittleDrama,0rNp8XZ_hrg,"вқӨпёҸComplicated love, it seems my friend's sister likes me | I'm In Love With My Brother's Best Friend",2026-04-05,1153,62265,273,3
YouTube,еҲҳдҝҠй’Ұ,UChhBhc7qJ42rgzAIPe9z6Cg,LittleDrama,pETi48yor8M,вқӨпёҸрҹ«¶I have developed feelings for my brother's friend | I'm In Love With My Brother's Best Friend?!,2026-04-05,1341,130756,569,2
YouTube,еҲҳдҝҠй’Ұ,UChhBhc7qJ42rgzAIPe9z6Cg,LittleDrama,kLXiub80saE,"рҹ”ҘAs long as IвҖҷm here, I wonвҖҷt let you suffer any more unfair treatment | Surrender to My Professor",2026-04-04,18,54751,205,3
YouTube,еҲҳдҝҠй’Ұ,UChhBhc7qJ42rgzAIPe9z6Cg,LittleDrama,G-QyiiJAXEY,рҹҳұвқӨпёҸForbidden Love: I had a relationship with my professor | Surrender to My Professor,2026-04-04,10,31416,104,0
YouTube,еҲҳдҝҠй’Ұ,UChhBhc7qJ42rgzAIPe9z6Cg,LittleDrama,FjohhLxcBGk,вңЁMy Unspeakable Secret with the Professor | Surrender to My Professor,2026-04-03,52,81346,396,4
YouTube,еҲҳдҝҠй’Ұ,UChhBhc7qJ42rgzAIPe9z6Cg,LittleDrama,43WbGZkxn1g,"рҹ’”рҹҳӯHe only saw the truth when I was dying |  Dear Brother, You Loved Me Too Late",2026-04-02,738,2788,14,0
YouTube,еҲҳдҝҠй’Ұ,UChhBhc7qJ42rgzAIPe9z6Cg,LittleDrama,kR2oezMMaVM,"рҹ’”рҹҳӯMy beloved brother actually wished I was dead | Dear Brother, You Loved Me Too Late",2026-04-02,1275,4226,27,1
YouTube,еҲҳдҝҠй’Ұ,UChhBhc7qJ42rgzAIPe9z6Cg,LittleDrama,QwXwjzn2uvg,"рҹҺўвңЁI hate him, yet I can't stop thinking about him | My Stepbrother's Dirty Secret",2026-04-01,945,4232,31,0
YouTube,еҲҳдҝҠй’Ұ,UChhBhc7qJ42rgzAIPe9z6Cg,LittleDrama,5IxQ-jSCBrY,вңЁрҹ«¶My Stepbrother Pretends Not to Know Me at School | My Stepbrother's Dirty Secret,2026-04-01,684,388389,1485,18
YouTube,еҲҳдҝҠй’Ұ,UChhBhc7qJ42rgzAIPe9z6Cg,LittleDrama,sI1dX0jotdc,"рҹҺўвқӨпёҸI Hate My Stepbrother, But He Saved My Life | My Stepbrother's Dirty Secret",2026-04-01,1102,3129,27,0
YouTube,еҲҳдҝҠй’Ұ,UChhBhc7qJ42rgzAIPe9z6Cg,LittleDrama,nkWsX-ZKaiM,вқӨпёҸрҹ«¶My enemy boss seems to have fallen for me | Scandalous,2026-03-31,813,77190,537,5
YouTube,еҲҳдҝҠй’Ұ,UChhBhc7qJ42rgzAIPe9z6Cg,LittleDrama,cFdW7RVDJlY,My first love asked me to pretend to be his fake girlfriendрҹӨ”| Pucked in the Friend Zone,2026-03-30,658,39997,256,9
YouTube,еҲҳдҝҠй’Ұ,UChhBhc7qJ42rgzAIPe9z6Cg,LittleDrama,51_6qY22WPM,"He broke my heart completely, yet I still love himвқӨпёҸвҖҚрҹ©№ | Pucked in the Friend Zone",2026-03-30,1102,13759,77,1
YouTube,еҲҳдҝҠй’Ұ,UChhBhc7qJ42rgzAIPe9z6Cg,LittleDrama,izNF9hBm3mU,She is falling into the embrace of love | Breathe,2026-03-28,825,27547,175,4
YouTube,еҲҳдҝҠй’Ұ,UChhBhc7qJ42rgzAIPe9z6Cg,LittleDrama,Sw8XQIsap3c,She fell in love with the person she sought revenge against | Scandalous,2026-03-27,927,11245,49,0
YouTube,еҲҳдҝҠй’Ұ,UChhBhc7qJ42rgzAIPe9z6Cg,LittleDrama,IoMrkTiomvQ,"I didn't want to reveal my identity, but you bullied my sister. | My Sister Is the Warlord Queen",2026-03-25,1312,5808,52,2
YouTube,еҲҳдҝҠй’Ұ,UChhBhc7qJ42rgzAIPe9z6Cg,LittleDrama,HuGo9mRHu-4,Everyone thought she was just a cleanerвҖҰ until she revealed her true identity. | Complete collection,2026-03-25,1191,4418,24,0
YouTube,еҲҳдҝҠй’Ұ,UC80LfoIH6FrzHTm6lXTWCKQ,DramaStory,QDD2zkWcgaY,"You are my partner, but we can't be togetherрҹҳўрҹҗәIn Love with the Alpha",2026-06-11,1451,1434,18,0
YouTube,еҲҳдҝҠй’Ұ,UC80LfoIH6FrzHTm6lXTWCKQ,DramaStory,H2pcazYiwko,"No useless wolf? Nah, it's the supreme Luna!рҹҗәрҹ‘‘In Love with the Alpha",2026-06-11,1602,3608,55,1
YouTube,еҲҳдҝҠй’Ұ,UC80LfoIH6FrzHTm6lXTWCKQ,DramaStory,JLsHlrpDGo0,"""I'm Not Into Guys..."" Proceeds to Stare At Him For 5 Minutes Straight. рҹҳӮвқӨпёҸStableboy",2026-06-10,1181,19670,307,3
YouTube,еҲҳдҝҠй’Ұ,UC80LfoIH6FrzHTm6lXTWCKQ,DramaStory,frpiu_TV84A,Ex becomes stepson! She Married His Billionaire Mafia Dad After Being Cheated On! рҹӨҜрҹҳ®,2026-06-10,1623,489,4,0
YouTube,еҲҳдҝҠй’Ұ,UC80LfoIH6FrzHTm6lXTWCKQ,DramaStory,OCYHxTwtR3A,"Forced to marry the rumored demon brother, unexpectedly pampered to the skyвқӨпёҸрҹҢ№",2026-06-09,1548,1400,14,0
YouTube,еҲҳдҝҠй’Ұ,UC80LfoIH6FrzHTm6lXTWCKQ,DramaStory,RSkORQRDHXg,"On one side is a hated first love, on the other a betraying scumbag; how should she chooseрҹҳўрҹҘҖ",2026-06-09,13,3519,18,0
YouTube,еҲҳдҝҠй’Ұ,UC80LfoIH6FrzHTm6lXTWCKQ,DramaStory,ITAJ_txwE8Y,"Forbidden Mission: Seduce DadвҖҷs Foe, Only to Be Trapped by a Powerful TycoonвқӨпёҸрҹҢ№Scandalous Full Movie",2026-06-07,1499,20656,109,2
YouTube,еҲҳдҝҠй’Ұ,UC80LfoIH6FrzHTm6lXTWCKQ,DramaStory,7iAdn-dRBy8,"When a tsundere president meets a rugby star, they say they dislike them, but their body is honestвқӨпёҸ",2026-06-06,1188,5096,90,0
YouTube,еҲҳдҝҠй’Ұ,UC80LfoIH6FrzHTm6lXTWCKQ,DramaStory,fTqpSud9vhs,"Billionaire hunts worldwide for first love, who turns out to be his contract wifeрҹҳӮвқӨпёҸ",2026-06-05,604,5327,66,1
YouTube,еҲҳдҝҠй’Ұ,UC80LfoIH6FrzHTm6lXTWCKQ,DramaStory,YcdJRLLEYtg,"Searched 18 years for my first love, only to see her name on my marriage certificateрҹҳӮвқӨпёҸ",2026-06-05,1258,21343,172,0
YouTube,еҲҳдҝҠй’Ұ,UC80LfoIH6FrzHTm6lXTWCKQ,DramaStory,gFOlXXssQ64,What are the two of them doing?рҹҳӮ#shorts #shortdrama #mustwatch,2026-06-05,37,63,4,0
YouTube,еҲҳдҝҠй’Ұ,UC80LfoIH6FrzHTm6lXTWCKQ,DramaStory,wbITytWEyL8,The construction worker I married suddenly turned out to be the richest man throughoutвқӨпёҸрҹҢ№,2026-06-04,309,976,4,0
YouTube,еҲҳдҝҠй’Ұ,UC80LfoIH6FrzHTm6lXTWCKQ,DramaStory,O1rqI0enOeA,"My scumbag ex humiliated me in public, but his brother held me in his armsвқӨпёҸрҹҢ№",2026-06-04,1345,27011,325,9
YouTube,еҲҳдҝҠй’Ұ,UC80LfoIH6FrzHTm6lXTWCKQ,DramaStory,2zJZEdW5iDk,"A love that transcends age, an abstinent older man falls for a proud young girlрҹҳұвқӨпёҸ",2026-06-03,1425,6758,29,0
YouTube,еҲҳдҝҠй’Ұ,UC80LfoIH6FrzHTm6lXTWCKQ,DramaStory,YMbuZaS5KTI,Forbidden love: Help! I accidentally fell for my DAD'S best friend!рҹҳұвқӨпёҸHow to Tame a Silver Fox,2026-06-03,1185,7911,46,0
YouTube,еҲҳдҝҠй’Ұ,UC80LfoIH6FrzHTm6lXTWCKQ,DramaStory,hHft5DWNmrM,"My fiancГ© betrayed me, so I turned around and married my billionaire ex-boyfriend!вқӨпёҸрҹҢ№",2026-06-02,1406,22170,226,2
YouTube,еҲҳдҝҠй’Ұ,UC80LfoIH6FrzHTm6lXTWCKQ,DramaStory,xXjTicy-RQA,"The mortal girl wields thunder, but I am the most perfect heir of the king of all gods!вҡЎрҹ”Ҙ",2026-06-02,1177,6993,77,0
YouTube,еҲҳдҝҠй’Ұ,UC80LfoIH6FrzHTm6lXTWCKQ,DramaStory,EzfRnacrQTA,"She is my mate, no one can hurt her, the declaration of the cold and ruthless wolf kingрҹҗәвқӨпёҸ",2026-06-01,1144,6917,66,3
YouTube,еҲҳдҝҠй’Ұ,UC80LfoIH6FrzHTm6lXTWCKQ,DramaStory,WmZtoh39sbs,"My scumbag fiancГ© betrayed me, so I turned and threw myself into his uncle's armsрҹҳ®рҹҢ№",2026-06-01,1171,7476,71,2
YouTube,еҲҳдҝҠй’Ұ,UC80LfoIH6FrzHTm6lXTWCKQ,DramaStory,2glXC5MAJEI,"A Mute Girl Falls for the Brutal Wolf King, My love for you speaks for itself.рҹҗәвқӨпёҸ",2026-05-31,1225,26688,183,1
YouTube,еҲҳдҝҠй’Ұ,UC80LfoIH6FrzHTm6lXTWCKQ,DramaStory,EqrizILDN-E,"The school bully set a trap for me, but unexpectedly he himself turned out to be the foolрҹҳҺрҹӨЎ",2026-05-30,1291,9283,77,2
YouTube,еҲҳдҝҠй’Ұ,UC80LfoIH6FrzHTm6lXTWCKQ,DramaStory,sxAvCrnmrJI,"We can't, I am your brother's girlfriendрҹҳ®вқӨпёҸA Hamptons Summer Affair with My BFF's Brother",2026-05-30,1380,44155,473,4
YouTube,еҲҳдҝҠй’Ұ,UC80LfoIH6FrzHTm6lXTWCKQ,DramaStory,ioPuxqgsI7A,An undercover billionaire girl vs. a fake queen bee. Who wins? рҹ‘‘рҹҚҝ,2026-05-29,1231,2053,20,0
YouTube,еҲҳдҝҠй’Ұ,UC80LfoIH6FrzHTm6lXTWCKQ,DramaStory,xIuwOFtcnEI,"He's my brother's worst enemy, so why can't I stop thinking about him?! вқӨпёҸрҹҢ№Hate to Love You",2026-05-28,1199,11230,59,0
YouTube,еҲҳдҝҠй’Ұ,UC80LfoIH6FrzHTm6lXTWCKQ,DramaStory,EPu9OroSYEE,"Forced to be a tutor for my archenemy, but the atmosphere is becoming increasingly awkwardрҹҳҶрҹҢ№",2026-05-28,1515,34902,373,12
YouTube,еҲҳдҝҠй’Ұ,UC80LfoIH6FrzHTm6lXTWCKQ,DramaStory,IYsBLzq1kzQ,My cruel husband harmed my familyрҹҘІ. Now it's my turn to fight back!вңҠрҹҳЎThe Deaf Heiress's Secret,2026-05-27,1124,3818,15,1
YouTube,еҲҳдҝҠй’Ұ,UC80LfoIH6FrzHTm6lXTWCKQ,DramaStory,UIJjKqKx_ys,"You are my nemesis, I could never like you, not until they are in one roomрҹҳ®вқӨпёҸTutoring my Rival Boy",2026-05-27,1587,49349,514,5
YouTube,еҲҳдҝҠй’Ұ,UC80LfoIH6FrzHTm6lXTWCKQ,DramaStory,2OQjBt5DGJQ,"""Give me a pup, or I'll DIE!"" Forced to be the mate of a cursed Werewolf Alpha!рҹҗәрҹҳұ",2026-05-26,1257,52043,262,4
YouTube,еҲҳдҝҠй’Ұ,UC80LfoIH6FrzHTm6lXTWCKQ,DramaStory,8WY-nG14N7s,Sky-high contract: He spent tens of millions just to make me his only virgin brideвҖҰрҹҗәрҹ‘°,2026-05-26,1129,17641,138,14
YouTube,еҲҳдҝҠй’Ұ,UC80LfoIH6FrzHTm6lXTWCKQ,DramaStory,gHLtnMGuuuM,"My brother's friend became my boyfriend, and my brother exploded when he found outрҹҳ°рҹҘҖ",2026-05-25,1294,11813,68,1
YouTube,еҲҳдҝҠй’Ұ,UC80LfoIH6FrzHTm6lXTWCKQ,DramaStory,jOGEtXTDyI4,"Hockey superstar is expecting a child out of wedlock, and the mother turns out to be disabled?!рҹҳ®рҹҢ№",2026-05-24,1519,19331,168,0
YouTube,еҲҳдҝҠй’Ұ,UC80LfoIH6FrzHTm6lXTWCKQ,DramaStory,2G8fH_PueQU,"His last message before space launch: ""This is my final gift to you.""рҹҺҷпёҸрҹ’”Their Brother Lost in Space",2026-05-23,1154,471,7,1
YouTube,еҲҳдҝҠй’Ұ,UC80LfoIH6FrzHTm6lXTWCKQ,DramaStory,Kyq2ddD7MFA,"After being abandoned by a scumbag, I received the affection of the most handsome dukeрҹӨҰвҖҚвҷӮпёҸвқӨпёҸ",2026-05-22,1192,8813,61,1
YouTube,еҲҳдҝҠй’Ұ,UC80LfoIH6FrzHTm6lXTWCKQ,DramaStory,Fm2lJSv1ZJ4,"The Fierce Wolf King Falls for an Innocent WolfвҖ‘less Girl, she wants to escape but cannotрҹҗәрҹҢ№",2026-05-19,1280,60248,397,9
YouTube,еҲҳдҝҠй’Ұ,UC80LfoIH6FrzHTm6lXTWCKQ,DramaStory,oi0-52K37vg,"Innocent princess vs cold-blooded thug, even if you don't say it, I know you love meвқӨпёҸрҹҢ№",2026-05-18,1242,25324,123,6
YouTube,еҲҳдҝҠй’Ұ,UC80LfoIH6FrzHTm6lXTWCKQ,DramaStory,or3gmJ1PS50,Help! What should I do if I kissed my arch-enemy prince in front of the whole school?вқӨпёҸрҹӨҙ,2026-05-17,1336,25927,352,8
YouTube,еҲҳдҝҠй’Ұ,UC80LfoIH6FrzHTm6lXTWCKQ,DramaStory,x1gbfw7RUlw,Forbidden Touch: That Prince I Hate the Most Kissed MeвқӨпёҸрҹҢ№The Prince's First Love Full Movie,2026-05-16,1074,16193,186,6
YouTube,еҲҳдҝҠй’Ұ,UC80LfoIH6FrzHTm6lXTWCKQ,DramaStory,qFr0jXVXZYw,"Accidentally saved a pop superstar, and since then my life has changed because of himрҹҺӨвңЁBreathe",2026-05-13,1714,57397,606,10
YouTube,й»„жҖқзҗӘ,UCIg97fCjw1HnS8vPqwiHLGA,Drama Nook,ZO6tfqLCPXk,I escaped my toxic Vampire Master... until his own PRINCE found me! рҹҳұрҹ‘‘ | The Vampire Prince's Bride,2026-06-12,492,25,2,0
YouTube,й»„жҖқзҗӘ,UCIg97fCjw1HnS8vPqwiHLGA,Drama Nook,cPpycsEWGig,"рҹ’“ ""Love is a WEAKNESS."" But for her, the powerful alpha is willing to lose the game.",2026-06-09,35,7727,111,0
YouTube,й»„жҖқзҗӘ,UCIg97fCjw1HnS8vPqwiHLGA,Drama Nook,fdU3huxTW0A,"рҹ’“ ""He doesn't deserve a LUNA."" But for her, the scary alpha is willing to lose the game.",2026-06-09,1600,2198,29,0
YouTube,й»„жҖқзҗӘ,UCIg97fCjw1HnS8vPqwiHLGA,Drama Nook,_9SH8ltZ7iQ,рҹ‘‘ I ran away from a cheating ex... only to return as his alpha brother's LUNA!,2026-06-09,76,7230,124,0
YouTube,й»„жҖқзҗӘ,UCIg97fCjw1HnS8vPqwiHLGA,Drama Nook,Aw-3fbjlk6s,рҹ–ӨLove in Luca's world always comes with danger.вҒ ,2026-06-05,90,4582,97,5
YouTube,й»„жҖқзҗӘ,UCIg97fCjw1HnS8vPqwiHLGA,Drama Nook,Qtb48jh92s0,Time to pay the price! рҹ’ёрҹӨ¬ My cheating fiancГ© and his mistress are NOT ready for the revenge IвҖҷm...,2026-05-25,133,760,42,1
YouTube,й»„жҖқзҗӘ,UCIg97fCjw1HnS8vPqwiHLGA,Drama Nook,eLvwjFAsUrQ,The man who promised forever abandoned me. рҹ’” The man I left years ago became my only hope. вҸівңЁ рҹҳӯ,2026-05-25,87,2006,33,1
YouTube,й»„жҖқзҗӘ,UCIg97fCjw1HnS8vPqwiHLGA,Drama Nook,8h8shocJ1EA,"""Double his bid.""рҹ”ҘMy billionaire first love humiliated my cheating ex just to win me that necklace!",2026-05-25,94,12125,290,1
YouTube,й»„жҖқзҗӘ,UCIg97fCjw1HnS8vPqwiHLGA,Drama Nook,AS1ZKKXMmCk,"рҹҘәрҹ’”Caught my fiancГ© cheating, but running into my billionaire first love changed EVERYTHING...  вңЁ",2026-05-25,109,2182,81,2
YouTube,й»„жҖқзҗӘ,UCIg97fCjw1HnS8vPqwiHLGA,Drama Nook,akIJBk3b2mM,Both jock brothers lost the game and chose HER for the kiss dare. Who gets the lip? рҹҘөрҹ’Ӣ,2026-05-19,18,15421,67,1
YouTube,й»„жҖқзҗӘ,UCIg97fCjw1HnS8vPqwiHLGA,Drama Nook,ZAHv0QGBIvc,The popular lacrosse captain just found out his fiancГ©e has a secret connection with his brother! рҹҘҚрҹ’Ҙ,2026-05-19,31,2699,21,1
YouTube,й»„жҖқзҗӘ,UCIg97fCjw1HnS8vPqwiHLGA,Drama Nook,oY3AUaXhGQY,"Forced to marry a Bellfort brother for debt, but sheвҖҷs lowkey tangled up with BOTH! рҹ’ёрҹӨјвҖҚвҷҖпёҸ",2026-05-19,56,27343,432,3
YouTube,й»„жҖқзҗӘ,UCIg97fCjw1HnS8vPqwiHLGA,Drama Nook,e9j0zwYCtSA,"I tipped my ex-husband $1,000 & called him ""Average."" рҹ’°рҹ’… Now I'm his secretary and he's obsessed! рҹҷ„рҹ”Ҙ",2026-05-19,158,2483,74,1
YouTube,й»„жҖқзҗӘ,UCIg97fCjw1HnS8vPqwiHLGA,Drama Nook,pGZi-KwKWzw,Targeted by the Elite Four on her first day!,2026-05-09,60,3226,46,0
YouTube,й»„жҖқзҗӘ,UCIg97fCjw1HnS8vPqwiHLGA,Drama Nook,aoIq1cEoGak,Targeted by the Elite Four on her first day!,2026-05-09,42,4913,53,0
YouTube,й»„жҖқзҗӘ,UCIg97fCjw1HnS8vPqwiHLGA,Drama Nook,l2r5qVMU6gI,Targeted by the Elite Four on her first day!,2026-05-09,58,3051,51,0
YouTube,й»„жҖқзҗӘ,UCIg97fCjw1HnS8vPqwiHLGA,Drama Nook,bVK0e4IegK8,Targeted by the Elite Four on her first day!,2026-05-09,33,2757,21,0
YouTube,й»„жҖқзҗӘ,UCIg97fCjw1HnS8vPqwiHLGA,Drama Nook,CipmpuSzwsc,My cold-hearted ex insists he's my only protector... рҹҗәрҹ’”How to Kiss a Vampire,2026-05-08,1284,1344,15,0
YouTube,й»„жҖқзҗӘ,UCIg97fCjw1HnS8vPqwiHLGA,Drama Nook,9Vit6da3g8s,"The rich heir falls for the maid's daughter, against all odds!рҹ«ўвқӨпёҸвҖҚрҹ”Ҙ",2026-05-08,92,1708,52,0
YouTube,й»„жҖқзҗӘ,UCIg97fCjw1HnS8vPqwiHLGA,Drama Nook,yTLCaUuuBSo,"The rich heir falls for the maid's daughter, against all odds!рҹ«ўвқӨпёҸвҖҚрҹ”Ҙ",2026-05-08,97,1504,52,2
YouTube,й»„жҖқзҗӘ,UCIg97fCjw1HnS8vPqwiHLGA,Drama Nook,z2cznie6nkw,"The rich heir falls for the maid's daughter, against all odds!рҹ«ўвқӨпёҸвҖҚрҹ”Ҙ",2026-05-08,76,584,7,0
YouTube,й»„жҖқзҗӘ,UCIg97fCjw1HnS8vPqwiHLGA,Drama Nook,AUJv9Lz00zc,"The rich heir falls for the maid's daughter, against all odds!рҹ«ўвқӨпёҸвҖҚрҹ”Ҙ",2026-05-08,117,3133,82,0
YouTube,й»„жҖқзҗӘ,UCIg97fCjw1HnS8vPqwiHLGA,Drama Nook,j7nYOWqYH4U,"The rich heir falls for the maid's daughter, against all odds!рҹ«ўвқӨпёҸвҖҚрҹ”Ҙ",2026-05-08,114,8589,198,1
YouTube,й»„жҖқзҗӘ,UCIg97fCjw1HnS8vPqwiHLGA,Drama Nook,2CrgHDIK20A,"The rich heir falls for the maid's daughter, against all odds!рҹ«ўвқӨпёҸвҖҚрҹ”Ҙ",2026-05-08,53,1036,22,0
YouTube,й»„жҖқзҗӘ,UCIg97fCjw1HnS8vPqwiHLGA,Drama Nook,8vFAvV23JdI,"The rich heir falls for the maid's daughter, against all odds!рҹ«ўвқӨпёҸвҖҚрҹ”Ҙ",2026-05-08,95,2058,43,0
YouTube,й»„жҖқзҗӘ,UCIg97fCjw1HnS8vPqwiHLGA,Drama Nook,Mwde2OKFEhI,"вҖңHeвҖҷs the young master, IвҖҷm the servantвҖҷs daughter...We were never meant to be.вҖқрҹ’”Tell Me Not to..",2026-04-23,2115,110709,1278,40
YouTube,й»„жҖқзҗӘ,UCIg97fCjw1HnS8vPqwiHLGA,Drama Nook,4Sz8XPfcTBk,"Growing up together, Torn apart by status...Tell Me Not to Love You",2026-04-22,1662,12800,156,5
YouTube,й»„жҖқзҗӘ,UCIg97fCjw1HnS8vPqwiHLGA,Drama Nook,ZVZjVx4Pup8,"""My childhood crush is moving into my room!?""вңЁрҹҳІThe Quarterback Next Door",2026-04-15,1812,96662,760,36
YouTube,й»„жҖқзҗӘ,UCIg97fCjw1HnS8vPqwiHLGA,Drama Nook,6USEvqBqrAQ,"My bullies fell in love with me, and now I have to choose.пјҒрҹҚ·рҹӨ«Taming My Bullies",2026-04-14,2199,128320,1262,25
YouTube,й»„жҖқзҗӘ,UCIg97fCjw1HnS8vPqwiHLGA,Drama Nook,nMOpmlsIvIs,"вҖңI just got divorced, and now a handsome heir is on one knee. Should I say yes?вҖқ  рҹ’Қрҹ”Ҙ",2026-04-13,1878,2459,21,0
