platform,operator,channel_id,channel_name,video_id,video_title,published_date,duration_sec,views,likes,comments
YouTube,еҙ”й“ӯжҙӢ,UCAkSxwl8Lbk2hBXAAfsEFTA,Victor Drama,-vrnPhZO-U8,рҹ”ҘTaming My Bullies: Full Season 1-3 Highlight Clips | #drama #romantic,2026-06-12,6554,6,0,0
YouTube,еҙ”й“ӯжҙӢ,UCAkSxwl8Lbk2hBXAAfsEFTA,Victor Drama,3g0XV3IpNgo,рҹҗәMy Werewolf Boyfriend Spoils Me Rotten to Protect Me and Our Babies... #shorts #movie,2026-06-12,64,16,1,0
YouTube,еҙ”й“ӯжҙӢ,UCAkSxwl8Lbk2hBXAAfsEFTA,Victor Drama,re6LEAbmXTs,рҹ”ҘI Have Triplets! One Night Accident With My Mysterious Wolf Boss...  #shorts #movie,2026-06-12,60,706,20,1
YouTube,еҙ”й“ӯжҙӢ,UCAkSxwl8Lbk2hBXAAfsEFTA,Victor Drama,aji90Gn04E8,"A Spontaneous Kiss Changed My Life, Leading to a Whirlwind CEO Marriage | #drama #romantic",2026-06-11,843,293,2,0
YouTube,еҙ”й“ӯжҙӢ,UCAkSxwl8Lbk2hBXAAfsEFTA,Victor Drama,MO1pWLsKhYw,"IвҖҷm a Weak Human Designer, But IвҖҷm Carrying the AlphaвҖҷs Rare Triplets | #drama #werewolf",2026-06-11,2010,7232,173,11
YouTube,еҙ”й“ӯжҙӢ,UCAkSxwl8Lbk2hBXAAfsEFTA,Victor Drama,o90S0FwNzuQ,"The Cold CEO Lost His Wife, Then Began Courting Her All Over Again | #drama #ceo",2026-06-10,2140,313,8,0
YouTube,еҙ”й“ӯжҙӢ,UCAkSxwl8Lbk2hBXAAfsEFTA,Victor Drama,w_phCcMyv30,My Cold Ex-Husband Hired Me as His Secretary and Started Chasing Me. #shorts #revenge,2026-06-10,82,522,16,2
YouTube,еҙ”й“ӯжҙӢ,UCAkSxwl8Lbk2hBXAAfsEFTA,Victor Drama,jC-DQ4t6mMo,"рҹ’ҸAfter All the Hardships, Will Rowan and I Finally Get a Happy Ending? | #drama #romantic",2026-06-10,1926,313,0,0
YouTube,еҙ”й“ӯжҙӢ,UCAkSxwl8Lbk2hBXAAfsEFTA,Victor Drama,K9O-IMTMfYg,"He Forgot Our Love, So I Brought Back Every Memory for Him... #shorts #romantic",2026-06-10,55,2154,51,0
YouTube,еҙ”й“ӯжҙӢ,UCAkSxwl8Lbk2hBXAAfsEFTA,Victor Drama,MtdYCi6tYBg,I Was Abandoned By My Family Just For a Facial Birthmark? #drama #revenge,2026-06-09,2010,724,14,0
YouTube,еҙ”й“ӯжҙӢ,UCAkSxwl8Lbk2hBXAAfsEFTA,Victor Drama,CbMbB-YnyZg,I Dumped My Fortune-Chasing Cheating Ex and Accidentally Married a Ordinary Nurse | #drama #betrayal,2026-06-09,2875,2783,29,0
YouTube,еҙ”й“ӯжҙӢ,UCAkSxwl8Lbk2hBXAAfsEFTA,Victor Drama,79D2D57W7Ok,"Mute and Misunderstood, I Still Hoped HeвҖҷd Fall for Me Again... #shorts #revenge",2026-06-09,56,4666,87,0
YouTube,еҙ”й“ӯжҙӢ,UCAkSxwl8Lbk2hBXAAfsEFTA,Victor Drama,c5UeHAlE1W0,"рҹҢ№I Dated His Son, But IвҖҷm Irresistibly Drawn to the Mafia Boss Father. | #drama #forbiddenlove",2026-06-09,247,1442,16,4
YouTube,еҙ”й“ӯжҙӢ,UCAkSxwl8Lbk2hBXAAfsEFTA,Victor Drama,KkrBCwVxwDI,"рҹ’’I Married a Nobody to Heal My Broken Heart, HeвҖҷs Actually a Top Tycoon? #shorts #ceo",2026-06-09,79,2266,70,1
YouTube,еҙ”й“ӯжҙӢ,UCAkSxwl8Lbk2hBXAAfsEFTA,Victor Drama,rdumc5xP8Ds,рҹҸ’The Man I Abandoned Is Now the LeagueвҖҷs Hottest Hockey Icon #drama #romantic,2026-06-08,1127,1077,7,0
YouTube,еҙ”й“ӯжҙӢ,UCAkSxwl8Lbk2hBXAAfsEFTA,Victor Drama,VKSx2swFi8Q,"рҹҗәDeathly Afraid of Werewolves, I Had to Marry One to Survive! #shorts #werewolf",2026-06-08,50,2851,52,0
YouTube,еҙ”й“ӯжҙӢ,UCAkSxwl8Lbk2hBXAAfsEFTA,Victor Drama,qnaWqHTDjWU,рҹҢғOne Night Changed Everything вҖ” IвҖҷm Carrying a BillionaireвҖҷs Heir #drama #ceo,2026-06-08,1654,2485,31,0
YouTube,еҙ”й“ӯжҙӢ,UCAkSxwl8Lbk2hBXAAfsEFTA,Victor Drama,sSlTRTXBODo,"I Was Just Checking My Body, Until a Werewolf Burst In and Claimed My Baby? #shorts #werewolf",2026-06-08,41,2994,42,0
YouTube,еҙ”й“ӯжҙӢ,UCAkSxwl8Lbk2hBXAAfsEFTA,Victor Drama,OnbmIb6Mjws,"рҹҗәI Fears Werewolves More Than Anything, Yet IвҖҷm Pregnant With the AlphaвҖҷs Baby. #shorts #werewolf",2026-06-08,95,4363,84,1
YouTube,еҙ”й“ӯжҙӢ,UCAkSxwl8Lbk2hBXAAfsEFTA,Victor Drama,OsIvZoi1c48,"HeвҖҷs the Most Desired Billionaire, But IвҖҷm Fleeing From His Unexpected Baby... #shorts #ceo",2026-06-08,78,2409,63,0
YouTube,еҙ”й“ӯжҙӢ,UCAkSxwl8Lbk2hBXAAfsEFTA,Victor Drama,uw22CfmI0Jg,рҹҸ’My Hot Hockey Boss Has No Idea HeвҖҷs a Father of My Kids? #shorts #hockey,2026-06-08,56,1345,27,0
YouTube,еҙ”й“ӯжҙӢ,UCAkSxwl8Lbk2hBXAAfsEFTA,Victor Drama,vAshLg7oAAA,рҹҗәIвҖҷm Terrified of WerewolvesвҖҰ Now IвҖҷm Carrying an AlphaвҖҷs Baby #drama #werewolf,2026-06-08,1688,3424,78,0
YouTube,еҙ”й“ӯжҙӢ,UCAkSxwl8Lbk2hBXAAfsEFTA,Victor Drama,kn3SztYuSrs,"вҷҝI Loved A Ordinary Guy In A Wheelchair, HeвҖҷs The Hidden Mafia King | #drama #mafia",2026-06-07,1513,1474,20,0
YouTube,еҙ”й“ӯжҙӢ,UCAkSxwl8Lbk2hBXAAfsEFTA,Victor Drama,_1xSrmFWIEY,рҹ’өOne Family Deal Turned Me Into a Coma BillionaireвҖҷs FiancГ©e #drama #romantic,2026-06-06,1742,2450,31,0
YouTube,еҙ”й“ӯжҙӢ,UCAkSxwl8Lbk2hBXAAfsEFTA,Victor Drama,AM9PNsOsqpg,"рҹҢ№I Got Pregnant Through IVF, Then Caught My FiancГ© Cheating With My Best Friend | #drama #mafia",2026-06-06,1399,5220,76,1
YouTube,еҙ”й“ӯжҙӢ,UCAkSxwl8Lbk2hBXAAfsEFTA,Victor Drama,qJtoWTF4wgM,"I Married Him To Save My Mom, But He Believed My Enemy And Destroyed Us | #drama #revenge",2026-06-05,1608,3593,43,7
YouTube,еҙ”й“ӯжҙӢ,UCAkSxwl8Lbk2hBXAAfsEFTA,Victor Drama,YQ-MZm70Fb0,"She Bears the MafiaвҖҷs Only Heir, But Found His Husband Cheating... [Drama Commentary] #drama #movie",2026-06-05,181,106,0,0
YouTube,еҙ”й“ӯжҙӢ,UCAkSxwl8Lbk2hBXAAfsEFTA,Victor Drama,22gPCpj5hc0,рҹҳҡEvery Fake Kiss and Touch Pulled Me Closer to My Secret-Obsessed Boss #drama,2026-06-05,2012,585,5,0
YouTube,еҙ”й“ӯжҙӢ,UCAkSxwl8Lbk2hBXAAfsEFTA,Victor Drama,ziMBW1r8wiI,"She Waited 8 Years for a Vegetative Boyfriend, Who Turned Out to Be the Mafia Don. #shorts #mafia",2026-06-05,172,665,15,1
YouTube,еҙ”й“ӯжҙӢ,UCAkSxwl8Lbk2hBXAAfsEFTA,Victor Drama,GFkGZnKIp9w,"We Faked A Marriage To Get Revenge On My Ex, We Both Faked Our Identities | #drama #ceo",2026-06-04,2029,637,14,0
YouTube,еҙ”й“ӯжҙӢ,UCAkSxwl8Lbk2hBXAAfsEFTA,Victor Drama,-sNleWkz3k8,рҹҗәCursed Werewolf + рҹ§ӣвҖҚSecret Vampire вҖ” Mortal Enemies Turned Fated Mates #drama #werewolf,2026-06-04,1111,697,11,0
YouTube,еҙ”й“ӯжҙӢ,UCAkSxwl8Lbk2hBXAAfsEFTA,Victor Drama,6zx80gQgh_g,"We Faked a Marriage to Get Revenge on My Ex, Then Fell in Love For Real... #shorts #romantic",2026-06-04,87,1045,16,0
YouTube,еҙ”й“ӯжҙӢ,UCAkSxwl8Lbk2hBXAAfsEFTA,Victor Drama,L5RrsnAShv0,I Fought Every Woman After My Love & Crushed My Arrogant In-Laws | #drama #romantic,2026-06-04,1804,1551,11,0
YouTube,еҙ”й“ӯжҙӢ,UCAkSxwl8Lbk2hBXAAfsEFTA,Victor Drama,XZEEBe6PExo,"I Lived With My Two Step Brothers, Until The MaidвҖҷs Daughter Ruined Everything. #shorts #revenge",2026-06-03,112,1284,24,0
YouTube,еҙ”й“ӯжҙӢ,UCAkSxwl8Lbk2hBXAAfsEFTA,Victor Drama,x5q-zZ6N84A,I Betrayed My Mafia KingвҖҰ But IвҖҷm Carrying His Heir! #shorts #mafia,2026-06-03,96,1904,46,2
YouTube,еҙ”й“ӯжҙӢ,UCAkSxwl8Lbk2hBXAAfsEFTA,Victor Drama,vOCfjl2GFBs,"He planned to end his fake marriage, not knowing the nurse was his wife. #drama #englishdrama",2026-06-02,1795,762,12,0
YouTube,еҙ”й“ӯжҙӢ,UCAkSxwl8Lbk2hBXAAfsEFTA,Victor Drama,xKT3XxbxQg4,"They lost each other to misunderstanding, then gained a twisted family bond. | #drama #romantic",2026-06-02,1513,1401,19,0
YouTube,еҙ”й“ӯжҙӢ,UCAkSxwl8Lbk2hBXAAfsEFTA,Victor Drama,YF85nGRyi4s,"Her fiancГ© broke up with her in public, before a homeless man proposed to her. #shorts #romantic",2026-06-02,58,1103,23,0
YouTube,еҙ”й“ӯжҙӢ,UCAkSxwl8Lbk2hBXAAfsEFTA,Victor Drama,m4JqfDhTTSE,She married a homeless man in haste and dressed him in cute pink pajamas. #shorts #romantic,2026-06-02,88,3167,92,2
YouTube,еҙ”й“ӯжҙӢ,UCAkSxwl8Lbk2hBXAAfsEFTA,Victor Drama,7HKWsM-xNpc,"Her ex showed off his wealth arrogantly, until the man shocked him with a Ferrari key.рҹҸҺпёҸ #shorts",2026-06-02,71,1439,33,0
YouTube,еҙ”й“ӯжҙӢ,UCAkSxwl8Lbk2hBXAAfsEFTA,Victor Drama,mmYkW1x-vRI,"She only wanted to help a friend, but caught her professorвҖҷs full attention. #shorts #romantic",2026-06-02,57,2074,25,0
YouTube,еҙ”й“ӯжҙӢ,UCAkSxwl8Lbk2hBXAAfsEFTA,Victor Drama,Tj5l96END0M,рҹҳҚI Was a PastorвҖҷs Perfect Good GirlвҖҰ Until I Fell For a Gang Bad Boy | #drama #mafia,2026-06-01,1768,2759,15,0
YouTube,еҙ”й“ӯжҙӢ,UCAkSxwl8Lbk2hBXAAfsEFTA,Victor Drama,c39YRJhXTX4,I Chose Love Over My Princess DutyвҖҰ Then My Mate Betrayed Me #drama #werewolf,2026-06-01,1424,552,8,0
YouTube,еҙ”й“ӯжҙӢ,UCAkSxwl8Lbk2hBXAAfsEFTA,Victor Drama,9AlzyNtz0p8,"You dumped Noah Preston when he had nothing, but now he's a billionaire! | #drama #ceo",2026-06-01,1233,591,6,0
YouTube,еҙ”й“ӯжҙӢ,UCAkSxwl8Lbk2hBXAAfsEFTA,Victor Drama,e2nhMs0U3NE,"рҹҳҲEvil Fake Sister Tried To Take Me Down, But My Hidden Billionaire Crew Protected Me #drama #revenge",2026-06-01,1923,428,4,0
YouTube,еҙ”й“ӯжҙӢ,UCAkSxwl8Lbk2hBXAAfsEFTA,Victor Drama,JMdGEonJgIU,рҹҗәEveryone Doubted Me After My RejectionвҖҰ Now TheyвҖҷll Regret It! #shorts #werewolf,2026-06-01,60,2212,63,0
YouTube,еҙ”й“ӯжҙӢ,UCAkSxwl8Lbk2hBXAAfsEFTA,Victor Drama,s9GMv36kvBw,I Cheated On My Cheating ExвҖҰ Now IвҖҷm Pregnant With My ProfessorвҖҷs Baby | #drama #romantic,2026-06-01,1503,12997,111,0
YouTube,еҙ”й“ӯжҙӢ,UCAkSxwl8Lbk2hBXAAfsEFTA,Victor Drama,cahzIlcLt5s,"вқӨпёҸвҖҚрҹ©№Forgot him for 7 years, a random night changed my entire life... #drama #ceo",2026-05-31,1519,1337,13,2
YouTube,еҙ”й“ӯжҙӢ,UCAkSxwl8Lbk2hBXAAfsEFTA,Victor Drama,QZw2qfdzM_Q,вқӨпёҸвҖҚрҹ©№Unplanned pregnancy and a suffocating family left this woman trapped in endless despair. #shorts,2026-05-31,112,825,31,0
YouTube,еҙ”й“ӯжҙӢ,UCAkSxwl8Lbk2hBXAAfsEFTA,Victor Drama,MrvGFsrYLiw,"They agreed to be fake lovers, but the boy slowly fell for her for real. #shorts #romantic",2026-05-31,58,1540,43,0
YouTube,еҙ”й“ӯжҙӢ,UCAkSxwl8Lbk2hBXAAfsEFTA,Victor Drama,T53W5BuIyyU,вҸ°Late on her first internship day but her childhood kindness to win the man's understanding. #shorts,2026-05-30,70,5202,122,0
YouTube,еҙ”й“ӯжҙӢ,UCAkSxwl8Lbk2hBXAAfsEFTA,Victor Drama,nZtO-o2EOxg,"вқӨпёҸвҖҚрҹ©№Double betrayal pushed me to wed, my husbandвҖҷs true identity shocked everyone! #shorts #ceo",2026-05-30,55,2063,49,1
YouTube,еҙ”й“ӯжҙӢ,UCAkSxwl8Lbk2hBXAAfsEFTA,Victor Drama,A5Y2z9-TqyE,рҹ‘§Small-town girlвҖҷs nightmare: exвҖҷs betrayal вҶ’ sudden contract marriage #drama #romantic,2026-05-30,1785,1535,20,1
YouTube,еҙ”й“ӯжҙӢ,UCAkSxwl8Lbk2hBXAAfsEFTA,Victor Drama,f60-nphufdg,"The doctor kept arranging night shifts alone with the intern, have a crush on her? #shorts #romantic",2026-05-30,74,2280,60,0
YouTube,еҙ”й“ӯжҙӢ,UCAkSxwl8Lbk2hBXAAfsEFTA,Victor Drama,iEQBdUHN_OQ,"You married a stranger with a promise to divorce, but now he doesn't want to let you go! #shorts",2026-05-30,56,1255,29,0
YouTube,еҙ”й“ӯжҙӢ,UCAkSxwl8Lbk2hBXAAfsEFTA,Victor Drama,9tYzNz_nSOg,"рҹ’”Betrayed by FiancГ© & Sister, I Married a Hidden Billionaire. #drama #romantic",2026-05-30,2438,17282,160,8
YouTube,еҙ”й“ӯжҙӢ,UCAkSxwl8Lbk2hBXAAfsEFTA,Victor Drama,kEvV1ovFT5w,"рҹ”ҘI married a stranger with a promise, but now he doesn't want to let me go! #drama #flashmarriage",2026-05-29,1751,1180,11,0
YouTube,еҙ”й“ӯжҙӢ,UCAkSxwl8Lbk2hBXAAfsEFTA,Victor Drama,gNh_JZTb574,"She just got home, only for her stepmother to tell her she was engaged without her consent. #shorts",2026-05-29,66,1412,19,0
YouTube,еҙ”й“ӯжҙӢ,UCAkSxwl8Lbk2hBXAAfsEFTA,Victor Drama,-qs089ADM4s,"рҹ”ҘI married a stranger, but my boss is my hidden husband. #drama #movie",2026-05-29,1600,1434,9,1
YouTube,еҙ”й“ӯжҙӢ,UCAkSxwl8Lbk2hBXAAfsEFTA,Victor Drama,B_g5aWKcjEo,"We met 7 years ago, now I donвҖҷt even recognize my billionaire lover. #shorts #romantic",2026-05-29,62,1220,18,0
YouTube,еҙ”й“ӯжҙӢ,UCAkSxwl8Lbk2hBXAAfsEFTA,Victor Drama,a5ANHg139p8,"I chased debt for momвҖҷs medical bills, then landed a fake marriage with a tycoon. #shorts #drama",2026-05-29,57,1380,43,2
YouTube,еҙ”й“ӯжҙӢ,UCAkSxwl8Lbk2hBXAAfsEFTA,Victor Drama,NwEYrjhLc2Q,"She mistakenly snuck into a billionaireвҖҷs luxury car, starting a life-changing love story. #shorts",2026-05-29,75,1360,48,0
YouTube,еҙ”й“ӯжҙӢ,UCAkSxwl8Lbk2hBXAAfsEFTA,Victor Drama,vojHCWzVN2w,"рҹҸ’Fake girlfriend, youвҖҷre crossing the line. #drama #romantic",2026-05-28,1781,6023,36,1
YouTube,еҙ”й“ӯжҙӢ,UCAkSxwl8Lbk2hBXAAfsEFTA,Victor Drama,qKPDoqJ23ZU,"рҹҢҷHe rejected his mate for being too weak, yet his wolf warned him of a fatal mistake. #drama #alpha",2026-05-28,1418,586,8,0
YouTube,еҙ”й“ӯжҙӢ,UCAkSxwl8Lbk2hBXAAfsEFTA,Victor Drama,wncGsIrw7t4,She found out her boyfriendвҖҷs hidden truth and unexpectedly met his hot dad. #shorts #movie,2026-05-28,53,2846,49,1
YouTube,еҙ”й“ӯжҙӢ,UCAkSxwl8Lbk2hBXAAfsEFTA,Victor Drama,Hs0UKhDwLds,She told her best friend everything about her secret story with her boyfriendвҖҷs dad. #shorts #movie,2026-05-28,55,1377,39,1
YouTube,еҙ”й“ӯжҙӢ,UCAkSxwl8Lbk2hBXAAfsEFTA,Victor Drama,kKABTIyLnD0,"Determined to wed the gang bossвҖҷs son, she unexpectedly drew his attention. #shorts #mafia",2026-05-28,60,1331,30,1
YouTube,еҙ”й“ӯжҙӢ,UCAkSxwl8Lbk2hBXAAfsEFTA,Victor Drama,KIkh_qxRxgE,"рҹ’ңHeвҖҷs my untouchable boss, and IвҖҷm hopelessly in love. #drama #ceo",2026-05-27,1277,1546,11,0
YouTube,еҙ”й“ӯжҙӢ,UCAkSxwl8Lbk2hBXAAfsEFTA,Victor Drama,RCGg3hv8rBs,The 3-year marriage contract expired. Time to end it all. #drama #romantic,2026-05-27,1973,1326,16,0
YouTube,еҙ”й“ӯжҙӢ,UCAkSxwl8Lbk2hBXAAfsEFTA,Victor Drama,v0b6QAl2m9c,Maid noticed by a handsome boss at dinner. New life ahead? #shorts #movie,2026-05-27,59,4862,84,2
YouTube,еҙ”й“ӯжҙӢ,UCAkSxwl8Lbk2hBXAAfsEFTA,Victor Drama,1qcMMaq3Xv8,"Their contractual marriage lasted three years. Now, itвҖҷs finally time to settle it. #shorts",2026-05-27,73,1542,29,0
YouTube,еҙ”й“ӯжҙӢ,UCAkSxwl8Lbk2hBXAAfsEFTA,Victor Drama,M4uFv-WJOrY,рҹ’–A Single mother is doted on deeply by a wealthy disabled tycoon. #shorts #singlemom,2026-05-26,59,3273,91,2
YouTube,еҙ”й“ӯжҙӢ,UCAkSxwl8Lbk2hBXAAfsEFTA,Victor Drama,HZywDx5CrFw,рҹ‘°Stand-in bride for a comatose billionaireвҖҰ until he wakes up! #drama #romantic,2026-05-26,2174,6639,64,1
YouTube,еҙ”й“ӯжҙӢ,UCAkSxwl8Lbk2hBXAAfsEFTA,Victor Drama,cbNyAseayfs,"рҹ’”Betrayed by her ex, she never thought sheвҖҷd catch the eye of a powerful CEO. #shorts #ceo",2026-05-26,53,2599,58,1
YouTube,еҙ”й“ӯжҙӢ,UCAkSxwl8Lbk2hBXAAfsEFTA,Victor Drama,fuw6Mc-G_AA,"рҹ‘°рҹӨөAfter rescuing the billionaireвҖҷs sibling, we got married in a flash! #drama #flashmarriage",2026-05-26,1432,4879,57,0
YouTube,еҙ”й“ӯжҙӢ,UCAkSxwl8Lbk2hBXAAfsEFTA,Victor Drama,qbRWq3eeeJU,A fake marriage to a comatose billionaire. What fate awaits her when he wakes? #shorts #movie,2026-05-26,60,1272,29,1
YouTube,еҙ”й“ӯжҙӢ,UCAkSxwl8Lbk2hBXAAfsEFTA,Victor Drama,8Upq8J60IKc,My Professor is my secret Lover? What a big mess! #drama #romantic,2026-05-25,1394,803,7,0
YouTube,еҙ”й“ӯжҙӢ,UCAkSxwl8Lbk2hBXAAfsEFTA,Victor Drama,SQeY5mja_6Q,"рҹ’өBought at a high price by the mafia boss, she becomes his contractual lover #drama #mafia",2026-05-25,1543,788,4,1
YouTube,еҙ”й“ӯжҙӢ,UCAkSxwl8Lbk2hBXAAfsEFTA,Victor Drama,0k8egeait4g,No free affection in adulthood. Every relationship is a fair trade.#shorts #flashmarriage,2026-05-25,72,1439,28,0
YouTube,еҙ”й“ӯжҙӢ,UCAkSxwl8Lbk2hBXAAfsEFTA,Victor Drama,xdpiaz_WJ8w,рҹғҸIs he just a magician or does he possess real magic? DonвҖҷt blink! [Full Movie] #magic #drama,2026-05-25,1688,281,3,0
YouTube,еҙ”й“ӯжҙӢ,UCAkSxwl8Lbk2hBXAAfsEFTA,Victor Drama,xRI7fTH_WY4,"She was framed as a thief, leaving everyone stunned when she pulled out a black card. #movie #drama",2026-05-23,3171,1525,17,0
YouTube,еҙ”й“ӯжҙӢ,UCAkSxwl8Lbk2hBXAAfsEFTA,Victor Drama,TmezUZRoHJc,"рҹҗәHumble maid, chosen by the cute Alpha King. #drama #werewolf",2026-05-23,1135,1155,13,1
YouTube,еҙ”й“ӯжҙӢ,UCAkSxwl8Lbk2hBXAAfsEFTA,Victor Drama,YOCTJMFofTg,"She became a private maid, only to find her new boss was her secret school crush! #romantic #drama",2026-05-22,1780,6950,46,1
YouTube,еҙ”й“ӯжҙӢ,UCAkSxwl8Lbk2hBXAAfsEFTA,Victor Drama,QzPHsFOPJBE,рҹҢ№The Mafia King Loves his Son's Fiance? She 's Falling for Her Ex's Mafia Dad! #romantic #mafia,2026-05-22,2385,49771,526,46
YouTube,еҙ”й“ӯжҙӢ,UCAkSxwl8Lbk2hBXAAfsEFTA,Victor Drama,0QYSJZIh4Vc,рҹғҸThe legendary magician makes a comeback! Can his stunning skills win her heart? #shorts #magic,2026-05-22,59,1243,31,0
YouTube,еҙ”й“ӯжҙӢ,UCAkSxwl8Lbk2hBXAAfsEFTA,Victor Drama,r5heDttMcUA,"рҹҗәShe was set up to enter the wrong room, but accidentally won the AlphaвҖҷs heart. #shorts #werewolf",2026-05-22,58,1929,35,0
YouTube,еҙ”й“ӯжҙӢ,UCAkSxwl8Lbk2hBXAAfsEFTA,Victor Drama,ps92EKNYsJI,"Mocked as a delivery girl, she shocked everyone as the top chief scientist.",2026-05-21,379,295,3,0
YouTube,еҙ”й“ӯжҙӢ,UCAkSxwl8Lbk2hBXAAfsEFTA,Victor Drama,nveDFjigL1U,"Shamed for stealing, and she paid with a black card and taught them a lesson. #shorts #movie",2026-05-21,65,1389,14,1
YouTube,еҙ”й“ӯжҙӢ,UCAkSxwl8Lbk2hBXAAfsEFTA,Victor Drama,WqjRtmGdsVY,"He brought his ex and their child home, so she packed her bags and walked away for good. #drama",2026-05-21,382,12700,95,1
YouTube,еҙ”й“ӯжҙӢ,UCAkSxwl8Lbk2hBXAAfsEFTA,Victor Drama,ZJtua8LFabs,"рҹ’”Abandoned post-release, the once business giant slaps everyone in the face with his capability.",2026-05-20,606,821,8,0
YouTube,еҙ”й“ӯжҙӢ,UCAkSxwl8Lbk2hBXAAfsEFTA,Victor Drama,w9WpiveDdUY,"She married the mafia son, but fell for his fatherвҖҰ #shorts #movie",2026-05-20,60,52780,1278,10
YouTube,еҙ”й“ӯжҙӢ,UCAkSxwl8Lbk2hBXAAfsEFTA,Victor Drama,35fjtZ34WC4,The young man fiercely fought the pervert and saved his crush.вқӨ  #romantic #movie,2026-05-20,418,9203,43,3
YouTube,еҙ”й“ӯжҙӢ,UCAkSxwl8Lbk2hBXAAfsEFTA,Victor Drama,AxftgX9dTEo,"She saved a man unexpectedly, and he became her husband the next day. #shorts #movie",2026-05-20,83,1896,45,0
YouTube,еҙ”й“ӯжҙӢ,UCAkSxwl8Lbk2hBXAAfsEFTA,Victor Drama,7yZUeRBB92A,The obedient girl must marry one of the two brothers. Which one will she pick? #shorts #movie,2026-05-20,65,1577,35,1
YouTube,еҙ”й“ӯжҙӢ,UCAkSxwl8Lbk2hBXAAfsEFTA,Victor Drama,ibO38t9lAuM,вңҲHe lost the ticket! The Billionaire was driven out of First Class by flight attendant.,2026-05-20,1692,1389,14,0
YouTube,еҙ”й“ӯжҙӢ,UCAkSxwl8Lbk2hBXAAfsEFTA,Victor Drama,I4qkG1eS_K4,The young man she saved unexpectedly is actually her hospital's boss?,2026-05-19,1984,38597,335,9
YouTube,еҙ”й“ӯжҙӢ,UCAkSxwl8Lbk2hBXAAfsEFTA,Victor Drama,HWGk2H-R7CE,"She must marry one brother: Gentleman or jealous boy, who will she pick?",2026-05-19,1870,11634,119,5
YouTube,еҙ”й“ӯжҙӢ,UCAkSxwl8Lbk2hBXAAfsEFTA,Victor Drama,i8cA6oWxwlU,"She thought he was poor and rude, turned out heвҖҷs untouchable. #shorts #movie",2026-05-19,80,1998,35,2
YouTube,еҙ”й“ӯжҙӢ,UCAkSxwl8Lbk2hBXAAfsEFTA,Victor Drama,p1wyGGJ0ti4,"He poses as a top chefвҖҷs pupil before the real master, will he get proven wrong? #shorts #movie",2026-05-19,99,4782,87,1
YouTube,еҙ”й“ӯжҙӢ,UCAkSxwl8Lbk2hBXAAfsEFTA,Victor Drama,QzfpKClcxL0,"The former king of chefs is despised by others, and someone even pretends to be his disciple?",2026-05-19,2269,4286,20,0
YouTube,еҙ”й“ӯжҙӢ,UCAkSxwl8Lbk2hBXAAfsEFTA,Victor Drama,rBdUXsCCvtc,вқӨShe loves him deeply though he is the notorious bad boy #drama #romantic,2026-05-18,1978,8262,55,1
YouTube,еҙ”й“ӯжҙӢ,UCAkSxwl8Lbk2hBXAAfsEFTA,Victor Drama,UFvYBAVB9P4,рҹҢ§From Rainy Humiliation To Billionaire Wife: Her Secret Life Begins! #shorts #drama #reelshort,2026-05-18,127,440,2,0
YouTube,еҙ”й“ӯжҙӢ,UCAkSxwl8Lbk2hBXAAfsEFTA,Victor Drama,o1ZyRHmXbVg,"рҹ”ҘSingle mom rises strong, finding love with a wealthy billionaire on wheelchair? #drama #movie",2026-05-18,1672,30931,374,13
YouTube,еҙ”й“ӯжҙӢ,UCctSzoeee7KCnR84dZ6IO7w,Maple Playhouse,qe-hbtUfzXk,"рҹ’”Betrayed by My Family, I Fought Tooth and Nail for My Little Girl! #drama #revenge",2026-06-12,1695,3,0,0
YouTube,еҙ”й“ӯжҙӢ,UCctSzoeee7KCnR84dZ6IO7w,Maple Playhouse,NRMiA9y2SDU,Horrifying Forbidden Truth: HeвҖҷs My Best FriendвҖҷs Father! #shorts #forbidden,2026-06-12,67,1,0,0
YouTube,еҙ”й“ӯжҙӢ,UCctSzoeee7KCnR84dZ6IO7w,Maple Playhouse,KE7XzJghL0E,A Fateful Mistake With a Handsome Stranger Changes Everything... #shorts #romantic,2026-06-12,98,14,0,0
YouTube,еҙ”й“ӯжҙӢ,UCctSzoeee7KCnR84dZ6IO7w,Maple Playhouse,LAH1isQrOQE,I Married a Mysterious CEO to Regain My Lost Dignity. #shorts #ceo,2026-06-12,55,50,5,0
YouTube,еҙ”й“ӯжҙӢ,UCctSzoeee7KCnR84dZ6IO7w,Maple Playhouse,h1ebJ0y_t8g,The Bad Boy Decides to Teach Me How to Be Charming. #shorts #romantic,2026-06-12,70,56,5,0
YouTube,еҙ”й“ӯжҙӢ,UCctSzoeee7KCnR84dZ6IO7w,Maple Playhouse,D-n1dYhrjSQ,Can I Protect My Wife and Destroy My StepfamilyвҖҷs Dark Empire? #drama #revenge,2026-06-11,2026,96,0,0
YouTube,еҙ”й“ӯжҙӢ,UCctSzoeee7KCnR84dZ6IO7w,Maple Playhouse,Urno_WFA83I,"My Groom Abandoned Me On My Wedding Day, So I Married My Mysterious Bodyguard #drama #revenge",2026-06-11,1538,240,1,0
YouTube,еҙ”й“ӯжҙӢ,UCctSzoeee7KCnR84dZ6IO7w,Maple Playhouse,IdIARIOmev8,рҹ’ҚA Mysterious Ring Gave Me Five Superpowers When I Had Nothing Left #drama #magic,2026-06-10,1519,119,1,0
YouTube,еҙ”й“ӯжҙӢ,UCctSzoeee7KCnR84dZ6IO7w,Maple Playhouse,UxiHt_rRXVg,I Married a Handsome Billionaire on a Rebound вҖ” HeвҖҷs My ExвҖҷs Father #drama #romantic,2026-06-10,1416,418,6,0
YouTube,еҙ”й“ӯжҙӢ,UCctSzoeee7KCnR84dZ6IO7w,Maple Playhouse,uGr3ymFwwbw,No One Can See Me Anymore вҖ” I Use My Invisibility Ring to Rewrite My Life! #shorts #revenge,2026-06-10,96,1409,30,0
YouTube,еҙ”й“ӯжҙӢ,UCctSzoeee7KCnR84dZ6IO7w,Maple Playhouse,DjiARVtJjNU,"I Escaped My Toxic Ex, Only to Catch His Billionaire FatherвҖҷs Heart. #shorts #romantic",2026-06-10,46,2164,56,1
YouTube,еҙ”й“ӯжҙӢ,UCctSzoeee7KCnR84dZ6IO7w,Maple Playhouse,EDtWJ5rCM-E,рҹ’”I Faked an Affair to Push My FiancГ© Away While Fighting Cancer and a Secret Pregnancy #drama,2026-06-09,1759,296,5,1
YouTube,еҙ”й“ӯжҙӢ,UCctSzoeee7KCnR84dZ6IO7w,Maple Playhouse,oSVO3jyS3Lc,Billionaire Levi Walked Into My Chaotic Life and Protected Me From All Harm. #shorts #ceo,2026-06-09,53,1533,29,0
YouTube,еҙ”й“ӯжҙӢ,UCctSzoeee7KCnR84dZ6IO7w,Maple Playhouse,o8oEtSv55MQ,вҷҝA Broken Single MomвҖҷs Tough Life Changed When a Billionaire Stepped In #drama #romantic,2026-06-09,1672,434,4,0
YouTube,еҙ”й“ӯжҙӢ,UCctSzoeee7KCnR84dZ6IO7w,Maple Playhouse,9238FDX2NDQ,"HeвҖҷs Been Chasing His Fate, Never Knowing ItвҖҷs the Amnesiac Girl He Saved. #shorts #revenge",2026-06-09,55,3135,58,0
YouTube,еҙ”й“ӯжҙӢ,UCctSzoeee7KCnR84dZ6IO7w,Maple Playhouse,MguMD4ndQ7Y,"Lost My Fortune, Fought Cancer, And Hid My Baby to Protect Him. #shorts #romantic",2026-06-09,63,12365,291,1
YouTube,еҙ”й“ӯжҙӢ,UCctSzoeee7KCnR84dZ6IO7w,Maple Playhouse,8NJMqXhltrg,"рҹ§‘вҖҚрҹҚіTo Save the Restaurant That Took Me In, I Unleashed My Hidden Chef Skills #drama #cooking",2026-06-08,2264,203,3,0
YouTube,еҙ”й“ӯжҙӢ,UCctSzoeee7KCnR84dZ6IO7w,Maple Playhouse,0yzKd8Eq18o,рҹҺҫShould I Stay With My Cheating Ex Or Reclaim My Lost Tennis Glory? #drama #tennis,2026-06-08,1878,401,6,1
YouTube,еҙ”й“ӯжҙӢ,UCctSzoeee7KCnR84dZ6IO7w,Maple Playhouse,aCMAo2c13Jg,"My ex abandoned me ruthlessly, but my street husband spoiled me endlessly... #shorts #mafia",2026-06-08,43,1676,35,0
YouTube,еҙ”й“ӯжҙӢ,UCctSzoeee7KCnR84dZ6IO7w,Maple Playhouse,yL596YDSP_o,"Betrayed By My Champion Lover, IвҖҷm Ready For My Epic Tennis Comeback! #shorts #revenge",2026-06-08,97,1011,27,0
YouTube,еҙ”й“ӯжҙӢ,UCctSzoeee7KCnR84dZ6IO7w,Maple Playhouse,gKpA8BWGsmw,"I Sacrificed My Tennis Career For Him, But He Betrayed Me For Fame. #shorts #revenge",2026-06-08,70,1162,22,0
YouTube,еҙ”й“ӯжҙӢ,UCctSzoeee7KCnR84dZ6IO7w,Maple Playhouse,zWvMMHsHt3E,The Boyfriend I Made a Grand Slam Champion Cheated Behind My Back. #shorts #revenge,2026-06-08,74,1229,22,0
YouTube,еҙ”й“ӯжҙӢ,UCctSzoeee7KCnR84dZ6IO7w,Maple Playhouse,kUaDylqw_mc,"I Sacrificed My Glory For Him, But Fame Turned Him Cruel And Ungrateful. #shorts #drama",2026-06-08,61,1541,29,0
YouTube,еҙ”й“ӯжҙӢ,UCctSzoeee7KCnR84dZ6IO7w,Maple Playhouse,JUdCt7Yk4-4,I Quit My Tennis Star Career To Build My BoyfriendвҖҷs Dream... #shorts #tennis,2026-06-08,66,2736,20,2
YouTube,еҙ”й“ӯжҙӢ,UCctSzoeee7KCnR84dZ6IO7w,Maple Playhouse,lcQs5L5E1MU,рҹ§‘вҖҚрҹҚіThe King of Cooking Lost Everything After His WifeвҖҷs Tragic Death. #shorts #cooking,2026-06-08,114,1840,38,2
YouTube,еҙ”й“ӯжҙӢ,UCctSzoeee7KCnR84dZ6IO7w,Maple Playhouse,2f01ytPYptw,"рҹ’ҸSaved a Fugitive Stranger With a Kiss, Then Flash-Married Him #drama #mafia",2026-06-08,2020,536,5,0
