platform,operator,channel_id,channel_name,video_id,video_title,published_date,duration_sec,views,likes,comments
Dailymotion,йҮ‘иҗҚ,x3tgrnq,ReelShort Drama Shorts,x9v0mkm,American Snlp3r: The Last Round рҹ’Ә- Full HD SeriesрҹҢҹNO CUT,2025-12-04,4779,4007,0,0
Dailymotion,йҮ‘иҗҚ,x3tgrnq,ReelShort Drama Shorts,x9uxwag,Taming My Bullies -Full Series| EP 1-82| No Cuts,2025-12-03,5152,32514,19,0
Dailymotion,йҮ‘иҗҚ,x3tgrnq,ReelShort Drama Shorts,x9uty9y,Seducing Mr. Larsen вҖ“ Full HD Episodes(Completed),2025-12-02,5345,6996,0,0
Dailymotion,йҮ‘иҗҚ,x3tgrnq,ReelShort Drama Shorts,x9urb6a,I Hate to Love My British Bad Boy (2025)вҖ“ FULL&DETAILED VERSION,2025-12-01,5472,5006,6,0
Dailymotion,йҮ‘иҗҚ,x3tgrnq,ReelShort Drama Shorts,x9ulazm,Once Upon A Breakup - Full Series Now!!вӯҗгҖҗLoveTriangleгҖ‘,2025-11-28,5932,30040,1,0
Dailymotion,йҮ‘иҗҚ,x3tgrnq,ReelShort Drama Shorts,x9uiu7y,The Price of Loving You вҖ“ Full Series Now !! рҹ”®гҖҗSupernaturalгҖ‘,2025-11-27,5621,18868,4,0
Dailymotion,йҮ‘иҗҚ,x3tgrnq,ReelShort Drama Shorts,x9ugocs,How to Land a Movie Star- рҹҢ FULL&DETAILED VERSION(EP1-61),2025-11-26,5469,772,0,0
Dailymotion,йҮ‘иҗҚ,x3tgrnq,ReelShort Drama Shorts,x9udvk0,My Stepbrother's Dirty Secret(2025) -рҹҺҮFull EpisodesвңҙпёҸNo Cut,2025-11-25,5693,12476,6,0
Dailymotion,йҮ‘иҗҚ,x3tgrnq,ReelShort Drama Shorts,x9ubj0u,рҹҚҸOperation Christmas Trap вҖ“рҹҺ„Full Series No Cut рҹ””,2025-11-24,5395,18408,7,0
Dailymotion,йҮ‘иҗҚ,x3tgrnq,ReelShort Drama Shorts,x9u63n8,рҹ’ӢBound by Honor - рҹ”ҘFull Movie гҖҗDangerous RelationshipгҖ‘,2025-11-21,4913,1323,0,0
Dailymotion,йҮ‘иҗҚ,x3tgrnq,ReelShort Drama Shorts,x9u1urm,вңЁ Callsign: Legacy- рҹ’« ReelShort_Drama_Full_Episodes рҹҺ¬,2025-11-19,5526,1608,0,0
Dailymotion,йҮ‘иҗҚ,x3tgrnq,ReelShort Drama Shorts,x9tzmaw,Bound to the Rebel Wolf(2025)-FULL&DETAILED VERSION,2025-11-18,4827,37609,1,0
Dailymotion,йҮ‘иҗҚ,x3tgrnq,ReelShort Drama Shorts,x9tx7yq,The Ghost of You and I Reelshort_Full_Movie_No_Cut,2025-11-17,5174,212,1,0
Dailymotion,йҮ‘иҗҚ,x3tgrnq,ReelShort Drama Shorts,x9trymo,рҹ’–рҹ”ҘSweet Wild Bride of Mine -Full Movie [English Sub],2025-11-14,4789,11079,0,0
Dailymotion,йҮ‘иҗҚ,x3tgrnq,ReelShort Drama Shorts,x9tkn9o,It's Time!!! - The Christmas Switch Full Episodes,2025-11-11,4735,1050,1,0
Dailymotion,йҮ‘иҗҚ,x3tgrnq,ReelShort Drama Shorts,x9swn68,вқӨпёҸвҖҚрҹ”Ҙрҹ’ҳ Tell Me Not to Love You - No Cut,2025-10-30,5908,61117,10,0
Dailymotion,йҮ‘иҗҚ,x3tgrnq,ReelShort Drama Shorts,x9sukrw,Full Series Now! - We're Your Parents гҖҗNo CutsгҖ‘,2025-10-29,3681,2357,0,0
Dailymotion,йҮ‘иҗҚ,x3tgrnq,ReelShort Drama Shorts,x9ssgx4,вқ„пёҸрҹҺ„рҹ’һSomeone Loved is Never Lost Full Movie,2025-10-28,5152,153,1,0
Dailymotion,йҮ‘иҗҚ,x3tgrnq,ReelShort Drama Shorts,x9sqa48,[вқӨпёҸвҖҚрҹ”Ҙрҹ”Ҙ2025]- You Fired The Backbone of Detroit Full Movie,2025-10-27,4821,273,0,0
Dailymotion,йҮ‘иҗҚ,x3tgrnq,ReelShort Drama Shorts,x9sdp56,New! How I Made the Alpha Mine Movie Full Episodes,2025-10-20,5547,433,1,0
Dailymotion,е°ҸзҸҠ,x4c7r9u,love-shortdrama,x9xxfho,Wrong Full Episodes-ReelShort,2026-01-17,3907,84,0,0
Dailymotion,е°ҸзҸҠ,x4c7r9u,love-shortdrama,x9xb3dk,The Words_V3,2026-01-08,4279,5,0,0
Dailymotion,е°ҸзҸҠ,x4c7ro4,babygirllovesshortdrama,x9xxjso,Wrong ReelShort Full Episodes,2026-01-17,3907,65,0,0
Dailymotion,е°ҸзҸҠ,x4c7ro4,babygirllovesshortdrama,x9xbano,The Words free episodes-ReelShort-Autumn Noel,2026-01-08,4284,0,0,0
Dailymotion,е°ҸзҸҠ,x4c7sre,dailyshortdrama,x9xxc5c,Wrong Full Episodes ReelShort,2026-01-16,3907,31,0,0
Dailymotion,е°ҸзҸҠ,x4c7sre,dailyshortdrama,x9xbai8,The Words free episodes-ReelShort,2026-01-08,4284,1,0,0
Dailymotion,йҮ‘иҗҚ,x4g6uv8,ReelShort Story Shorts,xaecm2y,"Reborn Villainess Healing Hearts, Breaking Walls | HD, NO CUT",2026-06-10,5308,3,0,0
Dailymotion,йҮ‘иҗҚ,x4g6uv8,ReelShort Story Shorts,xaecj8i,"Broken by My Twin Alphas | HD, NO CUT",2026-06-10,5501,6,0,0
Dailymotion,йҮ‘иҗҚ,x4g6uv8,ReelShort Story Shorts,xaecgym,"They Called Me Worthless Until My Cards Destroyed | HD, NO CUT",2026-06-10,5395,3,0,0
Dailymotion,йҮ‘иҗҚ,x4g6uv8,ReelShort Story Shorts,xaeaf4a,Owned by the Bad Boy Athlete | FREE Movie,2026-06-10,5071,11,0,0
Dailymotion,йҮ‘иҗҚ,x4g6uv8,ReelShort Story Shorts,xae5ut6,"The Extraordinary Mother of a Billionaire | HD, NO CUT",2026-06-09,5354,3,0,0
Dailymotion,йҮ‘иҗҚ,x4g6uv8,ReelShort Story Shorts,xae46pu,"The Fake Debutante and the True Billionaire | HD, NO CUT",2026-06-09,5113,22,0,0
Dailymotion,йҮ‘иҗҚ,x4g6uv8,ReelShort Story Shorts,xae3ybm,"Breaking My Bodyguard Dailymotion Movie | HD, NO CUT",2026-06-09,5113,27,0,0
Dailymotion,йҮ‘иҗҚ,x4g6uv8,ReelShort Story Shorts,xae33a2,"Alpha's Regret After His Pregnant Luna's Death Dailymotion Movie | HD, NO CUT",2026-06-09,4586,7,0,0
Dailymotion,йҮ‘иҗҚ,x4g6uv8,ReelShort Story Shorts,xadxnii,"Rejected Luna Is the Alpha Queen Dailymotion Movieрҹ‘ё | HD, NO CUT",2026-06-08,4767,525,0,0
Dailymotion,йҮ‘иҗҚ,x4g6uv8,ReelShort Story Shorts,xade0pm,"Luna Reborn Alpha's Second Chance Dailymotion Movie | HD, NO CUT",2026-06-05,4583,7,0,0
Dailymotion,йҮ‘иҗҚ,x4g6uv8,ReelShort Story Shorts,xada32e,When Love Departed | Losing Her Was His Greatest Punishment,2026-06-05,3074,4,0,0
Dailymotion,йҮ‘иҗҚ,x4g6uv8,ReelShort Story Shorts,xad5kyo,"Double Life of a Cell Block King Dailymotion MovieрҹӨҙ | HD, NO CUT",2026-06-04,4521,625,0,0
Dailymotion,йҮ‘иҗҚ,x4g6uv8,ReelShort Story Shorts,xad5iq0,"My Alpha Boss Gave Me Triplets Dailymotion Movie | HD, NO CUT",2026-06-04,4500,606,0,0
Dailymotion,йҮ‘иҗҚ,x4g6uv8,ReelShort Story Shorts,xad5d2u,"Alpha Daddy Make Me Yours Dailymotion Movieрҹ’– |HD, NO CUT",2026-06-04,4460,6,0,0
Dailymotion,йҮ‘иҗҚ,x4g6uv8,ReelShort Story Shorts,xacwqf2,I Accidentally Sexted My Enemy вңЁ HD Romance Comedy | English Subtitles,2026-06-03,5082,14,0,0
Dailymotion,йҮ‘иҗҚ,x4g6uv8,ReelShort Story Shorts,xacwpau,"Your Love Broke My Heartрҹ’” | Eng Sub, HD Movie #ReelShort #Dailymotion",2026-06-03,4042,2,0,0
Dailymotion,йҮ‘иҗҚ,x4g6uv8,ReelShort Story Shorts,xacwn9k,Taming My Bullies 3 Daylimotion Movieрҹ’Һ HD Quality | English Subtitles,2026-06-03,4785,2,0,0
Dailymotion,йҮ‘иҗҚ,x4g6uv8,ReelShort Story Shorts,xacwgxm,"Campus Saga Superpower Teen рҹ‘Ҡ Bullied Today, Powerful Tomorrow | Eng Sub HD Movie",2026-06-03,5149,2,0,0
Dailymotion,йҮ‘иҗҚ,x4g6uv8,ReelShort Story Shorts,xacs8w0,Dark Notes рҹ’– Eng Sub | HD Romance Drama #ReelShort,2026-06-02,3713,23,0,0
Dailymotion,йҮ‘иҗҚ,x4g6uv8,ReelShort Story Shorts,xacs5jo,The Imperfect Marriage рҹ’Һ Eng Sub HD Movie | 2026,2026-06-02,4784,23,0,0
Dailymotion,йҮ‘иҗҚ,x4g6uv8,ReelShort Story Shorts,xacrzxw,Stableboy рҹҢ№ Love Doesn't Care About Social Status | HD Movie [Eng Sub],2026-06-02,5287,2,0,0
Dailymotion,йҮ‘иҗҚ,x4g6uv8,ReelShort Story Shorts,xacirnc,"Don't Blink, You'll Miss It рҹҺ¬| ReelShort Free Movie[HD]",2026-06-01,4088,4,0,0
Dailymotion,йҮ‘иҗҚ,x4g6uv8,ReelShort Story Shorts,xacimzi,Alpha Queen Rising Dailymotion Movie[Eng Sub]рҹҗә#ReelShort,2026-06-01,4550,3,0,0
Dailymotion,йҮ‘иҗҚ,x4g6uv8,ReelShort Story Shorts,xa5nc8k,The Photo That Changed Everything | Griffin's Hidden Struggle,2026-04-16,4604,43,0,0
Dailymotion,йҮ‘иҗҚ,x4g6uv8,ReelShort Story Shorts,xa3bh16,My Stepbrother's Dirty Secret Movie - Forbidden Love,2026-03-26,1464,351,0,0
Dailymotion,йҮ‘иҗҚ,x4g735i,ReelShort Movie Shorts,xaewsja,Rejecting the Five Alphas Dailymotion Movie | Eng Sub #ReelShort,2026-06-12,4855,8,0,0
Dailymotion,йҮ‘иҗҚ,x4g735i,ReelShort Movie Shorts,xaewop6,I Accidentally Sexted My Enemy | Eng Sub #ReelShort,2026-06-12,5082,38150,5,0
Dailymotion,йҮ‘иҗҚ,x4g735i,ReelShort Movie Shorts,xaewlja,The Extraordinary Mother of a Billionaire | Everyone Mocked Her Until a Billionaire Called Her вҖңMomвҖқ рҹҳұ | Eng Sub,2026-06-12,5354,2,0,0
Dailymotion,йҮ‘иҗҚ,x4g735i,ReelShort Movie Shorts,xaekbh6,Caged by His Twisted Love Dailymotion MovieвқӨпёҸвҖҚ | Eng Sub #ReelShort,2026-06-11,5589,12,0,0
Dailymotion,йҮ‘иҗҚ,x4g735i,ReelShort Movie Shorts,xaej0qq,Rose in Chains Dailymotion MovieрҹҢ№ | Eng Sub #ReelShort,2026-06-11,4947,250,0,0
Dailymotion,йҮ‘иҗҚ,x4g735i,ReelShort Movie Shorts,xaeixxi,The Hockey Captain That Hates Me Dailymotion Movie | Eng Sub #ReelShort,2026-06-11,5019,13,0,0
Dailymotion,йҮ‘иҗҚ,x4g735i,ReelShort Movie Shorts,xaeiv8i,Wterboy Second Down Dailymotion Movieрҹ‘¬ | Eng Sub #ReelShort,2026-06-11,5662,9,0,0
Dailymotion,йҮ‘иҗҚ,x4g735i,ReelShort Movie Shorts,xaecm2u,"Reborn Villainess: Healing Hearts, Breaking Walls | Eng Sub #ReelShort",2026-06-10,5308,14,0,0
Dailymotion,йҮ‘иҗҚ,x4g735i,ReelShort Movie Shorts,xaecj8u,They Called Me Worthless Until My Cards Destroyed | Eng Sub #ReelShort,2026-06-10,5395,1,0,0
Dailymotion,йҮ‘иҗҚ,x4g735i,ReelShort Movie Shorts,xaecgxy,Broken by My Twin Alphas | Eng Sub #ReelShort,2026-06-10,5501,15,1,0
Dailymotion,йҮ‘иҗҚ,x4g735i,ReelShort Movie Shorts,xaeanvq,Owned by the Bad Boy Athlete | Eng Sub #ReelShort,2026-06-10,5071,25,0,0
Dailymotion,йҮ‘иҗҚ,x4g735i,ReelShort Movie Shorts,xae5uti,The Extraordinary Mother of a Billionaire | Eng Sub #ReelShort,2026-06-09,5354,4,0,0
Dailymotion,йҮ‘иҗҚ,x4g735i,ReelShort Movie Shorts,xae5pja,My Fated Deal with the Alpha King | Eng Sub #ReelShort,2026-06-09,5171,93,1,0
Dailymotion,йҮ‘иҗҚ,x4g735i,ReelShort Movie Shorts,xae4akq,The Fake Debutante and the True Billionaire | Eng Sub #ReelShort,2026-06-09,5113,7,0,0
Dailymotion,йҮ‘иҗҚ,x4g735i,ReelShort Movie Shorts,xae3yca,Breaking My Bodyguard Dailymotion Movie | Eng Sub #ReelShort,2026-06-09,5113,846,0,0
Dailymotion,йҮ‘иҗҚ,x4g735i,ReelShort Movie Shorts,xae31fm,Alpha's Regret After His Pregnant Luna's Death Dailymotion Movie | Eng Sub #ReelShort,2026-06-09,4586,9,0,0
Dailymotion,йҮ‘иҗҚ,x4g735i,ReelShort Movie Shorts,xadxpfa,Rejected Luna Is the Alpha Queen Dailymotion Movieрҹ‘‘ | Eng Sub #ReelShort,2026-06-08,4767,677,0,0
Dailymotion,йҮ‘иҗҚ,x4g735i,ReelShort Movie Shorts,xade0pe,Luna Reborn Alpha's Second Chance Dailymotion Movie рҹҗә | Eng Sub #ReelShort,2026-06-05,4583,32,1,0
Dailymotion,йҮ‘иҗҚ,x4g735i,ReelShort Movie Shorts,xadclly,Double Life of a Cell Block King Dailymotion Movie | Eng Sub #ReelShort,2026-06-05,4521,8,0,0
Dailymotion,йҮ‘иҗҚ,x4g735i,ReelShort Movie Shorts,xad5f7k,When Love Departed | She Walked Away and Never Looked BackрҹҳҺ,2026-06-04,3074,7,0,0
Dailymotion,йҮ‘иҗҚ,x4g735i,ReelShort Movie Shorts,xacwsyw,"Your Love Broke My Heartрҹ’” | Eng Sub, HD Movie #ReelShort #Dailymotion",2026-06-03,4042,4765,2,0
Dailymotion,йҮ‘иҗҚ,x4g735i,ReelShort Movie Shorts,xacwqew,I Accidentally Sexted My Enemy рҹ’• From Enemies to Something More | HD Movie,2026-06-03,5082,87,0,0
Dailymotion,йҮ‘иҗҚ,x4g735i,ReelShort Movie Shorts,xacwn9o,Taming My Bullies 3 рҹ’• Official HD Movie | Eng Sub #ReelShort,2026-06-03,4785,7,0,0
Dailymotion,йҮ‘иҗҚ,x4g735i,ReelShort Movie Shorts,xacwkqe,"Campus Saga Superpower Teen HD Movie |Eng Sub, 2026 #ReelShortвҡҪ",2026-06-03,5149,3,0,0
Dailymotion,йҮ‘иҗҚ,x4g735i,ReelShort Movie Shorts,xacsao0,"The Imperfect Marriage Dailymotion Movie| Eng Sub, Hotрҹ’–",2026-06-02,4784,31,0,0
Dailymotion,йҮ‘иҗҚ,x4g735i,ReelShort Movie Shorts,xacs8w2,"Dark Notes рҹҺө | Eng Sub, HD Movie, 2026 #ReelShort",2026-06-02,3713,12,0,0
Dailymotion,йҮ‘иҗҚ,x4g735i,ReelShort Movie Shorts,xacrzu4,"Stableboy HD Movie |Eng Sub, Watch Hot Love on ReelShort! вқӨпёҸвҖҚрҹ”Ҙ",2026-06-02,5287,162,0,0
Dailymotion,йҮ‘иҗҚ,x4g735i,ReelShort Movie Shorts,xacimzm,Alpha Queen Rising Dailymotion Movie[Eng Sub]рҹҗә#ReelShort,2026-06-01,4550,6,0,0
Dailymotion,йҮ‘иҗҚ,x4g735i,ReelShort Movie Shorts,xacidty,"Don't Blink, You'll Miss It рҹҺ¬| ReelShort HD Movie[Eng Sub]",2026-06-01,4088,3,0,0
Dailymotion,йҮ‘иҗҚ,x4g735i,ReelShort Movie Shorts,xabmrok,Djinn Under Contract Full Movie [Hot 2026]рҹ”Ҙ,2026-05-29,4058,14,0,0
Dailymotion,йҮ‘иҗҚ,x4g735i,ReelShort Movie Shorts,xabpnvc,Carter Reed рҹ”Ҙ | The Ruthless King Everyone Fears [ENG SUB] #ReelShort,2026-05-29,3830,19,0,0
Dailymotion,йҮ‘иҗҚ,x4g735i,ReelShort Movie Shorts,xabmoda,When Forever Fell Apart  | 2026 Hot Movieрҹ”Ҙ,2026-05-29,4823,6,0,0
Dailymotion,йҮ‘иҗҚ,x4g735i,ReelShort Movie Shorts,xabhyso,My Boss Loves Me Too Much [Hot 2026]рҹ”Ҙ,2026-05-28,3853,12,0,0
Dailymotion,йҮ‘иҗҚ,x4g735i,ReelShort Movie Shorts,xa66d8y,"She's Not Homeless, She's Healer Goddess | Who's Winning the Hero's Heart? рҹ’–",2026-04-21,3542,9,0,0
Dailymotion,йҮ‘иҗҚ,x4g735i,ReelShort Movie Shorts,xa62fvw,Married The Mafioso I Saved | Secrets of the Underworld рҹҳҺ,2026-04-20,4724,759,0,0
Dailymotion,йҮ‘иҗҚ,x4g735i,ReelShort Movie Shorts,xa5q7y8,Hating and Loving My Adopted Brother | A Family's Unexpected Bond,2026-04-17,3469,16,0,0
Dailymotion,йҮ‘иҗҚ,x4g735i,ReelShort Movie Shorts,xa52mls,Corrupting My Billionaire Boss's Heart[Hot 2026] | Forbidden Love at First Sight рҹҳҸрҹ”Ҙ,2026-04-10,4608,696,1,0
Dailymotion,йҮ‘иҗҚ,x4g735i,ReelShort Movie Shorts,xa2lno4,вңЁрҹҺ¶ Breathe | Can Their Love Survive the Spotlight?-гҖҗHD MovieгҖ‘,2026-03-19,5172,74,0,0
Dailymotion,йҮ‘иҗҚ,x4g735i,ReelShort Movie Shorts,xa2lefg,The Cooking Queen: A Recipe for Divorce | From Heartbreak to Culinary Queen Again,2026-03-19,5454,499,1,0
Dailymotion,йҮ‘иҗҚ,x4g735i,ReelShort Movie Shorts,x9z1sms,Fix You HD Movie - ReelShort Sweet Romanceрҹ’•[English Sub],2026-02-02,5291,36,0,0
Dailymotion,д№”иүі,x4kmjg6,Daily Reelshort,xa0s530,рҹҡҖрҹ§‘вҖҚрҹҡҖTheir Brother Lost in Space | Free Episode ENG SUB,2026-02-26,5400,20,0,0
Dailymotion,д№”иүі,x4kmjg6,Daily Reelshort,xa0s3nw,рҹ’–When Love's Sorrow Plays Again | Bitter Sweet [ENG SUB] Free Episode,2026-02-26,4352,28,0,0
Dailymotion,д№”иүі,x4kmjg6,Daily Reelshort,xa0s1d0,вқӨпёҸSecrets and SoulmatesвқӨпёҸFated Lovers [ENG SUB] Free Episode,2026-02-26,4144,15,0,0
Dailymotion,д№”иүі,x4kmjg6,Daily Reelshort,xa0pnq0,рҹ’өThe Billionaire and the Baby TrapрҹӨ—ENG SUB Free Episode,2026-02-25,4309,71,0,0
Dailymotion,д№”иүі,x4kmjg6,Daily Reelshort,xa0pkfm,рҹҘ°Backstage Romance with the PopstarрҹҘ° - ENG SUB Free Episode,2026-02-25,3894,9,0,0
Dailymotion,д№”иүі,x4kmjg6,Daily Reelshort,xa0nipo,рҹ’•Find Your Way Back to Me My Childhood Sweetheart [ENG SUB] HD Free Episodes,2026-02-24,5361,1103,2,0
Dailymotion,д№”иүі,x4k7s0s,ReelShort_GlancePlay,xa0me5o,рҹҺ¬вңЁPuck Me Baby One More Time [ENG SUB] рҹ’•,2026-02-24,4812,6,0,0
Dailymotion,д№”иүі,x4k7s0s,ReelShort_GlancePlay,xa0mh0s,рҹҢёрҹ‘‘ My Sister Is the Warlord Queen [ENG SUB] #reelshort HD Free Episodes No Cut,2026-02-24,6892,52,0,0
Dailymotion,д№”иүі,x4klm7q,ReelShort Romance Shows,xafl8o6,рҹ’«рҹ’«The Prank That Broke Us Dailymotion Video- Eleanor Vance High school star student #reelshort,2026-06-14,3452,0,0,0
Dailymotion,д№”иүі,x4klm7q,ReelShort Romance Shows,xaf7tcu,ENG SUBрҹ–ӨRejecting the Five Alphas Dailymotion Video - Elara A She-wolf with miraculous healing blood,2026-06-13,3218,5,0,0
Dailymotion,д№”иүі,x4klm7q,ReelShort Romance Shows,xaf7rte,рҹ’ҷDon't Miss Me When I'm Gone Dailymotion Video - I have to choose between two sons-the Miller brothers #reelshort,2026-06-13,3892,4,0,0
Dailymotion,д№”иүі,x4klm7q,ReelShort Romance Shows,xaf7r4a,HOTрҹ’ҘAfter the Reformatory My Family Begs Me Home Dailymotion Video - A New Life Ruined by Old Schemes #reelshort,2026-06-13,4316,2,0,0
Dailymotion,д№”иүі,x4klm7q,ReelShort Romance Shows,xaf7omq,NEWрҹ’«Rose in Chains Dailymotion Video - Love is the only key #reelshort,2026-06-13,4931,2,0,0
Dailymotion,д№”иүі,x4klm7q,ReelShort Romance Shows,xaf7ptu,NO CUTрҹ”ҘWaterboy Second Down Dailymotion Video - Superstar quarterback Donovan Miller is back #reelshort,2026-06-13,3384,0,0,0
Dailymotion,д№”иүі,x4klm7q,ReelShort Romance Shows,xaf7jam,NEWрҹҺӯCaged by His Twisted Love Dailymotion Video - Trapped by the Man She Thought Gone #reelshort,2026-06-13,4178,8,0,0
Dailymotion,д№”иүі,x4klm7q,ReelShort Romance Shows,xaf7bve,ENG SUBрҹ’ңThe Hockey Captain That Hates Me Dailymotion Video - Rivals Turn Lovers Under Pressure #reelshort,2026-06-13,4157,0,0,0
Dailymotion,д№”иүі,x4klm7q,ReelShort Romance Shows,xae91l6,вңЁвңЁAlpha's Regret After His Pregnant Luna's Death Dailymotion Video - The Regret That Can Never Be Undone #reelshort,2026-06-10,3425,11,0,0
Dailymotion,д№”иүі,x4klm7q,ReelShort Romance Shows,xae91xy,рҹ’Ҙрҹ’Ҙрҹ’ҘDraft Dreams Dailymotion Video - A Game That Changed My Whole Life #reelshort,2026-06-10,3183,1,0,0
Dailymotion,д№”иүі,x4klm7q,ReelShort Romance Shows,xae48xe,рҹ’«рҹ’«рҹ’«The Fake Debutante and the True Billionaire Dailymotion Video - Olivia Bennett win over wealthy Lian Cullen #reelshort,2026-06-09,3787,67,0,0
Dailymotion,д№”иүі,x4klm7q,ReelShort Romance Shows,xae489a,HOTрҹ”ҘBreaking My Bodyguard Dailymotion Video - Vera Marchesa just wants one thing #reelshort,2026-06-09,3820,1404,1,0
Dailymotion,д№”иүі,x4klm7q,ReelShort Romance Shows,xae0t76,HOTрҹ”ҘThey Called Me Worthless Until My Cards Destroyed Their Academy Dailymotion - The forgotten boy with a mysterious pendant hides a world-shaking secret #reelshort,2026-06-08,3578,0,0,0
Dailymotion,д№”иүі,x4klm7q,ReelShort Romance Shows,xae0s3u,рҹ”ҘBroken by My Twin Alphas Dailymotion - Ivy spent three years loving the twin Alphas #reelshort,2026-06-08,3648,40,0,0
Dailymotion,д№”иүі,x4klm7q,ReelShort Romance Shows,xae0oce,NO CUTвңЁWorthless to Priceless The Alpha's Rejected Mate Dailymotion Video - Hidden power Deadly secrets and A Forbidden Dark Destiny #reelshort,2026-06-08,3817,113,0,0
Dailymotion,д№”иүі,x4klm7q,ReelShort Romance Shows,xadmeki,рҹ‘‘рҹ‘‘The Alpha's Dead Luna Dailymotion Video - Aria A wolf-girl  Won Over by Alpha Kane's Five Years of Devotion #reelshort,2026-06-06,3721,12,0,0
Dailymotion,д№”иүі,x4klm7q,ReelShort Romance Shows,xadme22,NEWрҹ–ӨMy Fated Deal with the Alpha King Dailymotion Video - Alpha King Nicholas & Luna Violet #reelshort,2026-06-06,4117,108,0,0
Dailymotion,д№”иүі,x4klm7q,ReelShort Romance Shows,xadmdbu,рҹ’ҷрҹ’ҷрҹ’ҷLuna Reborn Alpha's Second Chance Dailymotion Video - Edward A Powerful Alpha #reelshort,2026-06-06,4567,8,0,0
Dailymotion,д№”иүі,x4klm7q,ReelShort Romance Shows,xadjwxu,рҹ”Ҙрҹ”Ҙрҹ”ҘChopping My Way to Immortality Dailymotion Anime - Derek A genius of the Celestial SectвҖҷs Cloud Peak #reelshort,2026-06-06,3727,4,0,0
Dailymotion,д№”иүі,x4klm7q,ReelShort Romance Shows,xad9ot6,рҹ’ӣрҹ’ӣрҹ’ӣDouble Life of a Cell Block King Dailymotion Video - A sudden marriage ties his fate to Sophia #reelshort,2026-06-05,4505,15,0,0
Dailymotion,д№”иүі,x4klm7q,ReelShort Romance Shows,xad9nw6,рҹ’ңрҹ’ңMy Alpha Boss Gave Me Triplets Dailymotion Video - Leopold The Ruthless Alpha of the Stonehearth Pack #reelshort,2026-06-05,4479,8,0,0
Dailymotion,д№”иүі,x4klm7q,ReelShort Romance Shows,xad6944,рҹ’Ҙрҹ’Ҙрҹ’ҘThe Extraordinary Mother of a Billionaire Dailymotion Anime - Billionaire Defends Humble Mother #reelshort,2026-06-04,4263,1739,0,0
Dailymotion,д№”иүі,x4klm7q,ReelShort Romance Shows,xad5wfg,рҹ”Ҙрҹ”Ҙрҹ”ҘReborn Villainess Healing Hearts Breaking Walls Dailymotion - Aria A kind-hearted veterinary intern#reelshort,2026-06-04,3966,4,0,0
Dailymotion,д№”иүі,x4klm7q,ReelShort Romance Shows,xad2sqy,ENG SUBрҹ’ҘOrc love Dailymotion Anime - Brian and Logan Twin Wolf Beastkin #reelshort,2026-06-04,3444,3,0,0
Dailymotion,д№”иүі,x4klm7q,ReelShort Romance Shows,xad2r4y,рҹ’”рҹ’”рҹ’”Your Love Broke My Heart Dailymotion Video - Seraph A princess cherished by her family her entire life #reelshort,2026-06-04,6044,14,0,0
Dailymotion,д№”иүі,x4klm7q,ReelShort Romance Shows,xacjwzc,рҹ”Ҙрҹ”Ҙрҹ”ҘThe Warlord Returns Dailymotion Video - Harrison The Director of FBI #reelshort,2026-06-01,5167,3,0,0
Dailymotion,д№”иүі,x4klm7q,ReelShort Romance Shows,xacjmwe,ENG SUBрҹ”ҘTaming My Bullies 3 Dailymotion Video - Emma and The Big Four's story is coming to its finale #reelshort,2026-06-01,4769,6,0,0
Dailymotion,д№”иүі,x4klm7q,ReelShort Romance Shows,xac8zgc,ENG SUBрҹ’”The Imperfect Marriage Dailymotion Video - Based on the novel by L. Steele - Vivian flash marries a hot silver fox #reelshort,2026-05-31,3573,11,0,0
Dailymotion,д№”иүі,x4klm7q,ReelShort Romance Shows,xabyzg0,рҹҢҲрҹҢҲSimp Reborn Win Over Her Mom Anime Dailymotion - Travel Into Romance Novel He Becomes A Carefree Anti-Hero #reelshort,2026-05-30,4796,3,0,0
Dailymotion,д№”иүі,x4klm7q,ReelShort Romance Shows,xabyvf4,ENG SUBрҹ’ҘCyberking Reclaims His Throne Dailymotion Video - Max Lennox The World's Number One Hacker CYBERKING #reelshort,2026-05-30,3746,1,0,0
Dailymotion,д№”иүі,x4klm7q,ReelShort Romance Shows,xabygcs,рҹ’ҷрҹ’ҷрҹ’ҷMy Boss Loves Me Too Much Dailymotion [ENG SUB] #reelshort,2026-05-30,3845,17,0,0
Dailymotion,д№”иүі,x4klm7q,ReelShort Romance Shows,xabybsg,рҹҢҲDjinn Under Contract Dailymotion Video - Eli Baran A Genie In A Magic Lamp #reelshort,2026-05-30,6072,9,0,0
Dailymotion,д№”иүі,x4klm7q,ReelShort Romance Shows,xaby9h6,рҹ’ңрҹ’ңCarter Reed Dailymotion - Emma Falling For a Monster #reelshort,2026-05-30,5088,8,0,0
Dailymotion,д№”иүі,x4klm7q,ReelShort Romance Shows,xabifxs,NEWрҹ’ҘThe Luna's Second Choice Dailymotion Video - She Rejects All Five Mates #reelshort,2026-05-28,3964,19,0,0
Dailymotion,д№”иүі,x4klm7q,ReelShort Romance Shows,xabgqja,рҹ–Өрҹ–Өрҹ–ӨDark Notes Dailymotion Video - Based on the novel by Pam Godwin #reelshort,2026-05-28,3712,15,0,0
Dailymotion,д№”иүі,x4klm7q,ReelShort Romance Shows,xabce9y,NEWрҹ–ӨReelShort Stableboy Dailymotion - Team captain Colt Maddox The Golden Boy Cowboy #reelshort,2026-05-27,4381,173,1,0
Dailymotion,д№”иүі,x4klm7q,ReelShort Romance Shows,xabcdcm,рҹ’Ҙрҹ’ҘReborn to See the Footbal Ruin Themselves Dailymotion Video - The Night Before State Championship #reelshort,2026-05-27,4124,91,0,0
Dailymotion,д№”иүі,x4klm7q,ReelShort Romance Shows,xab8jsi,рҹ”Ҙрҹ”ҘBound by Love Dailymotion Video - Aria won LucaвҖҷs love in an arranged mafia marriage #reelshort,2026-05-26,5245,1319,1,0
Dailymotion,д№”иүі,x4klm7q,ReelShort Romance Shows,xab8eq0,ENG SUGрҹҢҲCampus Saga Superpower Teen Dailymotion - From Bullied Girl to Powerful Force With a Magic Ring #reelshort,2026-05-26,4375,7,0,0
Dailymotion,д№”иүі,x4klm7q,ReelShort Romance Shows,xab51m2,рҹ”Ҙрҹ”Ҙрҹ”ҘAlpha Queen Rising Dailymotion Video - Aurora The Leader of The Legendary Shadow Circle #reelshort,2026-05-25,4537,5,0,0
Dailymotion,д№”иүі,x4klm7q,ReelShort Romance Shows,xab05ve,рҹ’Ҙрҹ’ҘDon't Blink You'll Miss It Dailymotion Video - Daniel Angier The Master of Magic #reelshort,2026-05-24,4070,17,0,0
Dailymotion,д№”иүі,x4klm7q,ReelShort Romance Shows,xab01q4,рҹ’ӣрҹ’ӣрҹ’ӣTaming My Bullies 2 Dailymotion Video - Once enemies Now lovers #reelshort,2026-05-24,5587,4,0,0
Dailymotion,д№”иүі,x4klm7q,ReelShort Romance Shows,xaa0zey,рҹ’ӣLove Cruise Reelshort Anime Movie Dailymotion - Yacht Romance Secret Journey #reelshort,2026-05-17,3689,11,0,0
Dailymotion,д№”иүі,x4klm7q,ReelShort Romance Shows,xa9yooi,ENG SUBрҹ”ҘNot My Clan Not My Problem Chinese Drama English Dubbed - The Adopted Daughter Of The Harrington Estate #reelshort,2026-05-16,3844,4,0,0
Dailymotion,д№”иүі,x4klm7q,ReelShort Romance Shows,xa9yn8i,рҹҢҲThe Wolf Assassin Pregnant and Dangerous (updating) - Sealed Power and Maternal Rescue #reelshort,2026-05-16,3974,7,0,0
Dailymotion,д№”иүі,x4klm7q,ReelShort Romance Shows,xa9yklc,рҹ”Ҙрҹ”ҘRejected Luna Is the Alpha Queen Dailymotion - Rejected Luna Unleashes Her White Wolf Power & Takes Revenge #reelshort,2026-05-16,4746,7,0,0
Dailymotion,д№”иүі,x4klm7q,ReelShort Romance Shows,xa9yi1w,NEWрҹ’ңFalling for My Nemesis Stepbrother Dailymotion - Good Girl Fell For Her Dangerous Stepbrother вҖ“ A Love He CanвҖҷt Fight! #reelshort,2026-05-16,3890,702,0,0
Dailymotion,д№”иүі,x4klm7q,ReelShort Romance Shows,xa9y0uq,ENG SUBрҹ’ҷThe Seduction Game Dailymotion Video -SheвҖҷs Being Set Up вҖ” But This Trailer Girl Is Playing Them All! #reelshort,2026-05-16,3956,392,0,0
Dailymotion,д№”иүі,x4klm7q,ReelShort Romance Shows,xa8zvg8,рҹ’ӣрҹ’ӣMy Househusband Is Gamble King C-Drama English Dubbed - Harold The Legendary Gamble King #reelshort,2026-05-10,3323,4,0,0
Dailymotion,д№”иүі,x4klm7q,ReelShort Romance Shows,xa8zefq,рҹҢҲрҹҢҲFool No More King Returns C-Drama English Dubbed #reelshort Movie,2026-05-10,3935,0,0,0
