platform,operator,channel_id,channel_name,video_id,video_title,published_date,duration_sec,views,likes,comments
YouTube,崔铭洋,UCAkSxwl8Lbk2hBXAAfsEFTA,Victor Drama,CdArAyMO_pE,"He Saved Sperm for Her, But Gave It to His Childhood Crush Instead | #drama #romantic",2026-06-19,2040,332,5,0
YouTube,崔铭洋,UCAkSxwl8Lbk2hBXAAfsEFTA,Victor Drama,aZhQNgjyl-U,An 18-Year-Old Shelterd Mafia Princess Marries Ruthless Seductive Mob Boss? | #drama #mafia,2026-06-18,2086,224,1,0
YouTube,崔铭洋,UCAkSxwl8Lbk2hBXAAfsEFTA,Victor Drama,kVI5JeQHw7Y,"He Took His Enemy’s Daughter Captive, Only to Fall Obsessively in Love With Her | #drama #mafia",2026-06-17,2480,2537,38,1
YouTube,崔铭洋,UCAkSxwl8Lbk2hBXAAfsEFTA,Victor Drama,txwkgHCY3Ck,Two ruthless mafia bosses clash fiercely—who is hotter and more possessive in love? #shorts #mafia,2026-06-17,60,1906,17,0
YouTube,崔铭洋,UCAkSxwl8Lbk2hBXAAfsEFTA,Victor Drama,4EwxGE0f6s0,"He Bullied Me Out of Town Years Ago, Now His Dark Offer Tempts Me Into His Broken World | #drama",2026-06-17,2250,2097,36,0
YouTube,崔铭洋,UCAkSxwl8Lbk2hBXAAfsEFTA,Victor Drama,dlytPsy5b3k,🩸Blood Feud Wolves: The Enemy Alpha Is Her Destined Mate | #drama #werewolf,2026-06-16,1955,3108,53,3
YouTube,崔铭洋,UCAkSxwl8Lbk2hBXAAfsEFTA,Victor Drama,mOe3OFEEkkw,Wed Upon First Meeting: They Fight Enemies and Her Mysterious History | #drama #romantic,2026-06-16,1812,1948,17,0
YouTube,崔铭洋,UCAkSxwl8Lbk2hBXAAfsEFTA,Victor Drama,GIexiYeQKd4,"❤Slowly, I Melted the Billionaire’s Frozen Cold Heart | #drama #romantic",2026-06-15,382,695,8,1
YouTube,崔铭洋,UCAkSxwl8Lbk2hBXAAfsEFTA,Victor Drama,IOtYm8Zo8DM,Forced Into a Sudden Marriage With a Mysterious Man | #drama #ceo,2026-06-15,2714,4019,48,7
YouTube,崔铭洋,UCAkSxwl8Lbk2hBXAAfsEFTA,Victor Drama,YtXI8XUyXc8,🐺Terrible Truth: My Crush Is My Best Friend’s Dad?  | #drama #alpha,2026-06-14,310,1647,8,0
YouTube,崔铭洋,UCAkSxwl8Lbk2hBXAAfsEFTA,Victor Drama,oaUsSiRQkZk,I Had No Idea My Ordinary Husband Was a Secret Billionaire | #drama #ceo,2026-06-13,379,297,4,0
YouTube,崔铭洋,UCAkSxwl8Lbk2hBXAAfsEFTA,Victor Drama,Fh8h42l6o7w,"😔I Only Wanted My Crush, But I’m Falling for the Bad Boy | #drama #romantic",2026-06-13,394,613,15,0
YouTube,崔铭洋,UCAkSxwl8Lbk2hBXAAfsEFTA,Victor Drama,LXD8FmCpI0c,😙My Casual Rescue Kiss Turned Into a Surprise Marriage With a Billionaire | #drama #romantic,2026-06-12,775,877,10,0
YouTube,崔铭洋,UCAkSxwl8Lbk2hBXAAfsEFTA,Victor Drama,-vrnPhZO-U8,🔥Taming My Bullies: Full Season 1-3 Highlight Clips | #drama #romantic,2026-06-12,6554,17067,206,9
YouTube,崔铭洋,UCAkSxwl8Lbk2hBXAAfsEFTA,Victor Drama,3g0XV3IpNgo,🐺My Werewolf Boyfriend Spoils Me Rotten to Protect Me and Our Babies... #shorts #movie,2026-06-12,64,3598,108,2
YouTube,崔铭洋,UCAkSxwl8Lbk2hBXAAfsEFTA,Victor Drama,re6LEAbmXTs,🔥I Have Triplets! One Night Accident With My Mysterious Wolf Boss...  #shorts #movie,2026-06-12,60,3390,100,1
YouTube,崔铭洋,UCAkSxwl8Lbk2hBXAAfsEFTA,Victor Drama,aji90Gn04E8,"A Spontaneous Kiss Changed My Life, Leading to a Whirlwind CEO Marriage | #drama #romantic",2026-06-11,843,518,6,0
YouTube,崔铭洋,UCAkSxwl8Lbk2hBXAAfsEFTA,Victor Drama,MO1pWLsKhYw,"I’m a Weak Human Designer, But I’m Carrying the Alpha’s Rare Triplets | #drama #werewolf",2026-06-11,2010,26517,470,21
YouTube,崔铭洋,UCAkSxwl8Lbk2hBXAAfsEFTA,Victor Drama,o90S0FwNzuQ,"The Cold CEO Lost His Wife, Then Began Courting Her All Over Again | #drama #ceo",2026-06-10,2140,711,15,0
YouTube,崔铭洋,UCAkSxwl8Lbk2hBXAAfsEFTA,Victor Drama,w_phCcMyv30,My Cold Ex-Husband Hired Me as His Secretary and Started Chasing Me. #shorts #revenge,2026-06-10,82,600,20,2
YouTube,崔铭洋,UCAkSxwl8Lbk2hBXAAfsEFTA,Victor Drama,jC-DQ4t6mMo,"💏After All the Hardships, Will Rowan and I Finally Get a Happy Ending? | #drama #romantic",2026-06-10,1926,3152,30,1
YouTube,崔铭洋,UCAkSxwl8Lbk2hBXAAfsEFTA,Victor Drama,K9O-IMTMfYg,"He Forgot Our Love, So I Brought Back Every Memory for Him... #shorts #romantic",2026-06-10,55,3526,87,0
YouTube,崔铭洋,UCAkSxwl8Lbk2hBXAAfsEFTA,Victor Drama,MtdYCi6tYBg,I Was Abandoned By My Family Just For a Facial Birthmark? #drama #revenge,2026-06-09,2010,1515,21,0
YouTube,崔铭洋,UCAkSxwl8Lbk2hBXAAfsEFTA,Victor Drama,CbMbB-YnyZg,I Dumped My Fortune-Chasing Cheating Ex and Accidentally Married a Ordinary Nurse | #drama #betrayal,2026-06-09,2875,3892,37,0
YouTube,崔铭洋,UCAkSxwl8Lbk2hBXAAfsEFTA,Victor Drama,79D2D57W7Ok,"Mute and Misunderstood, I Still Hoped He’d Fall for Me Again... #shorts #revenge",2026-06-09,56,5841,110,0
YouTube,崔铭洋,UCAkSxwl8Lbk2hBXAAfsEFTA,Victor Drama,c5UeHAlE1W0,"🌹I Dated His Son, But I’m Irresistibly Drawn to the Mafia Boss Father. | #drama #forbiddenlove",2026-06-09,247,3131,43,4
YouTube,崔铭洋,UCAkSxwl8Lbk2hBXAAfsEFTA,Victor Drama,KkrBCwVxwDI,"💒I Married a Nobody to Heal My Broken Heart, He’s Actually a Top Tycoon? #shorts #ceo",2026-06-09,79,2536,73,1
YouTube,崔铭洋,UCAkSxwl8Lbk2hBXAAfsEFTA,Victor Drama,rdumc5xP8Ds,🏒The Man I Abandoned Is Now the League’s Hottest Hockey Icon #drama #romantic,2026-06-08,1127,1198,8,0
YouTube,崔铭洋,UCAkSxwl8Lbk2hBXAAfsEFTA,Victor Drama,VKSx2swFi8Q,"🐺Deathly Afraid of Werewolves, I Had to Marry One to Survive! #shorts #werewolf",2026-06-08,50,3007,54,0
YouTube,崔铭洋,UCAkSxwl8Lbk2hBXAAfsEFTA,Victor Drama,qnaWqHTDjWU,🌃One Night Changed Everything — I’m Carrying a Billionaire’s Heir #drama #ceo,2026-06-08,1654,2829,36,0
YouTube,崔铭洋,UCAkSxwl8Lbk2hBXAAfsEFTA,Victor Drama,sSlTRTXBODo,"I Was Just Checking My Body, Until a Werewolf Burst In and Claimed My Baby? #shorts #werewolf",2026-06-08,41,3069,44,0
YouTube,崔铭洋,UCAkSxwl8Lbk2hBXAAfsEFTA,Victor Drama,OnbmIb6Mjws,"🐺I Fears Werewolves More Than Anything, Yet I’m Pregnant With the Alpha’s Baby. #shorts #werewolf",2026-06-08,95,4713,91,1
YouTube,崔铭洋,UCAkSxwl8Lbk2hBXAAfsEFTA,Victor Drama,OsIvZoi1c48,"He’s the Most Desired Billionaire, But I’m Fleeing From His Unexpected Baby... #shorts #ceo",2026-06-08,78,2465,64,0
YouTube,崔铭洋,UCAkSxwl8Lbk2hBXAAfsEFTA,Victor Drama,uw22CfmI0Jg,🏒My Hot Hockey Boss Has No Idea He’s a Father of My Kids? #shorts #hockey,2026-06-08,56,1384,28,0
YouTube,崔铭洋,UCAkSxwl8Lbk2hBXAAfsEFTA,Victor Drama,vAshLg7oAAA,🐺I’m Terrified of Werewolves… Now I’m Carrying an Alpha’s Baby #drama #werewolf,2026-06-08,1688,4598,92,1
YouTube,崔铭洋,UCAkSxwl8Lbk2hBXAAfsEFTA,Victor Drama,kn3SztYuSrs,"♿I Loved A Ordinary Guy In A Wheelchair, He’s The Hidden Mafia King | #drama #mafia",2026-06-07,1513,1700,21,0
YouTube,崔铭洋,UCAkSxwl8Lbk2hBXAAfsEFTA,Victor Drama,_1xSrmFWIEY,💵One Family Deal Turned Me Into a Coma Billionaire’s Fiancée #drama #romantic,2026-06-06,1742,4204,50,0
YouTube,崔铭洋,UCAkSxwl8Lbk2hBXAAfsEFTA,Victor Drama,AM9PNsOsqpg,"🌹I Got Pregnant Through IVF, Then Caught My Fiancé Cheating With My Best Friend | #drama #mafia",2026-06-06,1399,7543,99,1
YouTube,崔铭洋,UCAkSxwl8Lbk2hBXAAfsEFTA,Victor Drama,qJtoWTF4wgM,"I Married Him To Save My Mom, But He Believed My Enemy And Destroyed Us | #drama #revenge",2026-06-05,1608,4044,49,7
YouTube,崔铭洋,UCAkSxwl8Lbk2hBXAAfsEFTA,Victor Drama,YQ-MZm70Fb0,"She Bears the Mafia’s Only Heir, But Found His Husband Cheating... [Drama Commentary] #drama #movie",2026-06-05,181,115,1,0
YouTube,崔铭洋,UCAkSxwl8Lbk2hBXAAfsEFTA,Victor Drama,22gPCpj5hc0,😚Every Fake Kiss and Touch Pulled Me Closer to My Secret-Obsessed Boss #drama,2026-06-05,2012,854,7,0
YouTube,崔铭洋,UCAkSxwl8Lbk2hBXAAfsEFTA,Victor Drama,ziMBW1r8wiI,"She Waited 8 Years for a Vegetative Boyfriend, Who Turned Out to Be the Mafia Don. #shorts #mafia",2026-06-05,172,698,15,1
YouTube,崔铭洋,UCAkSxwl8Lbk2hBXAAfsEFTA,Victor Drama,GFkGZnKIp9w,"We Faked A Marriage To Get Revenge On My Ex, We Both Faked Our Identities | #drama #ceo",2026-06-04,2029,805,15,0
YouTube,崔铭洋,UCAkSxwl8Lbk2hBXAAfsEFTA,Victor Drama,-sNleWkz3k8,🐺Cursed Werewolf + 🧛‍Secret Vampire — Mortal Enemies Turned Fated Mates #drama #werewolf,2026-06-04,1111,913,14,1
YouTube,崔铭洋,UCAkSxwl8Lbk2hBXAAfsEFTA,Victor Drama,6zx80gQgh_g,"We Faked a Marriage to Get Revenge on My Ex, Then Fell in Love For Real... #shorts #romantic",2026-06-04,87,1063,16,0
YouTube,崔铭洋,UCAkSxwl8Lbk2hBXAAfsEFTA,Victor Drama,L5RrsnAShv0,I Fought Every Woman After My Love & Crushed My Arrogant In-Laws | #drama #romantic,2026-06-04,1804,1648,12,0
YouTube,崔铭洋,UCAkSxwl8Lbk2hBXAAfsEFTA,Victor Drama,XZEEBe6PExo,"I Lived With My Two Step Brothers, Until The Maid’s Daughter Ruined Everything. #shorts #revenge",2026-06-03,112,1316,25,0
YouTube,崔铭洋,UCAkSxwl8Lbk2hBXAAfsEFTA,Victor Drama,x5q-zZ6N84A,I Betrayed My Mafia King… But I’m Carrying His Heir! #shorts #mafia,2026-06-03,96,1939,47,2
YouTube,崔铭洋,UCAkSxwl8Lbk2hBXAAfsEFTA,Victor Drama,vOCfjl2GFBs,"He planned to end his fake marriage, not knowing the nurse was his wife. #drama #englishdrama",2026-06-02,1795,1171,16,0
YouTube,崔铭洋,UCAkSxwl8Lbk2hBXAAfsEFTA,Victor Drama,xKT3XxbxQg4,"They lost each other to misunderstanding, then gained a twisted family bond. | #drama #romantic",2026-06-02,1513,2579,26,0
YouTube,崔铭洋,UCAkSxwl8Lbk2hBXAAfsEFTA,Victor Drama,YF85nGRyi4s,"Her fiancé broke up with her in public, before a homeless man proposed to her. #shorts #romantic",2026-06-02,58,1124,23,0
YouTube,崔铭洋,UCAkSxwl8Lbk2hBXAAfsEFTA,Victor Drama,m4JqfDhTTSE,She married a homeless man in haste and dressed him in cute pink pajamas. #shorts #romantic,2026-06-02,88,3328,96,2
YouTube,崔铭洋,UCAkSxwl8Lbk2hBXAAfsEFTA,Victor Drama,7HKWsM-xNpc,"Her ex showed off his wealth arrogantly, until the man shocked him with a Ferrari key.🏎️ #shorts",2026-06-02,71,1486,33,0
YouTube,崔铭洋,UCAkSxwl8Lbk2hBXAAfsEFTA,Victor Drama,mmYkW1x-vRI,"She only wanted to help a friend, but caught her professor’s full attention. #shorts #romantic",2026-06-02,57,2095,25,0
YouTube,崔铭洋,UCAkSxwl8Lbk2hBXAAfsEFTA,Victor Drama,Tj5l96END0M,😍I Was a Pastor’s Perfect Good Girl… Until I Fell For a Gang Bad Boy | #drama #mafia,2026-06-01,1768,5230,33,0
YouTube,崔铭洋,UCAkSxwl8Lbk2hBXAAfsEFTA,Victor Drama,c39YRJhXTX4,I Chose Love Over My Princess Duty… Then My Mate Betrayed Me #drama #werewolf,2026-06-01,1424,721,10,0
YouTube,崔铭洋,UCAkSxwl8Lbk2hBXAAfsEFTA,Victor Drama,9AlzyNtz0p8,"You dumped Noah Preston when he had nothing, but now he's a billionaire! | #drama #ceo",2026-06-01,1233,667,6,0
YouTube,崔铭洋,UCAkSxwl8Lbk2hBXAAfsEFTA,Victor Drama,e2nhMs0U3NE,"😈Evil Fake Sister Tried To Take Me Down, But My Hidden Billionaire Crew Protected Me #drama #revenge",2026-06-01,1923,458,4,0
YouTube,崔铭洋,UCAkSxwl8Lbk2hBXAAfsEFTA,Victor Drama,JMdGEonJgIU,🐺Everyone Doubted Me After My Rejection… Now They’ll Regret It! #shorts #werewolf,2026-06-01,60,2266,63,0
YouTube,崔铭洋,UCAkSxwl8Lbk2hBXAAfsEFTA,Victor Drama,s9GMv36kvBw,I Cheated On My Cheating Ex… Now I’m Pregnant With My Professor’s Baby | #drama #romantic,2026-06-01,1503,15749,135,0
YouTube,崔铭洋,UCAkSxwl8Lbk2hBXAAfsEFTA,Victor Drama,cahzIlcLt5s,"❤️‍🩹Forgot him for 7 years, a random night changed my entire life... #drama #ceo",2026-05-31,1519,1378,13,2
YouTube,崔铭洋,UCAkSxwl8Lbk2hBXAAfsEFTA,Victor Drama,QZw2qfdzM_Q,❤️‍🩹Unplanned pregnancy and a suffocating family left this woman trapped in endless despair. #shorts,2026-05-31,112,843,31,0
YouTube,崔铭洋,UCAkSxwl8Lbk2hBXAAfsEFTA,Victor Drama,MrvGFsrYLiw,"They agreed to be fake lovers, but the boy slowly fell for her for real. #shorts #romantic",2026-05-31,58,1562,44,0
YouTube,崔铭洋,UCAkSxwl8Lbk2hBXAAfsEFTA,Victor Drama,T53W5BuIyyU,⏰Late on her first internship day but her childhood kindness to win the man's understanding. #shorts,2026-05-30,70,5820,137,0
YouTube,崔铭洋,UCAkSxwl8Lbk2hBXAAfsEFTA,Victor Drama,nZtO-o2EOxg,"❤️‍🩹Double betrayal pushed me to wed, my husband’s true identity shocked everyone! #shorts #ceo",2026-05-30,55,2082,49,1
YouTube,崔铭洋,UCAkSxwl8Lbk2hBXAAfsEFTA,Victor Drama,A5Y2z9-TqyE,👧Small-town girl’s nightmare: ex’s betrayal → sudden contract marriage #drama #romantic,2026-05-30,1785,1870,25,1
YouTube,崔铭洋,UCAkSxwl8Lbk2hBXAAfsEFTA,Victor Drama,f60-nphufdg,"The doctor kept arranging night shifts alone with the intern, have a crush on her? #shorts #romantic",2026-05-30,74,2339,62,0
YouTube,崔铭洋,UCAkSxwl8Lbk2hBXAAfsEFTA,Victor Drama,iEQBdUHN_OQ,"You married a stranger with a promise to divorce, but now he doesn't want to let you go! #shorts",2026-05-30,56,1269,29,0
YouTube,崔铭洋,UCAkSxwl8Lbk2hBXAAfsEFTA,Victor Drama,9tYzNz_nSOg,"💔Betrayed by Fiancé & Sister, I Married a Hidden Billionaire. #drama #romantic",2026-05-30,2438,20028,187,11
YouTube,崔铭洋,UCAkSxwl8Lbk2hBXAAfsEFTA,Victor Drama,kEvV1ovFT5w,"🔥I married a stranger with a promise, but now he doesn't want to let me go! #drama #flashmarriage",2026-05-29,1751,1341,11,0
YouTube,崔铭洋,UCAkSxwl8Lbk2hBXAAfsEFTA,Victor Drama,gNh_JZTb574,"She just got home, only for her stepmother to tell her she was engaged without her consent. #shorts",2026-05-29,66,1428,19,0
YouTube,崔铭洋,UCAkSxwl8Lbk2hBXAAfsEFTA,Victor Drama,-qs089ADM4s,"🔥I married a stranger, but my boss is my hidden husband. #drama #movie",2026-05-29,1600,1776,12,1
YouTube,崔铭洋,UCAkSxwl8Lbk2hBXAAfsEFTA,Victor Drama,B_g5aWKcjEo,"We met 7 years ago, now I don’t even recognize my billionaire lover. #shorts #romantic",2026-05-29,62,1237,18,0
YouTube,崔铭洋,UCAkSxwl8Lbk2hBXAAfsEFTA,Victor Drama,a5ANHg139p8,"I chased debt for mom’s medical bills, then landed a fake marriage with a tycoon. #shorts #drama",2026-05-29,57,1404,43,2
YouTube,崔铭洋,UCAkSxwl8Lbk2hBXAAfsEFTA,Victor Drama,NwEYrjhLc2Q,"She mistakenly snuck into a billionaire’s luxury car, starting a life-changing love story. #shorts",2026-05-29,75,1374,48,0
YouTube,崔铭洋,UCAkSxwl8Lbk2hBXAAfsEFTA,Victor Drama,vojHCWzVN2w,"🏒Fake girlfriend, you’re crossing the line. #drama #romantic",2026-05-28,1781,7112,45,2
YouTube,崔铭洋,UCAkSxwl8Lbk2hBXAAfsEFTA,Victor Drama,qKPDoqJ23ZU,"🌙He rejected his mate for being too weak, yet his wolf warned him of a fatal mistake. #drama #alpha",2026-05-28,1418,629,8,0
YouTube,崔铭洋,UCAkSxwl8Lbk2hBXAAfsEFTA,Victor Drama,wncGsIrw7t4,She found out her boyfriend’s hidden truth and unexpectedly met his hot dad. #shorts #movie,2026-05-28,53,2882,49,1
YouTube,崔铭洋,UCAkSxwl8Lbk2hBXAAfsEFTA,Victor Drama,Hs0UKhDwLds,She told her best friend everything about her secret story with her boyfriend’s dad. #shorts #movie,2026-05-28,55,1409,39,1
YouTube,崔铭洋,UCAkSxwl8Lbk2hBXAAfsEFTA,Victor Drama,kKABTIyLnD0,"Determined to wed the gang boss’s son, she unexpectedly drew his attention. #shorts #mafia",2026-05-28,60,1375,31,1
YouTube,崔铭洋,UCAkSxwl8Lbk2hBXAAfsEFTA,Victor Drama,KIkh_qxRxgE,"💜He’s my untouchable boss, and I’m hopelessly in love. #drama #ceo",2026-05-27,1277,1698,12,0
YouTube,崔铭洋,UCAkSxwl8Lbk2hBXAAfsEFTA,Victor Drama,RCGg3hv8rBs,The 3-year marriage contract expired. Time to end it all. #drama #romantic,2026-05-27,1973,1398,18,0
YouTube,崔铭洋,UCAkSxwl8Lbk2hBXAAfsEFTA,Victor Drama,v0b6QAl2m9c,Maid noticed by a handsome boss at dinner. New life ahead? #shorts #movie,2026-05-27,59,5155,89,2
YouTube,崔铭洋,UCAkSxwl8Lbk2hBXAAfsEFTA,Victor Drama,1qcMMaq3Xv8,"Their contractual marriage lasted three years. Now, it’s finally time to settle it. #shorts",2026-05-27,73,1555,29,0
YouTube,崔铭洋,UCAkSxwl8Lbk2hBXAAfsEFTA,Victor Drama,M4uFv-WJOrY,💖A Single mother is doted on deeply by a wealthy disabled tycoon. #shorts #singlemom,2026-05-26,59,3304,92,2
YouTube,崔铭洋,UCAkSxwl8Lbk2hBXAAfsEFTA,Victor Drama,HZywDx5CrFw,👰Stand-in bride for a comatose billionaire… until he wakes up! #drama #romantic,2026-05-26,2174,7112,66,1
YouTube,崔铭洋,UCAkSxwl8Lbk2hBXAAfsEFTA,Victor Drama,cbNyAseayfs,"💔Betrayed by her ex, she never thought she’d catch the eye of a powerful CEO. #shorts #ceo",2026-05-26,53,2614,58,1
YouTube,崔铭洋,UCAkSxwl8Lbk2hBXAAfsEFTA,Victor Drama,fuw6Mc-G_AA,"👰🤵After rescuing the billionaire’s sibling, we got married in a flash! #drama #flashmarriage",2026-05-26,1432,5071,61,0
YouTube,崔铭洋,UCAkSxwl8Lbk2hBXAAfsEFTA,Victor Drama,qbRWq3eeeJU,A fake marriage to a comatose billionaire. What fate awaits her when he wakes? #shorts #movie,2026-05-26,60,1288,29,1
YouTube,崔铭洋,UCAkSxwl8Lbk2hBXAAfsEFTA,Victor Drama,8Upq8J60IKc,My Professor is my secret Lover? What a big mess! #drama #romantic,2026-05-25,1394,1342,11,0
YouTube,崔铭洋,UCAkSxwl8Lbk2hBXAAfsEFTA,Victor Drama,SQeY5mja_6Q,"💵Bought at a high price by the mafia boss, she becomes his contractual lover #drama #mafia",2026-05-25,1543,823,4,1
YouTube,崔铭洋,UCAkSxwl8Lbk2hBXAAfsEFTA,Victor Drama,0k8egeait4g,No free affection in adulthood. Every relationship is a fair trade.#shorts #flashmarriage,2026-05-25,72,1452,28,0
YouTube,崔铭洋,UCAkSxwl8Lbk2hBXAAfsEFTA,Victor Drama,xdpiaz_WJ8w,🃏Is he just a magician or does he possess real magic? Don’t blink! [Full Movie] #magic #drama,2026-05-25,1688,332,5,0
YouTube,崔铭洋,UCAkSxwl8Lbk2hBXAAfsEFTA,Victor Drama,xRI7fTH_WY4,"She was framed as a thief, leaving everyone stunned when she pulled out a black card. #movie #drama",2026-05-23,3171,1562,17,0
YouTube,崔铭洋,UCAkSxwl8Lbk2hBXAAfsEFTA,Victor Drama,TmezUZRoHJc,"🐺Humble maid, chosen by the cute Alpha King. #drama #werewolf",2026-05-23,1135,1274,15,1
YouTube,崔铭洋,UCAkSxwl8Lbk2hBXAAfsEFTA,Victor Drama,YOCTJMFofTg,"She became a private maid, only to find her new boss was her secret school crush! #romantic #drama",2026-05-22,1780,7757,54,1
YouTube,崔铭洋,UCAkSxwl8Lbk2hBXAAfsEFTA,Victor Drama,QzPHsFOPJBE,🌹The Mafia King Loves his Son's Fiance? She 's Falling for Her Ex's Mafia Dad! #romantic #mafia,2026-05-22,2385,54167,560,46
YouTube,崔铭洋,UCAkSxwl8Lbk2hBXAAfsEFTA,Victor Drama,0QYSJZIh4Vc,🃏The legendary magician makes a comeback! Can his stunning skills win her heart? #shorts #magic,2026-05-22,59,1255,31,0
YouTube,崔铭洋,UCAkSxwl8Lbk2hBXAAfsEFTA,Victor Drama,r5heDttMcUA,"🐺She was set up to enter the wrong room, but accidentally won the Alpha’s heart. #shorts #werewolf",2026-05-22,58,1949,35,0
YouTube,崔铭洋,UCAkSxwl8Lbk2hBXAAfsEFTA,Victor Drama,ps92EKNYsJI,"Mocked as a delivery girl, she shocked everyone as the top chief scientist.",2026-05-21,379,300,3,0
YouTube,崔铭洋,UCAkSxwl8Lbk2hBXAAfsEFTA,Victor Drama,nveDFjigL1U,"Shamed for stealing, and she paid with a black card and taught them a lesson. #shorts #movie",2026-05-21,65,1408,14,1
YouTube,崔铭洋,UCAkSxwl8Lbk2hBXAAfsEFTA,Victor Drama,WqjRtmGdsVY,"He brought his ex and their child home, so she packed her bags and walked away for good. #drama",2026-05-21,382,13719,105,1
YouTube,崔铭洋,UCAkSxwl8Lbk2hBXAAfsEFTA,Victor Drama,ZJtua8LFabs,"💔Abandoned post-release, the once business giant slaps everyone in the face with his capability.",2026-05-20,606,856,8,0
YouTube,崔铭洋,UCAkSxwl8Lbk2hBXAAfsEFTA,Victor Drama,w9WpiveDdUY,"She married the mafia son, but fell for his father… #shorts #movie",2026-05-20,60,68520,1612,14
YouTube,崔铭洋,UCAkSxwl8Lbk2hBXAAfsEFTA,Victor Drama,35fjtZ34WC4,The young man fiercely fought the pervert and saved his crush.❤  #romantic #movie,2026-05-20,418,12442,62,4
YouTube,崔铭洋,UCAkSxwl8Lbk2hBXAAfsEFTA,Victor Drama,AxftgX9dTEo,"She saved a man unexpectedly, and he became her husband the next day. #shorts #movie",2026-05-20,83,1925,45,0
YouTube,崔铭洋,UCAkSxwl8Lbk2hBXAAfsEFTA,Victor Drama,7yZUeRBB92A,The obedient girl must marry one of the two brothers. Which one will she pick? #shorts #movie,2026-05-20,65,1594,35,1
YouTube,崔铭洋,UCAkSxwl8Lbk2hBXAAfsEFTA,Victor Drama,ibO38t9lAuM,✈He lost the ticket! The Billionaire was driven out of First Class by flight attendant.,2026-05-20,1692,1813,20,0
YouTube,崔铭洋,UCAkSxwl8Lbk2hBXAAfsEFTA,Victor Drama,I4qkG1eS_K4,The young man she saved unexpectedly is actually her hospital's boss?,2026-05-19,1984,44808,398,12
YouTube,崔铭洋,UCAkSxwl8Lbk2hBXAAfsEFTA,Victor Drama,HWGk2H-R7CE,"She must marry one brother: Gentleman or jealous boy, who will she pick?",2026-05-19,1870,12509,120,5
YouTube,崔铭洋,UCAkSxwl8Lbk2hBXAAfsEFTA,Victor Drama,i8cA6oWxwlU,"She thought he was poor and rude, turned out he’s untouchable. #shorts #movie",2026-05-19,80,2045,36,2
YouTube,崔铭洋,UCAkSxwl8Lbk2hBXAAfsEFTA,Victor Drama,p1wyGGJ0ti4,"He poses as a top chef’s pupil before the real master, will he get proven wrong? #shorts #movie",2026-05-19,99,6353,110,1
YouTube,崔铭洋,UCAkSxwl8Lbk2hBXAAfsEFTA,Victor Drama,QzfpKClcxL0,"The former king of chefs is despised by others, and someone even pretends to be his disciple?",2026-05-19,2269,7468,36,0
YouTube,崔铭洋,UCAkSxwl8Lbk2hBXAAfsEFTA,Victor Drama,rBdUXsCCvtc,❤She loves him deeply though he is the notorious bad boy #drama #romantic,2026-05-18,1978,9319,74,1
YouTube,崔铭洋,UCAkSxwl8Lbk2hBXAAfsEFTA,Victor Drama,UFvYBAVB9P4,🌧From Rainy Humiliation To Billionaire Wife: Her Secret Life Begins! #shorts #drama #reelshort,2026-05-18,127,455,2,0
YouTube,崔铭洋,UCAkSxwl8Lbk2hBXAAfsEFTA,Victor Drama,o1ZyRHmXbVg,"🔥Single mom rises strong, finding love with a wealthy billionaire on wheelchair? #drama #movie",2026-05-18,1672,38541,467,16
YouTube,崔铭洋,UCctSzoeee7KCnR84dZ6IO7w,Maple Playhouse,xSL5AalsZ48,"Surprise Turns Heartbreak: Husband Used Frozen Sperm for Ex, Wife Leaves Him for Good #drama",2026-06-19,260,90,1,0
YouTube,崔铭洋,UCctSzoeee7KCnR84dZ6IO7w,Maple Playhouse,T7L6gL74D7U,"A Single Kiss Saved a Fugitive Thug, A Hasty Marriage Ignited an Unstoppable Passion #drama #mafia",2026-06-19,2007,1008,8,0
YouTube,崔铭洋,UCctSzoeee7KCnR84dZ6IO7w,Maple Playhouse,RBEfyUYcSK4,"She Fell Into a Dangerous Secret Romance With Her Cold, Sexy Professor #drama #romantic",2026-06-19,1396,105,1,0
YouTube,崔铭洋,UCctSzoeee7KCnR84dZ6IO7w,Maple Playhouse,KYiXcowGLUM,"The Whole World Called Him a Loser Ex-Con, But I Chose to Marry Him Anyway #drama #romantic",2026-06-18,2161,1207,9,0
YouTube,崔铭洋,UCctSzoeee7KCnR84dZ6IO7w,Maple Playhouse,FHs3hbGAuQQ,"🌹She Ran Away Pregnant – Seven Years Later, Her Ruthless Boss Husband Chases Her Heart #drama #mafia",2026-06-17,2018,600,10,0
YouTube,崔铭洋,UCctSzoeee7KCnR84dZ6IO7w,Maple Playhouse,NPpk0f_FfRE,"He chained her for vengeance, but love became the only key to free their fates. #shorts #mafia",2026-06-17,53,1545,23,0
YouTube,崔铭洋,UCctSzoeee7KCnR84dZ6IO7w,Maple Playhouse,jMsj8TABDVI,"Humiliated over her crush, she sent anonymous photos, but texted the wrong hockey captain. #shorts",2026-06-17,74,106,3,0
YouTube,崔铭洋,UCctSzoeee7KCnR84dZ6IO7w,Maple Playhouse,_ZO8KLRKH1M,A Shameful School Exposure Led to an Accidental Steamy Mistake With Her Rival #drama #romantic,2026-06-17,1436,4302,53,2
YouTube,崔铭洋,UCctSzoeee7KCnR84dZ6IO7w,Maple Playhouse,4UXkF61FjXE,"She hid her family ties and avoided her brother’s rivals, fell for charming Shay Coleman. #shorts",2026-06-17,71,46,2,0
YouTube,崔铭洋,UCctSzoeee7KCnR84dZ6IO7w,Maple Playhouse,ThyZWuBu_oA,"She fled her mafia husband after a misunderstanding, losing one twin baby seven years ago. #shorts",2026-06-17,77,1211,27,0
YouTube,崔铭洋,UCctSzoeee7KCnR84dZ6IO7w,Maple Playhouse,a3ea1wZHAt4,She fled his bullying years ago; now she dares not love the broken man saving her. #shorts,2026-06-17,70,935,23,0
YouTube,崔铭洋,UCctSzoeee7KCnR84dZ6IO7w,Maple Playhouse,fm001V5zRf8,"She Sacrificed Fame for Him, Now Shines Without Him! #shorts #revenge",2026-06-17,57,1095,20,0
YouTube,崔铭洋,UCctSzoeee7KCnR84dZ6IO7w,Maple Playhouse,hpo8O8TQtzQ,👩🏻‍🍳She Gave Up Her Crown as Cooking Queen to Support Her Husband... #drama #cooking,2026-06-17,2698,400,5,0
YouTube,崔铭洋,UCctSzoeee7KCnR84dZ6IO7w,Maple Playhouse,QLWKuxg1hYY,"She Entered War College to Survive, Only to Mate With Her Deadliest Enemy #shorts #werewolf",2026-06-16,58,1576,39,0
YouTube,崔铭洋,UCctSzoeee7KCnR84dZ6IO7w,Maple Playhouse,vYsehBf-mHw,A Music Student’s Dangerous Secret: Her Strict Professor Ignites A Torrid Forbidden Affair #drama,2026-06-16,2170,712,7,0
YouTube,崔铭洋,UCctSzoeee7KCnR84dZ6IO7w,Maple Playhouse,yZPNpgyqh7Q,"She Chose Love Over Royal Duty, Now She Takes Back Her Throne! #drama #werewolf",2026-06-16,1439,318,4,0
YouTube,崔铭洋,UCctSzoeee7KCnR84dZ6IO7w,Maple Playhouse,zEgiAKNGCro,"Married at First Sight, Haunted by Her Hidden Past! #shorts #romantic",2026-06-16,69,1456,34,0
YouTube,崔铭洋,UCctSzoeee7KCnR84dZ6IO7w,Maple Playhouse,6OIAnHFGut0,"Rival Athletes Bound By Duty And Scorching Attraction, Only One Gets To Chase Their Dream. #shorts",2026-06-16,51,974,17,0
YouTube,崔铭洋,UCctSzoeee7KCnR84dZ6IO7w,Maple Playhouse,LWrBEXXodUI,"Forced to Marry a Creep, She Discovers She’s Already Wed to CEO Cole McBride... #shorts",2026-06-16,67,1490,33,0
YouTube,崔铭洋,UCctSzoeee7KCnR84dZ6IO7w,Maple Playhouse,igo0ADKhId0,Her Gambler Father Sold Her to Settle Debts? And Pregnant With the Mafia Lord’s Baby! #shorts,2026-06-16,75,1203,18,0
YouTube,崔铭洋,UCctSzoeee7KCnR84dZ6IO7w,Maple Playhouse,xrU1eBM4-ro,"Abandoned by Her First Mate, She Found a Secret Powerful Lover and Took Back Her Kingdom. #shorts",2026-06-16,64,1743,26,0
YouTube,崔铭洋,UCctSzoeee7KCnR84dZ6IO7w,Maple Playhouse,IxtkiRf7mbA,"Set Up by Her Roommate, She Accidentally Bore a Billionaire’s Heir #drama #revenge",2026-06-16,1433,498,6,0
YouTube,崔铭洋,UCctSzoeee7KCnR84dZ6IO7w,Maple Playhouse,BK7Q56YGv6o,"🏒Forced to assist her hockey rival, the skater slowly fell for her biggest enemy. #drama #romantic",2026-06-15,1491,6828,94,0
