platform,operator,channel_id,channel_name,video_id,video_title,published_date,duration_sec,views,likes,comments
YouTube,еҲҳдҝҠй’Ұ,UC77WdDKy6cbCxZkC46eaudA,Drama addict,j-YHxUSCDcY,From a Kiss to True Love: Falling for the Underground KingвҖ”A Heart-Pounding RomanceвқӨпёҸвңЁ,2026-05-13,46,15922,181,10
YouTube,еҲҳдҝҠй’Ұ,UC77WdDKy6cbCxZkC46eaudA,Drama addict,h9Nn66gPERA,A Fated Contract: The Blind Boy Falls for a Mysterious Witch. Can a Touch Restore His Sight?рҹҳҺрҹ‘Җ,2026-05-12,1138,7714,93,1
YouTube,еҲҳдҝҠй’Ұ,UC77WdDKy6cbCxZkC46eaudA,Drama addict,_jHAx76lFRk,Ordinary Girl vs. Billionaire Heir: A Doctor's Error Made Me His Only Hope!рҹҢ№вқӨпёҸ,2026-05-12,1933,10022,105,2
YouTube,еҲҳдҝҠй’Ұ,UC77WdDKy6cbCxZkC46eaudA,Drama addict,TqKpLQCSuAI,"In the ring, heвҖҷs a wild beast; outside, heвҖҷs the guardian angel for the fallen heiressрҹӨңрҹҳҮFix You",2026-05-11,1549,5886,49,2
YouTube,еҲҳдҝҠй’Ұ,UC77WdDKy6cbCxZkC46eaudA,Drama addict,R_db9_rTVDU,Abandon the scumbag ex and turn to embrace the iron-blooded boxerрҹӨңрҹ«ӮFix You Full Movie,2026-05-11,1428,58521,187,7
YouTube,еҲҳдҝҠй’Ұ,UC77WdDKy6cbCxZkC46eaudA,Drama addict,Kc5VPyIO3bo,"My scumbag ex betrayed me, but his uncle treated me like a queenрҹҢ№вқӨпёҸ",2026-05-10,1099,6578,85,1
YouTube,еҲҳдҝҠй’Ұ,UC77WdDKy6cbCxZkC46eaudA,Drama addict,eodzty2Dcsk,"A billionaire falls in love with a single mother, have we met somewhere before?рҹҢ№вқӨпёҸYou Drive Me Crazy",2026-05-10,1451,5321,43,1
YouTube,еҲҳдҝҠй’Ұ,UC77WdDKy6cbCxZkC46eaudA,Drama addict,as_k-M6lWds,"If the price of loving you is losing my life, I am willingрҹҘІрҹ’”The Price of Loving You",2026-05-09,1716,10827,103,3
YouTube,еҲҳдҝҠй’Ұ,UC77WdDKy6cbCxZkC46eaudA,Drama addict,pILChw6fvcE,"I thought I could change your feelings for me, but it turned out to be just my wishful thinkingрҹҘІрҹҘҖ",2026-05-09,1581,3082,38,0
YouTube,еҲҳдҝҠй’Ұ,UC77WdDKy6cbCxZkC46eaudA,Drama addict,LbctNKZAIDI,"It was originally a deal, but a special bond developed with a mortal enemyвңЁвқӨпёҸThe Tutor Trap",2026-05-08,1638,28119,257,1
YouTube,еҲҳдҝҠй’Ұ,UC77WdDKy6cbCxZkC46eaudA,Drama addict,LsSLUSHMPWg,"I made a deal with my nemesis, but he had other intentions towards meрҹ”ҘрҹҢ№The Tutor Trap",2026-05-08,1212,15945,158,7
YouTube,еҲҳдҝҠй’Ұ,UC77WdDKy6cbCxZkC46eaudA,Drama addict,jz1Lwc_GiEw,"Only her kiss can save him, but it costs her life. What will she choose?рҹ’үрҹ’”",2026-05-07,1647,12646,121,6
YouTube,еҲҳдҝҠй’Ұ,UC77WdDKy6cbCxZkC46eaudA,Drama addict,GvINRUt5Sqs,"Mating will kill her, but not mating will kill HIM! The Alpha KingвҖҷs impossible choice. рҹҗәрҹ’”",2026-05-07,1172,11919,81,0
YouTube,еҲҳдҝҠй’Ұ,UC77WdDKy6cbCxZkC46eaudA,Drama addict,5J002WhVtMA,"вңЁTo pay off my debt, I was forced to move into my 'arch-enemy's' mansion as a maid...рҹҘҖ| Vicious",2026-05-06,1924,242538,1562,31
YouTube,еҲҳдҝҠй’Ұ,UC77WdDKy6cbCxZkC46eaudA,Drama addict,MQITnrJwtbg,"After being betrayed by a scumbag, I directly romanced my husband's uncleвқӨпёҸрҹ’Һ",2026-05-06,1547,17725,74,3
YouTube,еҲҳдҝҠй’Ұ,UC77WdDKy6cbCxZkC46eaudA,Drama addict,iFgfhxPp5AA,"It was just an agreement, but unexpectedly the president developed feelingsрҹ§‘вҖҚрҹ’јFull Movie",2026-05-05,928,2782,21,1
YouTube,еҲҳдҝҠй’Ұ,UC77WdDKy6cbCxZkC46eaudA,Drama addict,4rW548e9M0c,From Fake to Fate: I Captured the Billionaire's Heart! рҹ’ҺвқӨпёҸBaby Trapped by the Billionaire,2026-05-04,1316,6204,51,2
YouTube,еҲҳдҝҠй’Ұ,UC77WdDKy6cbCxZkC46eaudA,Drama addict,43XjyJfHvGY,"Away from the dangerous ex, I turned and fell into the arms of the empire's princeрҹӨҙрҹҢ№",2026-05-03,1370,20303,161,2
YouTube,еҲҳдҝҠй’Ұ,UC77WdDKy6cbCxZkC46eaudA,Drama addict,A2JZXXdRai8,рҹҳұHe revealed his identity as the Lord of Hell to save meрҹҳҲрҹҘҖ | Lucifer's Bride,2026-05-03,1160,39614,308,7
YouTube,еҲҳдҝҠй’Ұ,UC77WdDKy6cbCxZkC46eaudA,Drama addict,RE1AjeJkLCE,"My parents despise me, my younger sister hates me, yet the CEO treasures me like a jewel рҹ’ҺрҹҢ№",2026-05-02,1066,113816,467,3
YouTube,еҲҳдҝҠй’Ұ,UC77WdDKy6cbCxZkC46eaudA,Drama addict,Hxm06ZEMF1s,"рҹ”ҘThe Billionaire CEO Fell for a Country Girl.рҹҷҚвҖҚвҷҖпёҸCEO, whatвҖҷs between us is only a dealрҹҘҖрҹҘҖ",2026-05-02,1654,51105,208,2
YouTube,еҲҳдҝҠй’Ұ,UC77WdDKy6cbCxZkC46eaudA,Drama addict,VJiWopXenn4,рҹ‘ЁвҖҚрҹ’јвңЁMarried to a CEO: The Country Girl's High Society Survival Guide | Binge Watch,2026-05-01,1143,9382,89,1
YouTube,еҲҳдҝҠй’Ұ,UC77WdDKy6cbCxZkC46eaudA,Drama addict,zhrdHvXuCVE,рҹҢҠCrossing the Line: The Maid & The Megastar's Forbidden RomanceрҹҢ№рҹӨ©| Breathe,2026-04-30,1624,3612,55,1
YouTube,еҲҳдҝҠй’Ұ,UC77WdDKy6cbCxZkC46eaudA,Drama addict,7a2wUHkGCGs,"Billionaires pretend to be foolish, healthy husbands pretend to be lame, whyрҹӨ”рҹҳ¶вҖҚрҹҢ«пёҸ",2026-04-30,1867,7262,73,2
YouTube,еҲҳдҝҠй’Ұ,UC77WdDKy6cbCxZkC46eaudA,Drama addict,_fH9eSV3heM,"вңЁвқӨпёҸHe cares about me, yet pretends to be indifferentрҹҘҖ | Full Movie | How to Break a DILF",2026-04-29,1097,36316,183,3
YouTube,еҲҳдҝҠй’Ұ,UC77WdDKy6cbCxZkC46eaudA,Drama addict,RJD9DGmHvjA,"рҹ”ҘI hate my stepbrother, but now I have no choice but to live under the same roofвңЁ",2026-04-28,1512,21574,148,3
YouTube,еҲҳдҝҠй’Ұ,UC77WdDKy6cbCxZkC46eaudA,Drama addict,vQvWtSRIoe4,"рҹҘІрҹҘҖSecret Love: I love you, but I cannot be with you | The Boy I Hate",2026-04-28,1201,93121,329,7
YouTube,еҲҳдҝҠй’Ұ,UC77WdDKy6cbCxZkC46eaudA,Drama addict,SFdjoLVtb90,"рҹҘҖрҹҘҖNo! You are my best friend's brother, we can't be together | The Boy I Hate",2026-04-27,1229,34706,221,3
YouTube,еҲҳдҝҠй’Ұ,UC77WdDKy6cbCxZkC46eaudA,Drama addict,-VGotTivHGs,"рҹҳ–On one side is friendship, on the other is love, what will she choose? Full MovieрҹҢ№The Boy I Hate",2026-04-27,1162,18609,68,0
YouTube,еҲҳдҝҠй’Ұ,UC77WdDKy6cbCxZkC46eaudA,Drama addict,Z4wLH3aUoI0,"рҹҘІA vicious woman ruined us! Four years later, my ex becomes my overprotective stepbrotherрҹҢ№",2026-04-26,923,1868,13,0
YouTube,еҲҳдҝҠй’Ұ,UC77WdDKy6cbCxZkC46eaudA,Drama addict,qNUzzqf2aB0,"рҹҳ®To hide my secret, I got together with my arch-nemesis | Breaking the Deal with My Hockey Bad Boy",2026-04-25,1529,161013,990,26
YouTube,еҲҳдҝҠй’Ұ,UC77WdDKy6cbCxZkC46eaudA,Drama addict,14ZntbPe570,"рҹҢ№My brother warned him to stay away from me, but he knocked on my door in the middle of the night...",2026-04-25,1312,71687,327,5
YouTube,еҲҳдҝҠй’Ұ,UC77WdDKy6cbCxZkC46eaudA,Drama addict,wQjATPRxJU8,"Absolute taboo! I am your boss, we must not cross the lineвҖҰрҹҢ№вқӨпёҸCorrupting My Billionaire Boss's Heart",2026-04-24,1238,6850,64,1
YouTube,еҲҳдҝҠй’Ұ,UC77WdDKy6cbCxZkC46eaudA,Drama addict,Vd_8EF9B2Ng,вқӨпёҸCan't Resist: I Fell in Love with My Brother's Best Friendрҹ”ҘрҹҢ№,2026-04-24,1428,424044,2226,31
YouTube,еҲҳдҝҠй’Ұ,UC77WdDKy6cbCxZkC46eaudA,Drama addict,kjaK5PxWclQ,"Dump My Cheating Ex, Then Get Spoiled Rotten by My BrotherвҖҷs Best Friend!вқӨпёҸрҹҢ№",2026-04-23,1671,26533,197,3
YouTube,еҲҳдҝҠй’Ұ,UC77WdDKy6cbCxZkC46eaudA,Drama addict,AzWmhYKZLYM,"He Made My Life Miserable, Then I Had to Move Into His Mega-Mansion рҹ§№рҹ’”Nanny to My Hot Bully",2026-04-22,1234,72287,462,7
YouTube,еҲҳдҝҠй’Ұ,UC77WdDKy6cbCxZkC46eaudA,Drama addict,T0X9ctn1k-E,"They were supposed to be a fake couple, but unexpectedly both fell into the whirlpool of loveрҹ”Ҙ",2026-04-21,1774,234261,1625,28
YouTube,еҲҳдҝҠй’Ұ,UC77WdDKy6cbCxZkC46eaudA,Drama addict,G1NUPoQx4KI,"FAKE DATING FAILS: When the ""Pretend"" Kisses Start Feeling Way Too Real... рҹҳі",2026-04-21,1496,131230,771,13
YouTube,еҲҳдҝҠй’Ұ,UC77WdDKy6cbCxZkC46eaudA,Drama addict,_sePRWmxPok,What Happens When Your Bestie Steals Your Voice AND Your Man? You Show Her Who's Boss. рҹ’…вңЁ,2026-04-20,1671,72810,722,15
YouTube,еҲҳдҝҠй’Ұ,UChhBhc7qJ42rgzAIPe9z6Cg,LittleDrama,HQBfrfKk_Ig,Arch-enemies turned lovers! The werewolf and vampire went to war for her!рҹҗәвҡ”пёҸрҹ§ӣ,2026-06-11,1632,323,8,0
YouTube,еҲҳдҝҠй’Ұ,UChhBhc7qJ42rgzAIPe9z6Cg,LittleDrama,BfyanrUU7fY,She discovered her boyfriend's secretрҹҳ®#shorts #shortdrama #mustwatch,2026-06-09,103,1099,14,0
YouTube,еҲҳдҝҠй’Ұ,UChhBhc7qJ42rgzAIPe9z6Cg,LittleDrama,WDV2fyv_rBI,He is the boss of this prisonвҳ пёҸрҹҳұ#shorts #shortdrama #film,2026-06-09,146,1070,22,0
YouTube,еҲҳдҝҠй’Ұ,UChhBhc7qJ42rgzAIPe9z6Cg,LittleDrama,MFqyMMpibCc,He purchased this necklace with absolute strengthрҹ“ҝрҹҳҺ#shorts #shortdrama #mustwatch,2026-06-02,89,1868,36,0
YouTube,еҲҳдҝҠй’Ұ,UChhBhc7qJ42rgzAIPe9z6Cg,LittleDrama,aqlXHbc9mRc,The most taboo love triangle: How should I choose between these two brothers?вқӨпёҸрҹӨ”,2026-05-28,1580,434,5,0
YouTube,еҲҳдҝҠй’Ұ,UChhBhc7qJ42rgzAIPe9z6Cg,LittleDrama,cD1VGmZaWdY,He has different feelings for himрҹҳ®вқӨпёҸ#shortdrama #love #shorts,2026-05-27,60,1727,17,1
YouTube,еҲҳдҝҠй’Ұ,UChhBhc7qJ42rgzAIPe9z6Cg,LittleDrama,hzj2is-Lcu4,She caused a commotion in the cockpit just to make the plane turn aroundвңҲпёҸрҹҳұ#shortdrama #shorts,2026-05-27,37,9722,41,1
YouTube,еҲҳдҝҠй’Ұ,UChhBhc7qJ42rgzAIPe9z6Cg,LittleDrama,QTycjHqghy8,"""Sleep with me before my 30th birthday, or I'll DIE!"" The Alpha King's Cursed Bride.рҹҗәрҹ‘°",2026-05-26,1017,345,4,0
YouTube,еҲҳдҝҠй’Ұ,UChhBhc7qJ42rgzAIPe9z6Cg,LittleDrama,j6-gbK-mXg0,"Escape from the scumbag ex, embrace the cold CEO, I know you love meрҹҳҺрҹҢ№Seducing Mr. Larsen",2026-05-25,1235,164,2,0
YouTube,еҲҳдҝҠй’Ұ,UChhBhc7qJ42rgzAIPe9z6Cg,LittleDrama,SLFEEEUrShU,His special petрҹҗҚрҹ•·пёҸ#shortdrama #shorts #pet,2026-05-25,53,4965,16,0
YouTube,еҲҳдҝҠй’Ұ,UChhBhc7qJ42rgzAIPe9z6Cg,LittleDrama,o6uMw3ce2Dk,She almost ended up with her ex-husband's father-in-lawрҹҳұвқӨпёҸ#shorts  #love  #shortdrama,2026-05-25,57,80,1,0
YouTube,еҲҳдҝҠй’Ұ,UChhBhc7qJ42rgzAIPe9z6Cg,LittleDrama,4sOjsKMrvas,"He Is Desperately Searching For a Genius Hacker, Unknowing She Is Actually His New Wife!рҹҳ®рҹҳҶ",2026-05-21,1188,176,4,0
YouTube,еҲҳдҝҠй’Ұ,UChhBhc7qJ42rgzAIPe9z6Cg,LittleDrama,kkzz8sL2S6s,"A forbidden love sparked by a car accident: Uncle, what are you doing here?рҹҢ№рҹҡ—Full Movie",2026-05-19,1288,248,2,0
YouTube,еҲҳдҝҠй’Ұ,UChhBhc7qJ42rgzAIPe9z6Cg,LittleDrama,QTHTjvmIpE4,BillionaireвҖҷs Fake Flash Marriage to a Village Girl Turns Real Loveрҹҳ®рҹҢ№Country Gal to CEO's Bride,2026-05-19,1971,155,1,0
YouTube,еҲҳдҝҠй’Ұ,UChhBhc7qJ42rgzAIPe9z6Cg,LittleDrama,akxLgH_DCks,"He was originally my husband's uncle, but everything changed after that nightрҹҳ®вңЁ",2026-05-18,1414,106,1,0
YouTube,еҲҳдҝҠй’Ұ,UChhBhc7qJ42rgzAIPe9z6Cg,LittleDrama,BR-ChF2LAO4,My homeless husband from a whirlwind marriage turned out to be the king of the mafia!рҹҳұвӣ“пёҸ,2026-05-18,1723,2467,25,0
YouTube,еҲҳдҝҠй’Ұ,UChhBhc7qJ42rgzAIPe9z6Cg,LittleDrama,sXNj7ZTbeZo,"The prince ruined my reputation, should I save him now?рҹӨ”#shortdrama #shorts #prince",2026-05-17,86,892,7,0
YouTube,еҲҳдҝҠй’Ұ,UChhBhc7qJ42rgzAIPe9z6Cg,LittleDrama,BPhRGpYgIGc,What should I do? I kissed the prince in front of the whole schoolрҹҳ°#shorts #shortdrama,2026-05-17,50,1777,10,0
YouTube,еҲҳдҝҠй’Ұ,UChhBhc7qJ42rgzAIPe9z6Cg,LittleDrama,YxzjZmXFc_w,She kicked the school bully to the groundрҹҳҶрҹҳҶ#shorts #funny #schoolbully,2026-05-16,88,16237,266,1
YouTube,еҲҳдҝҠй’Ұ,UChhBhc7qJ42rgzAIPe9z6Cg,LittleDrama,gAlk_TX-KJw,"The school bully harasses classmates, and the new transfer student steps in to helpрҹҳ®вңЁ#shorts #fyp",2026-05-16,57,3679,70,1
YouTube,еҲҳдҝҠй’Ұ,UChhBhc7qJ42rgzAIPe9z6Cg,LittleDrama,UnHTys50wgg,"I saved a classmate out of righteousness, yet I became the target of the school bullyрҹҳ°#shorts #film",2026-05-16,101,2286,88,1
YouTube,еҲҳдҝҠй’Ұ,UChhBhc7qJ42rgzAIPe9z6Cg,LittleDrama,YVOEnz4NXX0,She is actually willing to marry a beggarрҹҳ®вқӨпёҸ#shortdrama  #love #begger #shorts,2026-05-15,107,1313,19,0
YouTube,еҲҳдҝҠй’Ұ,UChhBhc7qJ42rgzAIPe9z6Cg,LittleDrama,_3s6WpVj_R4,Loving Lucifer: He is my nightmare and my only escapeрҹ–ӨрҹҢ№Lucifer's Bride,2026-05-13,1691,39159,422,9
YouTube,еҲҳдҝҠй’Ұ,UChhBhc7qJ42rgzAIPe9z6Cg,LittleDrama,GmuXbRQgLNI,"""You're Just My Prey!"" When the Cold Lucifer Meets His Innocent Bride, He Loses Control!рҹ‘°рҹҳҲ",2026-05-12,1609,59536,484,9
YouTube,еҲҳдҝҠй’Ұ,UChhBhc7qJ42rgzAIPe9z6Cg,LittleDrama,xw_G15u8Sks,"When the target is my first love, the mission is doomedвқӨпёҸрҹ”ҘThe Hitwoman Full Movie",2026-05-11,1587,380,8,0
YouTube,еҲҳдҝҠй’Ұ,UChhBhc7qJ42rgzAIPe9z6Cg,LittleDrama,PlAi7WV12b4,"Dumped by the Beta, Claimed by the Alpha Brother!рҹҳ®рҹҢ№Claimed by My Ex's Alpha Brother",2026-05-08,1363,6802,91,0
YouTube,еҲҳдҝҠй’Ұ,UChhBhc7qJ42rgzAIPe9z6Cg,LittleDrama,ErqtPWrOJRo,вңЁрҹҢ№Forbidden Love: I Think I Fell for My Dad's Friend | How to Break a DILF,2026-04-27,1392,133294,778,9
YouTube,еҲҳдҝҠй’Ұ,UChhBhc7qJ42rgzAIPe9z6Cg,LittleDrama,AnIXGFPN5YE,"рҹ”ҘвқӨпёҸThought it was a contractual marriage, but the gangster boss took it seriously!",2026-04-23,1707,1335,18,0
YouTube,еҲҳдҝҠй’Ұ,UChhBhc7qJ42rgzAIPe9z6Cg,LittleDrama,lWYfMClow00,I Was Forced to Live With My Ultimate Rival... Now I'm His Secret Nanny! рҹ§№вңЁ,2026-04-21,1519,41152,239,2
YouTube,еҲҳдҝҠй’Ұ,UChhBhc7qJ42rgzAIPe9z6Cg,LittleDrama,9xd3HFI33yM,вқӨпёҸрҹҢ№Dancing with the devil: The CEO's ultimate temptation and absolute possession!,2026-04-19,1285,30757,123,2
YouTube,еҲҳдҝҠй’Ұ,UChhBhc7qJ42rgzAIPe9z6Cg,LittleDrama,wJbucGeh8s8,Provoked the city's most dangerous man! The crazy boss spoils me to the heavens?!рҹҢ№рҹҢ№,2026-04-17,1472,79011,520,2
YouTube,еҲҳдҝҠй’Ұ,UChhBhc7qJ42rgzAIPe9z6Cg,LittleDrama,uB9BmvA_Pdo,вӣ“пёҸThe assassin I saved by chance is none other than my fiancГ©'s brother | Love Is a Dangerous Dance,2026-04-15,1606,2946,24,0
YouTube,еҲҳдҝҠй’Ұ,UChhBhc7qJ42rgzAIPe9z6Cg,LittleDrama,GwuLLisKSEo,"рҹҘІI died, but I was rebornвҖ”all to make my husband get the punishment he deservesвӣ“пёҸ",2026-04-14,1052,481,3,0
YouTube,еҲҳдҝҠй’Ұ,UChhBhc7qJ42rgzAIPe9z6Cg,LittleDrama,OF1tB60Smwc,"рҹ’”I loved him for ten years, only to find he saw me as nothing but a toolрҹҘҖ",2026-04-14,879,1008,9,0
YouTube,еҲҳдҝҠй’Ұ,UChhBhc7qJ42rgzAIPe9z6Cg,LittleDrama,rMiVwfdruNg,рҹҳ®The father she has been searching for four years turns out to be the world's largest arms dealerрҹ”Ҙ,2026-04-13,1281,2270,26,0
YouTube,еҲҳдҝҠй’Ұ,UChhBhc7qJ42rgzAIPe9z6Cg,LittleDrama,SgboOoBM8hM,рҹ”ҘIвҖҷm actually a wealthy manрҹҳҺbut I can be a poor guy if thatвҖҷs what you likeрҹҢ№,2026-04-13,449,3095,10,2
YouTube,еҲҳдҝҠй’Ұ,UChhBhc7qJ42rgzAIPe9z6Cg,LittleDrama,Q7up90bZUN8,рҹ”ҘрҹҰ№вҖҚвҷӮпёҸForbidden Love: I Fell in Love with the Mafia Boss | Monster in His Eyes,2026-04-12,1071,4185,28,0
YouTube,еҲҳдҝҠй’Ұ,UChhBhc7qJ42rgzAIPe9z6Cg,LittleDrama,hU5Scv_ahsI,"рҹҰ№вҖҚвҷӮпёҸвқӨпёҸEveryone fears him, but I want to get close to him | Monster in His Eyes",2026-04-11,1271,13100,77,3
YouTube,еҲҳдҝҠй’Ұ,UChhBhc7qJ42rgzAIPe9z6Cg,LittleDrama,MGiLsMs1I8Q,рҹҳ®вқӨпёҸLove at first sight вҖ” the domineering love of the Mafia boss | In the Palm of His Hand,2026-04-10,775,15603,51,1
YouTube,еҲҳдҝҠй’Ұ,UChhBhc7qJ42rgzAIPe9z6Cg,LittleDrama,zXCsRrlxFBg,рҹ’”рҹҘІMy boyfriend sold me to the boss of the mafia | In the Palm of His Hand,2026-04-09,853,5727,41,0
YouTube,еҲҳдҝҠй’Ұ,UChhBhc7qJ42rgzAIPe9z6Cg,LittleDrama,HUdgYk62Zq4,"вңЁрҹҳҺMy three brothers are top tycoons | After Divorce, I'm Spoiled by Three Brothers",2026-04-08,1372,1206,19,0
YouTube,еҲҳдҝҠй’Ұ,UChhBhc7qJ42rgzAIPe9z6Cg,LittleDrama,jWgUCYSEnYg,"рҹҳ®I only found out I was a rich girl after my divorce | After Divorce, I'm Spoiled by Three Brothers",2026-04-08,1339,2740,39,3
YouTube,еҲҳдҝҠй’Ұ,UChhBhc7qJ42rgzAIPe9z6Cg,LittleDrama,-mKFkm6BKzA,рҹҳ®A Secret I CanвҖҷt Let My Brother Know вҖ“ My Secret Crush | I'm In Love With My Brother's Best Friend,2026-04-06,802,3407,26,0
YouTube,еҲҳдҝҠй’Ұ,UChhBhc7qJ42rgzAIPe9z6Cg,LittleDrama,0rNp8XZ_hrg,"вқӨпёҸComplicated love, it seems my friend's sister likes me | I'm In Love With My Brother's Best Friend",2026-04-05,1153,62287,274,3
YouTube,еҲҳдҝҠй’Ұ,UChhBhc7qJ42rgzAIPe9z6Cg,LittleDrama,pETi48yor8M,вқӨпёҸрҹ«¶I have developed feelings for my brother's friend | I'm In Love With My Brother's Best Friend?!,2026-04-05,1341,130775,569,2
YouTube,еҲҳдҝҠй’Ұ,UChhBhc7qJ42rgzAIPe9z6Cg,LittleDrama,kLXiub80saE,"рҹ”ҘAs long as IвҖҷm here, I wonвҖҷt let you suffer any more unfair treatment | Surrender to My Professor",2026-04-04,18,54753,205,3
YouTube,еҲҳдҝҠй’Ұ,UChhBhc7qJ42rgzAIPe9z6Cg,LittleDrama,G-QyiiJAXEY,рҹҳұвқӨпёҸForbidden Love: I had a relationship with my professor | Surrender to My Professor,2026-04-04,10,31420,104,0
YouTube,еҲҳдҝҠй’Ұ,UChhBhc7qJ42rgzAIPe9z6Cg,LittleDrama,FjohhLxcBGk,вңЁMy Unspeakable Secret with the Professor | Surrender to My Professor,2026-04-03,52,81358,396,4
YouTube,еҲҳдҝҠй’Ұ,UChhBhc7qJ42rgzAIPe9z6Cg,LittleDrama,43WbGZkxn1g,"рҹ’”рҹҳӯHe only saw the truth when I was dying |  Dear Brother, You Loved Me Too Late",2026-04-02,738,2819,14,0
YouTube,еҲҳдҝҠй’Ұ,UChhBhc7qJ42rgzAIPe9z6Cg,LittleDrama,kR2oezMMaVM,"рҹ’”рҹҳӯMy beloved brother actually wished I was dead | Dear Brother, You Loved Me Too Late",2026-04-02,1275,4285,26,1
YouTube,еҲҳдҝҠй’Ұ,UChhBhc7qJ42rgzAIPe9z6Cg,LittleDrama,QwXwjzn2uvg,"рҹҺўвңЁI hate him, yet I can't stop thinking about him | My Stepbrother's Dirty Secret",2026-04-01,945,4234,31,0
YouTube,еҲҳдҝҠй’Ұ,UChhBhc7qJ42rgzAIPe9z6Cg,LittleDrama,5IxQ-jSCBrY,вңЁрҹ«¶My Stepbrother Pretends Not to Know Me at School | My Stepbrother's Dirty Secret,2026-04-01,684,393018,1498,18
YouTube,еҲҳдҝҠй’Ұ,UChhBhc7qJ42rgzAIPe9z6Cg,LittleDrama,sI1dX0jotdc,"рҹҺўвқӨпёҸI Hate My Stepbrother, But He Saved My Life | My Stepbrother's Dirty Secret",2026-04-01,1102,3132,27,0
YouTube,еҲҳдҝҠй’Ұ,UChhBhc7qJ42rgzAIPe9z6Cg,LittleDrama,nkWsX-ZKaiM,вқӨпёҸрҹ«¶My enemy boss seems to have fallen for me | Scandalous,2026-03-31,813,77368,539,5
YouTube,еҲҳдҝҠй’Ұ,UChhBhc7qJ42rgzAIPe9z6Cg,LittleDrama,cFdW7RVDJlY,My first love asked me to pretend to be his fake girlfriendрҹӨ”| Pucked in the Friend Zone,2026-03-30,658,40005,256,9
YouTube,еҲҳдҝҠй’Ұ,UChhBhc7qJ42rgzAIPe9z6Cg,LittleDrama,51_6qY22WPM,"He broke my heart completely, yet I still love himвқӨпёҸвҖҚрҹ©№ | Pucked in the Friend Zone",2026-03-30,1102,13766,77,1
YouTube,еҲҳдҝҠй’Ұ,UChhBhc7qJ42rgzAIPe9z6Cg,LittleDrama,izNF9hBm3mU,She is falling into the embrace of love | Breathe,2026-03-28,825,27551,175,4
YouTube,еҲҳдҝҠй’Ұ,UChhBhc7qJ42rgzAIPe9z6Cg,LittleDrama,Sw8XQIsap3c,She fell in love with the person she sought revenge against | Scandalous,2026-03-27,927,11248,49,0
YouTube,еҲҳдҝҠй’Ұ,UChhBhc7qJ42rgzAIPe9z6Cg,LittleDrama,IoMrkTiomvQ,"I didn't want to reveal my identity, but you bullied my sister. | My Sister Is the Warlord Queen",2026-03-25,1312,5812,52,2
YouTube,еҲҳдҝҠй’Ұ,UChhBhc7qJ42rgzAIPe9z6Cg,LittleDrama,HuGo9mRHu-4,Everyone thought she was just a cleanerвҖҰ until she revealed her true identity. | Complete collection,2026-03-25,1191,4420,24,0
YouTube,еҲҳдҝҠй’Ұ,UC80LfoIH6FrzHTm6lXTWCKQ,DramaStory,pJMDlTlIVLg,Top-tier professor vs genius female student: who will fall first in this round?вқӨпёҸрҹҢ№Dark Notes,2026-06-14,1277,8,1,0
YouTube,еҲҳдҝҠй’Ұ,UC80LfoIH6FrzHTm6lXTWCKQ,DramaStory,ibhb2K5uLbc,Contract Marriage With A Ruthless Mafia Boss... But He Fell First! вқӨпёҸвҖҚрҹ”ҘRuthless Mafia Daddy,2026-06-13,1137,549,15,1
YouTube,еҲҳдҝҠй’Ұ,UC80LfoIH6FrzHTm6lXTWCKQ,DramaStory,LnSWkLmTykA,A single IVF accident ended up making me pregnant with a gangster boss's child!!рҹҳ®рҹҢ№,2026-06-13,987,1281,24,0
YouTube,еҲҳдҝҠй’Ұ,UC80LfoIH6FrzHTm6lXTWCKQ,DramaStory,RlWQ12RCRgE,"My Jerk Ex Rejected Me, Not Knowing IвҖҷm The Powerful Wolf Princess! рҹ‘‘Never Reject A Wolf Princess",2026-06-12,1047,496,6,0
YouTube,еҲҳдҝҠй’Ұ,UC80LfoIH6FrzHTm6lXTWCKQ,DramaStory,QDD2zkWcgaY,"You are my partner, but we can't be togetherрҹҳўрҹҗәIn Love with the Alpha",2026-06-11,1451,2776,42,0
YouTube,еҲҳдҝҠй’Ұ,UC80LfoIH6FrzHTm6lXTWCKQ,DramaStory,H2pcazYiwko,"No useless wolf? Nah, it's the supreme Luna!рҹҗәрҹ‘‘In Love with the Alpha",2026-06-11,1602,6287,102,3
YouTube,еҲҳдҝҠй’Ұ,UC80LfoIH6FrzHTm6lXTWCKQ,DramaStory,JLsHlrpDGo0,"""I'm Not Into Guys..."" Proceeds to Stare At Him For 5 Minutes Straight. рҹҳӮвқӨпёҸStableboy",2026-06-10,1181,38493,536,6
YouTube,еҲҳдҝҠй’Ұ,UC80LfoIH6FrzHTm6lXTWCKQ,DramaStory,frpiu_TV84A,Ex becomes stepson! She Married His Billionaire Mafia Dad After Being Cheated On! рҹӨҜрҹҳ®,2026-06-10,1623,701,7,0
YouTube,еҲҳдҝҠй’Ұ,UC80LfoIH6FrzHTm6lXTWCKQ,DramaStory,OCYHxTwtR3A,"Forced to marry the rumored demon brother, unexpectedly pampered to the skyвқӨпёҸрҹҢ№",2026-06-09,1548,1792,21,0
YouTube,еҲҳдҝҠй’Ұ,UC80LfoIH6FrzHTm6lXTWCKQ,DramaStory,RSkORQRDHXg,"On one side is a hated first love, on the other a betraying scumbag; how should she chooseрҹҳўрҹҘҖ",2026-06-09,13,3704,21,0
YouTube,еҲҳдҝҠй’Ұ,UC80LfoIH6FrzHTm6lXTWCKQ,DramaStory,ITAJ_txwE8Y,"Forbidden Mission: Seduce DadвҖҷs Foe, Only to Be Trapped by a Powerful TycoonвқӨпёҸрҹҢ№Scandalous Full Movie",2026-06-07,1499,23042,122,2
YouTube,еҲҳдҝҠй’Ұ,UC80LfoIH6FrzHTm6lXTWCKQ,DramaStory,7iAdn-dRBy8,"When a tsundere president meets a rugby star, they say they dislike them, but their body is honestвқӨпёҸ",2026-06-06,1188,6045,105,0
YouTube,еҲҳдҝҠй’Ұ,UC80LfoIH6FrzHTm6lXTWCKQ,DramaStory,fTqpSud9vhs,"Billionaire hunts worldwide for first love, who turns out to be his contract wifeрҹҳӮвқӨпёҸ",2026-06-05,604,5878,70,1
YouTube,еҲҳдҝҠй’Ұ,UC80LfoIH6FrzHTm6lXTWCKQ,DramaStory,YcdJRLLEYtg,"Searched 18 years for my first love, only to see her name on my marriage certificateрҹҳӮвқӨпёҸ",2026-06-05,1258,28669,195,0
YouTube,еҲҳдҝҠй’Ұ,UC80LfoIH6FrzHTm6lXTWCKQ,DramaStory,gFOlXXssQ64,What are the two of them doing?рҹҳӮ#shorts #shortdrama #mustwatch,2026-06-05,37,81,4,0
YouTube,еҲҳдҝҠй’Ұ,UC80LfoIH6FrzHTm6lXTWCKQ,DramaStory,wbITytWEyL8,The construction worker I married suddenly turned out to be the richest man throughoutвқӨпёҸрҹҢ№,2026-06-04,309,1006,5,0
YouTube,еҲҳдҝҠй’Ұ,UC80LfoIH6FrzHTm6lXTWCKQ,DramaStory,O1rqI0enOeA,"My scumbag ex humiliated me in public, but his brother held me in his armsвқӨпёҸрҹҢ№",2026-06-04,1345,29169,353,10
YouTube,еҲҳдҝҠй’Ұ,UC80LfoIH6FrzHTm6lXTWCKQ,DramaStory,2zJZEdW5iDk,"A love that transcends age, an abstinent older man falls for a proud young girlрҹҳұвқӨпёҸ",2026-06-03,1425,7233,33,0
YouTube,еҲҳдҝҠй’Ұ,UC80LfoIH6FrzHTm6lXTWCKQ,DramaStory,YMbuZaS5KTI,Forbidden love: Help! I accidentally fell for my DAD'S best friend!рҹҳұвқӨпёҸHow to Tame a Silver Fox,2026-06-03,1185,8341,50,0
YouTube,еҲҳдҝҠй’Ұ,UC80LfoIH6FrzHTm6lXTWCKQ,DramaStory,hHft5DWNmrM,"My fiancГ© betrayed me, so I turned around and married my billionaire ex-boyfriend!вқӨпёҸрҹҢ№",2026-06-02,1406,23554,230,2
YouTube,еҲҳдҝҠй’Ұ,UC80LfoIH6FrzHTm6lXTWCKQ,DramaStory,xXjTicy-RQA,"The mortal girl wields thunder, but I am the most perfect heir of the king of all gods!вҡЎрҹ”Ҙ",2026-06-02,1177,7818,80,0
YouTube,еҲҳдҝҠй’Ұ,UC80LfoIH6FrzHTm6lXTWCKQ,DramaStory,EzfRnacrQTA,"She is my mate, no one can hurt her, the declaration of the cold and ruthless wolf kingрҹҗәвқӨпёҸ",2026-06-01,1144,7191,69,3
YouTube,еҲҳдҝҠй’Ұ,UC80LfoIH6FrzHTm6lXTWCKQ,DramaStory,WmZtoh39sbs,"My scumbag fiancГ© betrayed me, so I turned and threw myself into his uncle's armsрҹҳ®рҹҢ№",2026-06-01,1171,7877,73,2
YouTube,еҲҳдҝҠй’Ұ,UC80LfoIH6FrzHTm6lXTWCKQ,DramaStory,2glXC5MAJEI,"A Mute Girl Falls for the Brutal Wolf King, My love for you speaks for itself.рҹҗәвқӨпёҸ",2026-05-31,1225,29806,187,1
YouTube,еҲҳдҝҠй’Ұ,UC80LfoIH6FrzHTm6lXTWCKQ,DramaStory,EqrizILDN-E,"The school bully set a trap for me, but unexpectedly he himself turned out to be the foolрҹҳҺрҹӨЎ",2026-05-30,1291,9693,77,2
YouTube,еҲҳдҝҠй’Ұ,UC80LfoIH6FrzHTm6lXTWCKQ,DramaStory,sxAvCrnmrJI,"We can't, I am your brother's girlfriendрҹҳ®вқӨпёҸA Hamptons Summer Affair with My BFF's Brother",2026-05-30,1380,48592,536,4
