platform,operator,channel_id,channel_name,video_id,video_title,published_date,duration_sec,views,likes,comments
YouTube,刘俊钦,UC77WdDKy6cbCxZkC46eaudA,Drama addict,tt9UE8bcKbw,The fake rich girl stole my identity? Then I’ll just humiliate you in front of the whole school😎🌹,2026-05-28,1081,701,3,0
YouTube,刘俊钦,UC77WdDKy6cbCxZkC46eaudA,Drama addict,UDxYGL8mwvo,"I thought he was my nightmare, but he turned out to be the sweet addiction I cannot quit❤️🌹",2026-05-27,978,1223,18,0
YouTube,刘俊钦,UC77WdDKy6cbCxZkC46eaudA,Drama addict,lm3rq7rxW0Y,"The malicious husband conspires with his mistress to harm his deaf and mute wife, what should she do",2026-05-27,862,879,8,0
YouTube,刘俊钦,UC77WdDKy6cbCxZkC46eaudA,Drama addict,YqztTMd7PCI,"Forbidden Love: The cursed and cold wolf king, only this human girl can lift his poison...🐺👧",2026-05-26,1489,431738,1868,22
YouTube,刘俊钦,UC77WdDKy6cbCxZkC46eaudA,Drama addict,uu8s_k3L8-4,Love Beyond Age: I Fell in Love with My Ex-Husband's Father-in-Law❤️🌹Seducing Mr. Larsen,2026-05-26,1431,5345,42,0
YouTube,刘俊钦,UC77WdDKy6cbCxZkC46eaudA,Drama addict,c_giVntGMVY,"My vicious best friend stole my voice, and now she even wants to...😰😱Mic Drop Diva",2026-05-25,1367,1394,21,0
YouTube,刘俊钦,UC77WdDKy6cbCxZkC46eaudA,Drama addict,QrC542QItv8,I've fallen in love with my brother's friend. What should I do?😰🥀,2026-05-25,1314,12965,81,2
YouTube,刘俊钦,UC77WdDKy6cbCxZkC46eaudA,Drama addict,DwvBItqIJSY,"The real heiress was replaced by her evil sister, and her brothers kicked her out! 🥲💔",2026-05-24,1162,694,12,0
YouTube,刘俊钦,UC77WdDKy6cbCxZkC46eaudA,Drama addict,CU99V03uqQc,"My scumbag ex betrayed me, so I stopped pretending and revealed my billionaire status😱👸",2026-05-23,1105,416,3,0
YouTube,刘俊钦,UC77WdDKy6cbCxZkC46eaudA,Drama addict,deaQX2IpC2A,The thug I accidentally saved turned out to be a billionaire ice hockey star😮🤾‍♂️Full Movie,2026-05-22,1305,14147,74,1
YouTube,刘俊钦,UC77WdDKy6cbCxZkC46eaudA,Drama addict,LzriFBMy3-w,🔥A passerby who kissed on the street turns out to be a billionaire abstinent CEO?!😮,2026-05-21,967,9262,55,1
YouTube,刘俊钦,UC77WdDKy6cbCxZkC46eaudA,Drama addict,85cMml0vsxg,"👸The real daughter rips apart the fake young master, without me you are just a servant🔥😎",2026-05-21,966,840,10,2
YouTube,刘俊钦,UC77WdDKy6cbCxZkC46eaudA,Drama addict,vCBCjyj9WMM,Provoking the Most Dangerous Man in School: From Mutual Hatred to Irresistible Obsession❤️🌹,2026-05-20,1282,6210,55,1
YouTube,刘俊钦,UC77WdDKy6cbCxZkC46eaudA,Drama addict,KnXQvKIUAg0,The school bully who torments me by day turns out to be my ADOPTED BROTHER at night?! 😱,2026-05-20,437,1914,15,0
YouTube,刘俊钦,UC77WdDKy6cbCxZkC46eaudA,Drama addict,KfBAuqUHp9w,Forbidden Love in an Elite Family: Forced to Propose to My Ex's Uncle to Fulfil Grandma's Last Wish🥀,2026-05-19,1763,951,16,0
YouTube,刘俊钦,UC77WdDKy6cbCxZkC46eaudA,Drama addict,tvKxE8ZG3JE,"Helping my best friend get revenge on a scumbag, only to see her marry him instead!🥀💔",2026-05-19,1451,1151,17,0
YouTube,刘俊钦,UC77WdDKy6cbCxZkC46eaudA,Drama addict,9OM6Aa3ZI5E,"Forbidden Billionaire Romance: Married to the nephew, but secretly pregnant by the Uncle!😮✨",2026-05-18,1542,3857,30,1
YouTube,刘俊钦,UC77WdDKy6cbCxZkC46eaudA,Drama addict,mGL8-FduX4Q,"After being abandoned by my scumbag fiancé, I turned around and married his boss!❤️🌹",2026-05-18,1813,14748,94,1
YouTube,刘俊钦,UC77WdDKy6cbCxZkC46eaudA,Drama addict,76ozZ_CKn5g,"Stop fighting, both the werewolf and the vampire have fallen in love with me✨❤️",2026-05-17,1750,20973,179,4
YouTube,刘俊钦,UC77WdDKy6cbCxZkC46eaudA,Drama addict,uA462rsqjdc,"Accidentally saved someone, yet became the number one enemy of 30 million female fans worldwide😱",2026-05-17,1204,5147,82,2
YouTube,刘俊钦,UC77WdDKy6cbCxZkC46eaudA,Drama addict,Cj9zHb2AmjQ,"On the first day at the new school, I offended the most dangerous bully, what should I do😰🔥",2026-05-16,1316,1627,14,1
YouTube,刘俊钦,UC77WdDKy6cbCxZkC46eaudA,Drama addict,oAwKSIZVpFI,"I was forcibly pampered by a wealthy madman, but he was never willing to take it further💔🥀",2026-05-16,1503,10753,79,3
YouTube,刘俊钦,UC77WdDKy6cbCxZkC46eaudA,Drama addict,dhDxUGEdxF0,"I thought the husband I picked up was just a beggar, until he took a car key out of his pocket😮🏎️",2026-05-15,1119,5901,58,1
YouTube,刘俊钦,UC77WdDKy6cbCxZkC46eaudA,Drama addict,O-WO6uva9h4,"The Mafia boss taught me maths, I taught the big shot about love😮😆Secret Surrogate to the Mafia King",2026-05-14,5,24344,109,2
YouTube,刘俊钦,UC77WdDKy6cbCxZkC46eaudA,Drama addict,i20wlGui_bY,The person who has treated me like a little sister since childhood now wants to be my boyfriend?😮❤️,2026-05-14,1704,32724,171,5
YouTube,刘俊钦,UC77WdDKy6cbCxZkC46eaudA,Drama addict,OADDVwkh4LI,From Cheated by Scumbag to Doted by Male God: Falling for My Brother's Best Friend❤️🌹,2026-05-13,1377,66875,349,8
YouTube,刘俊钦,UC77WdDKy6cbCxZkC46eaudA,Drama addict,j-YHxUSCDcY,From a Kiss to True Love: Falling for the Underground King—A Heart-Pounding Romance❤️✨,2026-05-13,46,15978,181,10
YouTube,刘俊钦,UC77WdDKy6cbCxZkC46eaudA,Drama addict,h9Nn66gPERA,A Fated Contract: The Blind Boy Falls for a Mysterious Witch. Can a Touch Restore His Sight?😎👀,2026-05-12,1138,7786,93,1
YouTube,刘俊钦,UC77WdDKy6cbCxZkC46eaudA,Drama addict,_jHAx76lFRk,Ordinary Girl vs. Billionaire Heir: A Doctor's Error Made Me His Only Hope!🌹❤️,2026-05-12,1933,10032,106,2
YouTube,刘俊钦,UC77WdDKy6cbCxZkC46eaudA,Drama addict,TqKpLQCSuAI,"In the ring, he’s a wild beast; outside, he’s the guardian angel for the fallen heiress🤜😇Fix You",2026-05-11,1549,5889,49,2
YouTube,刘俊钦,UC77WdDKy6cbCxZkC46eaudA,Drama addict,R_db9_rTVDU,Abandon the scumbag ex and turn to embrace the iron-blooded boxer🤜🫂Fix You Full Movie,2026-05-11,1428,60730,193,7
YouTube,刘俊钦,UC77WdDKy6cbCxZkC46eaudA,Drama addict,Kc5VPyIO3bo,"My scumbag ex betrayed me, but his uncle treated me like a queen🌹❤️",2026-05-10,1099,6582,85,1
YouTube,刘俊钦,UC77WdDKy6cbCxZkC46eaudA,Drama addict,eodzty2Dcsk,"A billionaire falls in love with a single mother, have we met somewhere before?🌹❤️You Drive Me Crazy",2026-05-10,1451,5340,43,1
YouTube,刘俊钦,UC77WdDKy6cbCxZkC46eaudA,Drama addict,as_k-M6lWds,"If the price of loving you is losing my life, I am willing🥲💔The Price of Loving You",2026-05-09,1716,11097,104,3
YouTube,刘俊钦,UC77WdDKy6cbCxZkC46eaudA,Drama addict,pILChw6fvcE,"I thought I could change your feelings for me, but it turned out to be just my wishful thinking🥲🥀",2026-05-09,1581,3084,38,0
YouTube,刘俊钦,UC77WdDKy6cbCxZkC46eaudA,Drama addict,LbctNKZAIDI,"It was originally a deal, but a special bond developed with a mortal enemy✨❤️The Tutor Trap",2026-05-08,1638,28334,260,1
YouTube,刘俊钦,UC77WdDKy6cbCxZkC46eaudA,Drama addict,LsSLUSHMPWg,"I made a deal with my nemesis, but he had other intentions towards me🔥🌹The Tutor Trap",2026-05-08,1212,15966,159,7
YouTube,刘俊钦,UC77WdDKy6cbCxZkC46eaudA,Drama addict,jz1Lwc_GiEw,"Only her kiss can save him, but it costs her life. What will she choose?💉💔",2026-05-07,1647,12665,121,6
YouTube,刘俊钦,UC77WdDKy6cbCxZkC46eaudA,Drama addict,GvINRUt5Sqs,"Mating will kill her, but not mating will kill HIM! The Alpha King’s impossible choice. 🐺💔",2026-05-07,1172,11933,81,0
YouTube,刘俊钦,UC77WdDKy6cbCxZkC46eaudA,Drama addict,5J002WhVtMA,"✨To pay off my debt, I was forced to move into my 'arch-enemy's' mansion as a maid...🥀| Vicious",2026-05-06,1924,271024,1730,34
YouTube,刘俊钦,UC77WdDKy6cbCxZkC46eaudA,Drama addict,MQITnrJwtbg,"After being betrayed by a scumbag, I directly romanced my husband's uncle❤️💎",2026-05-06,1547,17733,73,3
YouTube,刘俊钦,UC77WdDKy6cbCxZkC46eaudA,Drama addict,iFgfhxPp5AA,"It was just an agreement, but unexpectedly the president developed feelings🧑‍💼Full Movie",2026-05-05,928,2786,21,1
YouTube,刘俊钦,UC77WdDKy6cbCxZkC46eaudA,Drama addict,4rW548e9M0c,From Fake to Fate: I Captured the Billionaire's Heart! 💎❤️Baby Trapped by the Billionaire,2026-05-04,1316,6208,51,2
YouTube,刘俊钦,UC77WdDKy6cbCxZkC46eaudA,Drama addict,43XjyJfHvGY,"Away from the dangerous ex, I turned and fell into the arms of the empire's prince🤴🌹",2026-05-03,1370,20312,161,2
YouTube,刘俊钦,UC77WdDKy6cbCxZkC46eaudA,Drama addict,A2JZXXdRai8,😱He revealed his identity as the Lord of Hell to save me😈🥀 | Lucifer's Bride,2026-05-03,1160,39729,308,7
YouTube,刘俊钦,UC77WdDKy6cbCxZkC46eaudA,Drama addict,RE1AjeJkLCE,"My parents despise me, my younger sister hates me, yet the CEO treasures me like a jewel 💎🌹",2026-05-02,1066,114170,467,3
YouTube,刘俊钦,UC77WdDKy6cbCxZkC46eaudA,Drama addict,Hxm06ZEMF1s,"🔥The Billionaire CEO Fell for a Country Girl.🙍‍♀️CEO, what’s between us is only a deal🥀🥀",2026-05-02,1654,51210,208,2
YouTube,刘俊钦,UC77WdDKy6cbCxZkC46eaudA,Drama addict,VJiWopXenn4,👨‍💼✨Married to a CEO: The Country Girl's High Society Survival Guide | Binge Watch,2026-05-01,1143,9389,89,1
YouTube,刘俊钦,UC77WdDKy6cbCxZkC46eaudA,Drama addict,zhrdHvXuCVE,🌊Crossing the Line: The Maid & The Megastar's Forbidden Romance🌹🤩| Breathe,2026-04-30,1624,3621,55,1
YouTube,刘俊钦,UC77WdDKy6cbCxZkC46eaudA,Drama addict,7a2wUHkGCGs,"Billionaires pretend to be foolish, healthy husbands pretend to be lame, why🤔😶‍🌫️",2026-04-30,1867,7266,73,2
YouTube,刘俊钦,UC77WdDKy6cbCxZkC46eaudA,Drama addict,_fH9eSV3heM,"✨❤️He cares about me, yet pretends to be indifferent🥀 | Full Movie | How to Break a DILF",2026-04-29,1097,36353,182,3
YouTube,刘俊钦,UC77WdDKy6cbCxZkC46eaudA,Drama addict,RJD9DGmHvjA,"🔥I hate my stepbrother, but now I have no choice but to live under the same roof✨",2026-04-28,1512,22093,155,3
YouTube,刘俊钦,UC77WdDKy6cbCxZkC46eaudA,Drama addict,vQvWtSRIoe4,"🥲🥀Secret Love: I love you, but I cannot be with you | The Boy I Hate",2026-04-28,1201,93213,328,7
YouTube,刘俊钦,UC77WdDKy6cbCxZkC46eaudA,Drama addict,SFdjoLVtb90,"🥀🥀No! You are my best friend's brother, we can't be together | The Boy I Hate",2026-04-27,1229,34756,222,3
YouTube,刘俊钦,UC77WdDKy6cbCxZkC46eaudA,Drama addict,-VGotTivHGs,"😖On one side is friendship, on the other is love, what will she choose? Full Movie🌹The Boy I Hate",2026-04-27,1162,18634,68,0
YouTube,刘俊钦,UC77WdDKy6cbCxZkC46eaudA,Drama addict,Z4wLH3aUoI0,"🥲A vicious woman ruined us! Four years later, my ex becomes my overprotective stepbrother🌹",2026-04-26,923,1872,13,0
YouTube,刘俊钦,UC77WdDKy6cbCxZkC46eaudA,Drama addict,qNUzzqf2aB0,"😮To hide my secret, I got together with my arch-nemesis | Breaking the Deal with My Hockey Bad Boy",2026-04-25,1529,165552,1025,28
YouTube,刘俊钦,UC77WdDKy6cbCxZkC46eaudA,Drama addict,14ZntbPe570,"🌹My brother warned him to stay away from me, but he knocked on my door in the middle of the night...",2026-04-25,1312,71949,329,5
YouTube,刘俊钦,UC77WdDKy6cbCxZkC46eaudA,Drama addict,wQjATPRxJU8,"Absolute taboo! I am your boss, we must not cross the line…🌹❤️Corrupting My Billionaire Boss's Heart",2026-04-24,1238,6872,64,1
YouTube,刘俊钦,UC77WdDKy6cbCxZkC46eaudA,Drama addict,Vd_8EF9B2Ng,❤️Can't Resist: I Fell in Love with My Brother's Best Friend🔥🌹,2026-04-24,1428,430384,2256,30
YouTube,刘俊钦,UC77WdDKy6cbCxZkC46eaudA,Drama addict,kjaK5PxWclQ,"Dump My Cheating Ex, Then Get Spoiled Rotten by My Brother’s Best Friend!❤️🌹",2026-04-23,1671,26603,198,3
YouTube,刘俊钦,UC77WdDKy6cbCxZkC46eaudA,Drama addict,AzWmhYKZLYM,"He Made My Life Miserable, Then I Had to Move Into His Mega-Mansion 🧹💔Nanny to My Hot Bully",2026-04-22,1234,73312,469,7
YouTube,刘俊钦,UC77WdDKy6cbCxZkC46eaudA,Drama addict,T0X9ctn1k-E,"They were supposed to be a fake couple, but unexpectedly both fell into the whirlpool of love🔥",2026-04-21,1774,242956,1676,31
YouTube,刘俊钦,UC77WdDKy6cbCxZkC46eaudA,Drama addict,G1NUPoQx4KI,"FAKE DATING FAILS: When the ""Pretend"" Kisses Start Feeling Way Too Real... 😳",2026-04-21,1496,137664,813,11
YouTube,刘俊钦,UC77WdDKy6cbCxZkC46eaudA,Drama addict,_sePRWmxPok,What Happens When Your Bestie Steals Your Voice AND Your Man? You Show Her Who's Boss. 💅✨,2026-04-20,1671,73990,733,15
YouTube,刘俊钦,UChhBhc7qJ42rgzAIPe9z6Cg,LittleDrama,HQBfrfKk_Ig,Arch-enemies turned lovers! The werewolf and vampire went to war for her!🐺⚔️🧛,2026-06-11,1632,487,9,0
YouTube,刘俊钦,UChhBhc7qJ42rgzAIPe9z6Cg,LittleDrama,BfyanrUU7fY,She discovered her boyfriend's secret😮#shorts #shortdrama #mustwatch,2026-06-09,103,1102,14,0
YouTube,刘俊钦,UChhBhc7qJ42rgzAIPe9z6Cg,LittleDrama,WDV2fyv_rBI,He is the boss of this prison☠️😱#shorts #shortdrama #film,2026-06-09,146,1072,22,0
YouTube,刘俊钦,UChhBhc7qJ42rgzAIPe9z6Cg,LittleDrama,MFqyMMpibCc,He purchased this necklace with absolute strength📿😎#shorts #shortdrama #mustwatch,2026-06-02,89,1869,36,0
YouTube,刘俊钦,UChhBhc7qJ42rgzAIPe9z6Cg,LittleDrama,aqlXHbc9mRc,The most taboo love triangle: How should I choose between these two brothers?❤️🤔,2026-05-28,1580,466,6,0
YouTube,刘俊钦,UChhBhc7qJ42rgzAIPe9z6Cg,LittleDrama,cD1VGmZaWdY,He has different feelings for him😮❤️#shortdrama #love #shorts,2026-05-27,60,1733,17,1
YouTube,刘俊钦,UChhBhc7qJ42rgzAIPe9z6Cg,LittleDrama,hzj2is-Lcu4,She caused a commotion in the cockpit just to make the plane turn around✈️😱#shortdrama #shorts,2026-05-27,37,9729,41,1
YouTube,刘俊钦,UChhBhc7qJ42rgzAIPe9z6Cg,LittleDrama,QTycjHqghy8,"""Sleep with me before my 30th birthday, or I'll DIE!"" The Alpha King's Cursed Bride.🐺👰",2026-05-26,1017,374,4,0
YouTube,刘俊钦,UChhBhc7qJ42rgzAIPe9z6Cg,LittleDrama,j6-gbK-mXg0,"Escape from the scumbag ex, embrace the cold CEO, I know you love me😎🌹Seducing Mr. Larsen",2026-05-25,1235,176,2,0
YouTube,刘俊钦,UChhBhc7qJ42rgzAIPe9z6Cg,LittleDrama,SLFEEEUrShU,His special pet🐍🕷️#shortdrama #shorts #pet,2026-05-25,53,4970,16,0
YouTube,刘俊钦,UChhBhc7qJ42rgzAIPe9z6Cg,LittleDrama,o6uMw3ce2Dk,She almost ended up with her ex-husband's father-in-law😱❤️#shorts  #love  #shortdrama,2026-05-25,57,84,2,0
YouTube,刘俊钦,UChhBhc7qJ42rgzAIPe9z6Cg,LittleDrama,4sOjsKMrvas,"He Is Desperately Searching For a Genius Hacker, Unknowing She Is Actually His New Wife!😮😆",2026-05-21,1188,184,4,0
YouTube,刘俊钦,UChhBhc7qJ42rgzAIPe9z6Cg,LittleDrama,kkzz8sL2S6s,"A forbidden love sparked by a car accident: Uncle, what are you doing here?🌹🚗Full Movie",2026-05-19,1288,254,2,0
YouTube,刘俊钦,UChhBhc7qJ42rgzAIPe9z6Cg,LittleDrama,QTHTjvmIpE4,Billionaire’s Fake Flash Marriage to a Village Girl Turns Real Love😮🌹Country Gal to CEO's Bride,2026-05-19,1971,161,1,0
YouTube,刘俊钦,UChhBhc7qJ42rgzAIPe9z6Cg,LittleDrama,akxLgH_DCks,"He was originally my husband's uncle, but everything changed after that night😮✨",2026-05-18,1414,117,1,0
YouTube,刘俊钦,UChhBhc7qJ42rgzAIPe9z6Cg,LittleDrama,BR-ChF2LAO4,My homeless husband from a whirlwind marriage turned out to be the king of the mafia!😱⛓️,2026-05-18,1723,3074,33,0
YouTube,刘俊钦,UChhBhc7qJ42rgzAIPe9z6Cg,LittleDrama,sXNj7ZTbeZo,"The prince ruined my reputation, should I save him now?🤔#shortdrama #shorts #prince",2026-05-17,86,893,7,0
YouTube,刘俊钦,UChhBhc7qJ42rgzAIPe9z6Cg,LittleDrama,BPhRGpYgIGc,What should I do? I kissed the prince in front of the whole school😰#shorts #shortdrama,2026-05-17,50,1777,10,0
YouTube,刘俊钦,UChhBhc7qJ42rgzAIPe9z6Cg,LittleDrama,YxzjZmXFc_w,She kicked the school bully to the ground😆😆#shorts #funny #schoolbully,2026-05-16,88,16241,266,1
YouTube,刘俊钦,UChhBhc7qJ42rgzAIPe9z6Cg,LittleDrama,gAlk_TX-KJw,"The school bully harasses classmates, and the new transfer student steps in to help😮✨#shorts #fyp",2026-05-16,57,3681,70,1
YouTube,刘俊钦,UChhBhc7qJ42rgzAIPe9z6Cg,LittleDrama,UnHTys50wgg,"I saved a classmate out of righteousness, yet I became the target of the school bully😰#shorts #film",2026-05-16,101,2287,88,1
YouTube,刘俊钦,UChhBhc7qJ42rgzAIPe9z6Cg,LittleDrama,YVOEnz4NXX0,She is actually willing to marry a beggar😮❤️#shortdrama  #love #begger #shorts,2026-05-15,107,1315,19,0
YouTube,刘俊钦,UChhBhc7qJ42rgzAIPe9z6Cg,LittleDrama,_3s6WpVj_R4,Loving Lucifer: He is my nightmare and my only escape🖤🌹Lucifer's Bride,2026-05-13,1691,39988,426,9
YouTube,刘俊钦,UChhBhc7qJ42rgzAIPe9z6Cg,LittleDrama,GmuXbRQgLNI,"""You're Just My Prey!"" When the Cold Lucifer Meets His Innocent Bride, He Loses Control!👰😈",2026-05-12,1609,63075,509,10
YouTube,刘俊钦,UChhBhc7qJ42rgzAIPe9z6Cg,LittleDrama,xw_G15u8Sks,"When the target is my first love, the mission is doomed❤️🔥The Hitwoman Full Movie",2026-05-11,1587,380,8,0
YouTube,刘俊钦,UChhBhc7qJ42rgzAIPe9z6Cg,LittleDrama,PlAi7WV12b4,"Dumped by the Beta, Claimed by the Alpha Brother!😮🌹Claimed by My Ex's Alpha Brother",2026-05-08,1363,6819,91,0
YouTube,刘俊钦,UChhBhc7qJ42rgzAIPe9z6Cg,LittleDrama,ErqtPWrOJRo,✨🌹Forbidden Love: I Think I Fell for My Dad's Friend | How to Break a DILF,2026-04-27,1392,144224,852,10
YouTube,刘俊钦,UChhBhc7qJ42rgzAIPe9z6Cg,LittleDrama,AnIXGFPN5YE,"🔥❤️Thought it was a contractual marriage, but the gangster boss took it seriously!",2026-04-23,1707,1362,20,0
YouTube,刘俊钦,UChhBhc7qJ42rgzAIPe9z6Cg,LittleDrama,lWYfMClow00,I Was Forced to Live With My Ultimate Rival... Now I'm His Secret Nanny! 🧹✨,2026-04-21,1519,41200,241,2
YouTube,刘俊钦,UChhBhc7qJ42rgzAIPe9z6Cg,LittleDrama,9xd3HFI33yM,❤️🌹Dancing with the devil: The CEO's ultimate temptation and absolute possession!,2026-04-19,1285,30769,123,2
YouTube,刘俊钦,UChhBhc7qJ42rgzAIPe9z6Cg,LittleDrama,wJbucGeh8s8,Provoked the city's most dangerous man! The crazy boss spoils me to the heavens?!🌹🌹,2026-04-17,1472,79051,519,2
YouTube,刘俊钦,UChhBhc7qJ42rgzAIPe9z6Cg,LittleDrama,uB9BmvA_Pdo,⛓️The assassin I saved by chance is none other than my fiancé's brother | Love Is a Dangerous Dance,2026-04-15,1606,2951,24,0
YouTube,刘俊钦,UChhBhc7qJ42rgzAIPe9z6Cg,LittleDrama,GwuLLisKSEo,"🥲I died, but I was reborn—all to make my husband get the punishment he deserves⛓️",2026-04-14,1052,481,3,0
YouTube,刘俊钦,UChhBhc7qJ42rgzAIPe9z6Cg,LittleDrama,OF1tB60Smwc,"💔I loved him for ten years, only to find he saw me as nothing but a tool🥀",2026-04-14,879,1008,9,0
YouTube,刘俊钦,UChhBhc7qJ42rgzAIPe9z6Cg,LittleDrama,rMiVwfdruNg,😮The father she has been searching for four years turns out to be the world's largest arms dealer🔥,2026-04-13,1281,2276,26,0
YouTube,刘俊钦,UChhBhc7qJ42rgzAIPe9z6Cg,LittleDrama,SgboOoBM8hM,🔥I’m actually a wealthy man😎but I can be a poor guy if that’s what you like🌹,2026-04-13,449,3095,10,2
YouTube,刘俊钦,UChhBhc7qJ42rgzAIPe9z6Cg,LittleDrama,Q7up90bZUN8,🔥🦹‍♂️Forbidden Love: I Fell in Love with the Mafia Boss | Monster in His Eyes,2026-04-12,1071,4187,28,0
YouTube,刘俊钦,UChhBhc7qJ42rgzAIPe9z6Cg,LittleDrama,hU5Scv_ahsI,"🦹‍♂️❤️Everyone fears him, but I want to get close to him | Monster in His Eyes",2026-04-11,1271,13105,77,3
YouTube,刘俊钦,UChhBhc7qJ42rgzAIPe9z6Cg,LittleDrama,MGiLsMs1I8Q,😮❤️Love at first sight — the domineering love of the Mafia boss | In the Palm of His Hand,2026-04-10,775,15608,51,1
YouTube,刘俊钦,UChhBhc7qJ42rgzAIPe9z6Cg,LittleDrama,zXCsRrlxFBg,💔🥲My boyfriend sold me to the boss of the mafia | In the Palm of His Hand,2026-04-09,853,5729,41,0
YouTube,刘俊钦,UChhBhc7qJ42rgzAIPe9z6Cg,LittleDrama,HUdgYk62Zq4,"✨😎My three brothers are top tycoons | After Divorce, I'm Spoiled by Three Brothers",2026-04-08,1372,1213,19,0
YouTube,刘俊钦,UChhBhc7qJ42rgzAIPe9z6Cg,LittleDrama,jWgUCYSEnYg,"😮I only found out I was a rich girl after my divorce | After Divorce, I'm Spoiled by Three Brothers",2026-04-08,1339,2743,39,3
YouTube,刘俊钦,UChhBhc7qJ42rgzAIPe9z6Cg,LittleDrama,-mKFkm6BKzA,😮A Secret I Can’t Let My Brother Know – My Secret Crush | I'm In Love With My Brother's Best Friend,2026-04-06,802,3414,26,0
YouTube,刘俊钦,UChhBhc7qJ42rgzAIPe9z6Cg,LittleDrama,0rNp8XZ_hrg,"❤️Complicated love, it seems my friend's sister likes me | I'm In Love With My Brother's Best Friend",2026-04-05,1153,62374,273,3
YouTube,刘俊钦,UChhBhc7qJ42rgzAIPe9z6Cg,LittleDrama,pETi48yor8M,❤️🫶I have developed feelings for my brother's friend | I'm In Love With My Brother's Best Friend?!,2026-04-05,1341,130830,569,2
YouTube,刘俊钦,UChhBhc7qJ42rgzAIPe9z6Cg,LittleDrama,kLXiub80saE,"🔥As long as I’m here, I won’t let you suffer any more unfair treatment | Surrender to My Professor",2026-04-04,18,54761,205,3
YouTube,刘俊钦,UChhBhc7qJ42rgzAIPe9z6Cg,LittleDrama,G-QyiiJAXEY,😱❤️Forbidden Love: I had a relationship with my professor | Surrender to My Professor,2026-04-04,10,31420,104,0
YouTube,刘俊钦,UChhBhc7qJ42rgzAIPe9z6Cg,LittleDrama,FjohhLxcBGk,✨My Unspeakable Secret with the Professor | Surrender to My Professor,2026-04-03,52,81366,396,4
YouTube,刘俊钦,UChhBhc7qJ42rgzAIPe9z6Cg,LittleDrama,43WbGZkxn1g,"💔😭He only saw the truth when I was dying |  Dear Brother, You Loved Me Too Late",2026-04-02,738,2899,15,0
YouTube,刘俊钦,UChhBhc7qJ42rgzAIPe9z6Cg,LittleDrama,kR2oezMMaVM,"💔😭My beloved brother actually wished I was dead | Dear Brother, You Loved Me Too Late",2026-04-02,1275,4389,27,1
YouTube,刘俊钦,UChhBhc7qJ42rgzAIPe9z6Cg,LittleDrama,QwXwjzn2uvg,"🎢✨I hate him, yet I can't stop thinking about him | My Stepbrother's Dirty Secret",2026-04-01,945,4249,31,0
YouTube,刘俊钦,UChhBhc7qJ42rgzAIPe9z6Cg,LittleDrama,5IxQ-jSCBrY,✨🫶My Stepbrother Pretends Not to Know Me at School | My Stepbrother's Dirty Secret,2026-04-01,684,396459,1506,22
YouTube,刘俊钦,UChhBhc7qJ42rgzAIPe9z6Cg,LittleDrama,sI1dX0jotdc,"🎢❤️I Hate My Stepbrother, But He Saved My Life | My Stepbrother's Dirty Secret",2026-04-01,1102,3145,27,0
YouTube,刘俊钦,UChhBhc7qJ42rgzAIPe9z6Cg,LittleDrama,nkWsX-ZKaiM,❤️🫶My enemy boss seems to have fallen for me | Scandalous,2026-03-31,813,77677,540,5
YouTube,刘俊钦,UChhBhc7qJ42rgzAIPe9z6Cg,LittleDrama,cFdW7RVDJlY,My first love asked me to pretend to be his fake girlfriend🤔| Pucked in the Friend Zone,2026-03-30,658,40023,256,9
YouTube,刘俊钦,UChhBhc7qJ42rgzAIPe9z6Cg,LittleDrama,51_6qY22WPM,"He broke my heart completely, yet I still love him❤️‍🩹 | Pucked in the Friend Zone",2026-03-30,1102,13770,77,1
YouTube,刘俊钦,UChhBhc7qJ42rgzAIPe9z6Cg,LittleDrama,izNF9hBm3mU,She is falling into the embrace of love | Breathe,2026-03-28,825,27558,175,4
YouTube,刘俊钦,UChhBhc7qJ42rgzAIPe9z6Cg,LittleDrama,Sw8XQIsap3c,She fell in love with the person she sought revenge against | Scandalous,2026-03-27,927,11256,49,0
YouTube,刘俊钦,UChhBhc7qJ42rgzAIPe9z6Cg,LittleDrama,IoMrkTiomvQ,"I didn't want to reveal my identity, but you bullied my sister. | My Sister Is the Warlord Queen",2026-03-25,1312,5817,52,2
YouTube,刘俊钦,UChhBhc7qJ42rgzAIPe9z6Cg,LittleDrama,HuGo9mRHu-4,Everyone thought she was just a cleaner… until she revealed her true identity. | Complete collection,2026-03-25,1191,4424,24,0
YouTube,刘俊钦,UC80LfoIH6FrzHTm6lXTWCKQ,DramaStory,UOztve1zuJE,They seem to be a bit flirty with each other😂🌹#shorts #film #shortdrama #mustwatch,2026-06-19,104,1363,52,2
YouTube,刘俊钦,UC80LfoIH6FrzHTm6lXTWCKQ,DramaStory,1MBzFAmfmSw,He has a crush on him😱❤️#shorts #shortdrama #film #mustwatch,2026-06-19,77,2250,100,1
YouTube,刘俊钦,UC80LfoIH6FrzHTm6lXTWCKQ,DramaStory,7dsF22qJod8,An absolutely forbidden love: a brutal wolf king forcefully marking his fragile male partner!🐺🤼‍♂️,2026-06-18,307,1930,44,0
YouTube,刘俊钦,UC80LfoIH6FrzHTm6lXTWCKQ,DramaStory,TZRl6Wls2L4,"They Are Both Male Wolves, But Fate Bound Them as Mates! 🐺🔥How I Made the Alpha Mine",2026-06-17,1259,2062,50,0
YouTube,刘俊钦,UC80LfoIH6FrzHTm6lXTWCKQ,DramaStory,uESenyHqfr4,"When the charming school bully meets the aloof prince, no matter what others think, I only like you🌹",2026-06-16,1532,3659,86,1
YouTube,刘俊钦,UC80LfoIH6FrzHTm6lXTWCKQ,DramaStory,2TxGroBv7n0,"On one side is a family-arranged marriage, on the other is his own love, what will he choose?💔🥀",2026-06-15,366,1824,34,1
YouTube,刘俊钦,UC80LfoIH6FrzHTm6lXTWCKQ,DramaStory,AUtiPqh_jBo,The aloof prince gets kissed by the bad-boy school bully and by chance finds his true love!?👑🔥,2026-06-15,1219,2744,58,0
YouTube,刘俊钦,UC80LfoIH6FrzHTm6lXTWCKQ,DramaStory,pJMDlTlIVLg,Top-tier professor vs genius female student: who will fall first in this round?❤️🌹Dark Notes,2026-06-14,1277,674,6,0
YouTube,刘俊钦,UC80LfoIH6FrzHTm6lXTWCKQ,DramaStory,ibhb2K5uLbc,Contract Marriage With A Ruthless Mafia Boss... But He Fell First! ❤️‍🔥Ruthless Mafia Daddy,2026-06-13,1137,3532,42,1
YouTube,刘俊钦,UC80LfoIH6FrzHTm6lXTWCKQ,DramaStory,LnSWkLmTykA,A single IVF accident ended up making me pregnant with a gangster boss's child!!😮🌹,2026-06-13,987,14544,111,1
YouTube,刘俊钦,UC80LfoIH6FrzHTm6lXTWCKQ,DramaStory,RlWQ12RCRgE,"My Jerk Ex Rejected Me, Not Knowing I’m The Powerful Wolf Princess! 👑Never Reject A Wolf Princess",2026-06-12,1047,826,12,0
YouTube,刘俊钦,UC80LfoIH6FrzHTm6lXTWCKQ,DramaStory,QDD2zkWcgaY,"You are my partner, but we can't be together😢🐺In Love with the Alpha",2026-06-11,1451,8041,105,1
