platform,operator,channel_id,channel_name,video_id,video_title,published_date,duration_sec,views,likes,comments
Dailymotion,金萍,x3tgrnq,ReelShort Drama Shorts,xa9axvs,"Fool No More, King Returns | They Mocked Him—Now They Fear Him😈",2026-05-11,5919,648,0,0
Dailymotion,金萍,x3tgrnq,ReelShort Drama Shorts,xa8qp9q,"Runaway Single Mom, Safe in His Arms | He Protected Her When No One Else Did🥲",2026-05-09,4421,27455,12,0
Dailymotion,金萍,x3tgrnq,ReelShort Drama Shorts,xa8el76,Private School Playboys | She Was Done Being the Nice Girl💘,2026-05-07,2699,743,1,0
Dailymotion,金萍,x3tgrnq,ReelShort Drama Shorts,xa89y1q,Ace! The Golf King’s Reconquest | The King They Forgot Is Back 🤩,2026-05-06,4347,574,1,0
Dailymotion,金萍,x3tgrnq,ReelShort Drama Shorts,xa7ku1a,My Dark Romeo | She Wants Revenge—He Wants Control😈,2026-04-30,2389,1384,2,0
Dailymotion,金萍,x3tgrnq,ReelShort Drama Shorts,xa7fwve,Comeback Play | From Washed-Up to Court King😎,2026-04-29,3860,8526,3,0
Dailymotion,金萍,x3tgrnq,ReelShort Drama Shorts,xa7aadm,"The Janitor Billionaire & His Swapped Bride | Wrong Choice, Right Man?",2026-04-28,4933,12442,8,0
Dailymotion,金萍,x3tgrnq,ReelShort Drama Shorts,xa7548y,"Silicon God Strikes Back | Betrayal Unmasked, Genius Reborn",2026-04-27,2643,205,0,0
Dailymotion,金萍,x3tgrnq,ReelShort Drama Shorts,xa62bo0,Married The Mafioso I Saved | Passion in the Shadows,2026-04-20,4724,540736,325,0
Dailymotion,金萍,x3tgrnq,ReelShort Drama Shorts,xa5nhxq,The Photo That Changed Everything | Secrets of the Walker Legacy,2026-04-16,4604,225,1,0
Dailymotion,金萍,x3tgrnq,ReelShort Drama Shorts,xa5gvkc,Mic Drop Diva [HD Movie] | Can Ivy Find Her True Voice Amidst Betrayal?,2026-04-14,3934,556,0,0
Dailymotion,金萍,x3tgrnq,ReelShort Drama Shorts,xa530ek,Corrupting My Billionaire Boss's Heart | A Promise He Can’t Break… A Love He Can’t Resist 💔❤️‍🔥,2026-04-10,4608,1321,1,0
Dailymotion,金萍,x3tgrnq,ReelShort Drama Shorts,xa4vtvi,The Summer My Heart Stopped  [HD Movie]| She Loved Him… Until Her Last Breath 😢,2026-04-09,4109,1040,1,0
Dailymotion,金萍,x3tgrnq,ReelShort Drama Shorts,xa4689w,Queen of Cuisine👑🍳 | ReelShort HD Movie,2026-04-03,5441,7121,4,0
Dailymotion,金萍,x3tgrnq,ReelShort Drama Shorts,xa42ru8,"Gossip Godmother | HD Movie, Eng Sub",2026-04-02,4891,1610,2,0
Dailymotion,金萍,x3tgrnq,ReelShort Drama Shorts,xa3vv1u,"After Divorce, I’m Spoiled by Three Brothers | From Nothing to Everything 💥💖",2026-04-01,5340,9094,9,0
Dailymotion,金萍,x3tgrnq,ReelShort Drama Shorts,xa3n4z0,Stop That Homeless Man Is an American Hero {English SUB],2026-03-30,5100,6828,2,0
Dailymotion,金萍,x3tgrnq,ReelShort Drama Shorts,xa3evvw,Pucked in the Friend Zone | He Broke Her Heart… Now He Wants Her Back 💔🔥,2026-03-27,4687,6742,3,0
Dailymotion,金萍,x3tgrnq,ReelShort Drama Shorts,xa3c67a,Scandalous❤️Hot Daddy Romance Movie,2026-03-26,4774,4002,1,0
Dailymotion,金萍,x3tgrnq,ReelShort Drama Shorts,xa238io,"My Magnificent Bodyguard 💊⚔️ | A Miracle Cure, Deadly Enemies, One Powerful Protector-[HD Movie]",2026-03-16,5520,608,1,0
Dailymotion,金萍,x3tgrnq,ReelShort Drama Shorts,xa1szb6,My Duplicated Husband 🖤🕵️ | Is He Her Husband—or Someone Else?-[HD Movie],2026-03-12,5501,4790,6,0
Dailymotion,金萍,x3tgrnq,ReelShort Drama Shorts,xa1polw,Return of the Reaper 🖤⚔️ | The Legendary Killer Breaks His Final Promise-{English SUB],2026-03-11,4968,1564,2,0
Dailymotion,金萍,x3tgrnq,ReelShort Drama Shorts,x9ycwac,Fix You Movie - Dreams Or Beloved Girl? 【Romantic Lover Story】,2026-01-23,5291,728,1,0
Dailymotion,金萍,x3tgrnq,ReelShort Drama Shorts,x9xeoai,The Next ReelStar🌟—VOTE FOR YOUR STAR ON ReelShort NOW!!🔥,2026-01-09,5281,530,0,0
Dailymotion,金萍,x3tgrnq,ReelShort Drama Shorts,x9xbq0c,Waterboy🌈—SECRET CRUSH on ReelShort!!🤫🔥,2026-01-08,6055,3872,2,0
Dailymotion,金萍,x3tgrnq,ReelShort Drama Shorts,x9vxgnm,Understated Guardian King -FULL EPISODES|NO CUTS|OFFICIAL VERSION,2025-12-18,5633,792,0,0
Dailymotion,金萍,x3tgrnq,ReelShort Drama Shorts,x9vq4dy,Bastard King of the Cage -🥊Full Series Now !! 【Sports】,2025-12-15,5946,3154,0,0
Dailymotion,金萍,x3tgrnq,ReelShort Drama Shorts,x9vq3gg,Bastard King of the Cage🥊 -Full HD Movie ⭐【NO CUTS】,2025-12-15,5198,269,0,0
Dailymotion,金萍,x3tgrnq,ReelShort Drama Shorts,x9vk34k,Rented a Billionaire Husband for Christmas🎄-Free Movie&Full Episodes,2025-12-12,5198,2370,1,0
Dailymotion,金萍,x3tgrnq,ReelShort Drama Shorts,x9vhb94,The Prince's First Love – 🏳️‍🌈Full HD Episodes 【BoysLove】,2025-12-11,5217,2399,0,0
Dailymotion,金萍,x3tgrnq,ReelShort Drama Shorts,x9v86gg,Queen of the Court🎾 – HD Full Episodes🏅(Completed),2025-12-08,5059,497,1,0
Dailymotion,金萍,x3tgrnq,ReelShort Drama Shorts,x9v0mkm,American Snlp3r: The Last Round 💪- Full HD Series🌟NO CUT,2025-12-04,4779,4008,0,0
Dailymotion,金萍,x3tgrnq,ReelShort Drama Shorts,x9uxwag,Taming My Bullies -Full Series| EP 1-82| No Cuts,2025-12-03,5152,38031,23,0
Dailymotion,金萍,x3tgrnq,ReelShort Drama Shorts,x9uty9y,Seducing Mr. Larsen – Full HD Episodes(Completed),2025-12-02,5345,7001,0,0
Dailymotion,金萍,x3tgrnq,ReelShort Drama Shorts,x9urb6a,I Hate to Love My British Bad Boy (2025)– FULL&DETAILED VERSION,2025-12-01,5472,5106,6,0
Dailymotion,金萍,x3tgrnq,ReelShort Drama Shorts,x9ulazm,Once Upon A Breakup - Full Series Now!!⭐【LoveTriangle】,2025-11-28,5932,30041,1,0
Dailymotion,金萍,x3tgrnq,ReelShort Drama Shorts,x9uiu7y,The Price of Loving You – Full Series Now !! 🔮【Supernatural】,2025-11-27,5621,18901,4,0
Dailymotion,金萍,x3tgrnq,ReelShort Drama Shorts,x9ugocs,How to Land a Movie Star- 🌠FULL&DETAILED VERSION(EP1-61),2025-11-26,5469,777,0,0
Dailymotion,金萍,x3tgrnq,ReelShort Drama Shorts,x9udvk0,My Stepbrother's Dirty Secret(2025) -🎇Full Episodes✴️No Cut,2025-11-25,5693,12480,6,0
Dailymotion,金萍,x3tgrnq,ReelShort Drama Shorts,x9ubj0u,🍏Operation Christmas Trap –🎄Full Series No Cut 🔔,2025-11-24,5395,18482,7,0
Dailymotion,金萍,x3tgrnq,ReelShort Drama Shorts,x9u63n8,💋Bound by Honor - 🔥Full Movie 【Dangerous Relationship】,2025-11-21,4913,1331,0,0
Dailymotion,金萍,x3tgrnq,ReelShort Drama Shorts,x9u1urm,✨ Callsign: Legacy- 💫 ReelShort_Drama_Full_Episodes 🎬,2025-11-19,5526,1608,0,0
Dailymotion,金萍,x3tgrnq,ReelShort Drama Shorts,x9tzmaw,Bound to the Rebel Wolf(2025)-FULL&DETAILED VERSION,2025-11-18,4827,37614,1,0
Dailymotion,金萍,x3tgrnq,ReelShort Drama Shorts,x9tx7yq,The Ghost of You and I Reelshort_Full_Movie_No_Cut,2025-11-17,5174,212,1,0
Dailymotion,金萍,x3tgrnq,ReelShort Drama Shorts,x9trymo,💖🔥Sweet Wild Bride of Mine -Full Movie [English Sub],2025-11-14,4789,11081,0,0
Dailymotion,金萍,x3tgrnq,ReelShort Drama Shorts,x9tkn9o,It's Time!!! - The Christmas Switch Full Episodes,2025-11-11,4735,1050,1,0
Dailymotion,金萍,x3tgrnq,ReelShort Drama Shorts,x9swn68,❤️‍🔥💘 Tell Me Not to Love You - No Cut,2025-10-30,5908,61124,10,0
Dailymotion,金萍,x3tgrnq,ReelShort Drama Shorts,x9sukrw,Full Series Now! - We're Your Parents 【No Cuts】,2025-10-29,3681,2393,0,0
Dailymotion,金萍,x3tgrnq,ReelShort Drama Shorts,x9ssgx4,❄️🎄💞Someone Loved is Never Lost Full Movie,2025-10-28,5152,153,1,0
Dailymotion,金萍,x3tgrnq,ReelShort Drama Shorts,x9sqa48,[❤️‍🔥🔥2025]- You Fired The Backbone of Detroit Full Movie,2025-10-27,4821,273,0,0
Dailymotion,金萍,x3tgrnq,ReelShort Drama Shorts,x9sdp56,New! How I Made the Alpha Mine Movie Full Episodes,2025-10-20,5547,435,1,0
Dailymotion,小珊,x4c7r9u,love-shortdrama,x9xxfho,Wrong Full Episodes-ReelShort,2026-01-17,3907,85,0,0
Dailymotion,小珊,x4c7r9u,love-shortdrama,x9xb3dk,The Words_V3,2026-01-08,4279,5,0,0
Dailymotion,小珊,x4c7ro4,babygirllovesshortdrama,x9xxjso,Wrong ReelShort Full Episodes,2026-01-17,3907,66,0,0
Dailymotion,小珊,x4c7ro4,babygirllovesshortdrama,x9xbano,The Words free episodes-ReelShort-Autumn Noel,2026-01-08,4284,0,0,0
Dailymotion,小珊,x4c7sre,dailyshortdrama,x9xxc5c,Wrong Full Episodes ReelShort,2026-01-16,3907,31,0,0
Dailymotion,小珊,x4c7sre,dailyshortdrama,x9xbai8,The Words free episodes-ReelShort,2026-01-08,4284,1,0,0
Dailymotion,金萍,x4g6uv8,ReelShort Story Shorts,xagl4oa,Wterboy Second Down 👨‍❤️‍💋‍👨 | He Was Just a Waterboy… Until He Shocked Everyone on the Field,2026-06-18,4531,14,0,0
Dailymotion,金萍,x4g6uv8,ReelShort Story Shorts,xagl3vu,"Caged by His Twisted Love 💔 | The More I Run, The More He Owns Me",2026-06-18,4194,6,0,0
Dailymotion,金萍,x4g6uv8,ReelShort Story Shorts,xagaik6,小猪合集1,2026-06-17,4424,0,0,0
Dailymotion,金萍,x4g6uv8,ReelShort Story Shorts,xag9tyi,火车救援3,2026-06-17,3510,0,0,0
Dailymotion,金萍,x4g6uv8,ReelShort Story Shorts,xag9sxu,盛大节日3,2026-06-17,3510,0,0,0
Dailymotion,金萍,x4g6uv8,ReelShort Story Shorts,xag9tle,火车救援2,2026-06-17,3510,0,0,0
Dailymotion,金萍,x4g6uv8,ReelShort Story Shorts,xag9t7a,盛大节日1,2026-06-17,3510,0,0,0
Dailymotion,金萍,x4g6uv8,ReelShort Story Shorts,xag9s7a,睡前故事3,2026-06-17,3510,0,0,0
Dailymotion,金萍,x4g6uv8,ReelShort Story Shorts,xag9spq,盛大节日2,2026-06-17,3510,0,0,0
Dailymotion,金萍,x4g6uv8,ReelShort Story Shorts,xag9tfa,火车救援1,2026-06-17,3510,0,0,0
Dailymotion,金萍,x4g6uv8,ReelShort Story Shorts,xag9she,睡前故事1,2026-06-17,3510,0,0,0
Dailymotion,金萍,x4g6uv8,ReelShort Story Shorts,xag9rya,睡前故事2,2026-06-17,3510,0,0,0
Dailymotion,金萍,x4g6uv8,ReelShort Story Shorts,xaecm2y,"Reborn Villainess Healing Hearts, Breaking Walls | HD, NO CUT",2026-06-10,5308,3,0,0
Dailymotion,金萍,x4g6uv8,ReelShort Story Shorts,xaecj8i,"Broken by My Twin Alphas | HD, NO CUT",2026-06-10,5501,8,0,0
Dailymotion,金萍,x4g6uv8,ReelShort Story Shorts,xaecgym,"They Called Me Worthless Until My Cards Destroyed | HD, NO CUT",2026-06-10,5395,3,0,0
Dailymotion,金萍,x4g6uv8,ReelShort Story Shorts,xaeaf4a,Owned by the Bad Boy Athlete | FREE Movie,2026-06-10,5071,19,0,0
Dailymotion,金萍,x4g6uv8,ReelShort Story Shorts,xae5ut6,"The Extraordinary Mother of a Billionaire | HD, NO CUT",2026-06-09,5354,7,0,0
Dailymotion,金萍,x4g6uv8,ReelShort Story Shorts,xae46pu,"The Fake Debutante and the True Billionaire | HD, NO CUT",2026-06-09,5113,34,0,0
Dailymotion,金萍,x4g6uv8,ReelShort Story Shorts,xae3ybm,"Breaking My Bodyguard Dailymotion Movie | HD, NO CUT",2026-06-09,5113,28,0,0
Dailymotion,金萍,x4g6uv8,ReelShort Story Shorts,xae33a2,"Alpha's Regret After His Pregnant Luna's Death Dailymotion Movie | HD, NO CUT",2026-06-09,4586,7,0,0
Dailymotion,金萍,x4g6uv8,ReelShort Story Shorts,xadxnii,"Rejected Luna Is the Alpha Queen Dailymotion Movie👸 | HD, NO CUT",2026-06-08,4767,611,0,0
Dailymotion,金萍,x4g6uv8,ReelShort Story Shorts,xade0pm,"Luna Reborn Alpha's Second Chance Dailymotion Movie | HD, NO CUT",2026-06-05,4583,7,0,0
Dailymotion,金萍,x4g6uv8,ReelShort Story Shorts,xada32e,When Love Departed | Losing Her Was His Greatest Punishment,2026-06-05,3074,4,0,0
Dailymotion,金萍,x4g6uv8,ReelShort Story Shorts,xad5kyo,"Double Life of a Cell Block King Dailymotion Movie🤴 | HD, NO CUT",2026-06-04,4521,625,0,0
Dailymotion,金萍,x4g6uv8,ReelShort Story Shorts,xad5iq0,"My Alpha Boss Gave Me Triplets Dailymotion Movie | HD, NO CUT",2026-06-04,4500,658,0,0
Dailymotion,金萍,x4g6uv8,ReelShort Story Shorts,xad5d2u,"Alpha Daddy Make Me Yours Dailymotion Movie💖 |HD, NO CUT",2026-06-04,4460,7,0,0
Dailymotion,金萍,x4g6uv8,ReelShort Story Shorts,xacwqf2,I Accidentally Sexted My Enemy ✨ HD Romance Comedy | English Subtitles,2026-06-03,5082,15,0,0
Dailymotion,金萍,x4g6uv8,ReelShort Story Shorts,xacwpau,"Your Love Broke My Heart💔 | Eng Sub, HD Movie #ReelShort #Dailymotion",2026-06-03,4042,3,0,0
Dailymotion,金萍,x4g6uv8,ReelShort Story Shorts,xacwn9k,Taming My Bullies 3 Daylimotion Movie💎 HD Quality | English Subtitles,2026-06-03,4785,2,0,0
Dailymotion,金萍,x4g6uv8,ReelShort Story Shorts,xacwgxm,"Campus Saga Superpower Teen 👊 Bullied Today, Powerful Tomorrow | Eng Sub HD Movie",2026-06-03,5149,2,0,0
Dailymotion,金萍,x4g6uv8,ReelShort Story Shorts,xacs8w0,Dark Notes 💖 Eng Sub | HD Romance Drama #ReelShort,2026-06-02,3713,25,0,0
Dailymotion,金萍,x4g6uv8,ReelShort Story Shorts,xacs5jo,The Imperfect Marriage 💎 Eng Sub HD Movie | 2026,2026-06-02,4784,25,0,0
Dailymotion,金萍,x4g6uv8,ReelShort Story Shorts,xacrzxw,Stableboy 🌹 Love Doesn't Care About Social Status | HD Movie [Eng Sub],2026-06-02,5287,2,0,0
Dailymotion,金萍,x4g6uv8,ReelShort Story Shorts,xacirnc,"Don't Blink, You'll Miss It 🎬| ReelShort Free Movie[HD]",2026-06-01,4088,4,0,0
Dailymotion,金萍,x4g6uv8,ReelShort Story Shorts,xacimzi,Alpha Queen Rising Dailymotion Movie[Eng Sub]🐺#ReelShort,2026-06-01,4550,3,0,0
Dailymotion,金萍,x4g6uv8,ReelShort Story Shorts,xa5nc8k,The Photo That Changed Everything | Griffin's Hidden Struggle,2026-04-16,4604,43,0,0
Dailymotion,金萍,x4g6uv8,ReelShort Story Shorts,xa3bh16,My Stepbrother's Dirty Secret Movie - Forbidden Love,2026-03-26,1464,396,0,0
Dailymotion,金萍,x4g735i,ReelShort Movie Shorts,xagl4sa,Wterboy Second Down👬 | From Waterboy to MVP in One Season,2026-06-18,4531,2,0,0
Dailymotion,金萍,x4g735i,ReelShort Movie Shorts,xagcrx6,We Never Said We Went Bankrupt Dailymotion Movie| Eng Sub #ReelShort,2026-06-17,4465,37,0,0
Dailymotion,金萍,x4g735i,ReelShort Movie Shorts,xagckty,My Brothers Begged But I'm the Dragon's Queen Dailymotion Movie| Eng Sub #ReelShort,2026-06-17,4772,1444,1,0
Dailymotion,金萍,x4g735i,ReelShort Movie Shorts,xaftanu,"The Hockey Captain That Hates Me Dailymotion Movie | A Rival on Ice, A Forbidden Love Off the Ice ❄️🔥",2026-06-15,5019,1377,1,0
Dailymotion,金萍,x4g735i,ReelShort Movie Shorts,xaftcm6,"After the Reformatory, My Family Begs Me Home Dailymotion Movie | Eng Sub #ReelShort",2026-06-15,4335,9,1,0
Dailymotion,金萍,x4g735i,ReelShort Movie Shorts,xaft9g6,I Accidentally Sexted My Enemy | From Hate to Obsession After One Mistaken Text 💘,2026-06-15,5082,16558,4,0
Dailymotion,金萍,x4g735i,ReelShort Movie Shorts,xaewsja,Rejecting the Five Alphas Dailymotion Movie | Eng Sub #ReelShort,2026-06-12,4855,36,0,0
Dailymotion,金萍,x4g735i,ReelShort Movie Shorts,xaewop6,I Accidentally Sexted My Enemy | Eng Sub #ReelShort,2026-06-12,5082,121096,40,0
Dailymotion,金萍,x4g735i,ReelShort Movie Shorts,xaewlja,The Extraordinary Mother of a Billionaire | Everyone Mocked Her Until a Billionaire Called Her “Mom” 😱 | Eng Sub,2026-06-12,5354,6,0,0
Dailymotion,金萍,x4g735i,ReelShort Movie Shorts,xaekbh6,Caged by His Twisted Love Dailymotion Movie❤️‍ | Eng Sub #ReelShort,2026-06-11,5589,19,0,0
Dailymotion,金萍,x4g735i,ReelShort Movie Shorts,xaej0qq,Rose in Chains Dailymotion Movie🌹 | Eng Sub #ReelShort,2026-06-11,4947,409,1,0
Dailymotion,金萍,x4g735i,ReelShort Movie Shorts,xaeixxi,The Hockey Captain That Hates Me Dailymotion Movie | Eng Sub #ReelShort,2026-06-11,5019,23,0,0
Dailymotion,金萍,x4g735i,ReelShort Movie Shorts,xaeiv8i,Wterboy Second Down Dailymotion Movie👬 | Eng Sub #ReelShort,2026-06-11,5662,15,0,0
Dailymotion,金萍,x4g735i,ReelShort Movie Shorts,xaecm2u,"Reborn Villainess: Healing Hearts, Breaking Walls | Eng Sub #ReelShort",2026-06-10,5308,24,0,0
Dailymotion,金萍,x4g735i,ReelShort Movie Shorts,xaecj8u,They Called Me Worthless Until My Cards Destroyed | Eng Sub #ReelShort,2026-06-10,5395,3,0,0
Dailymotion,金萍,x4g735i,ReelShort Movie Shorts,xaecgxy,Broken by My Twin Alphas | Eng Sub #ReelShort,2026-06-10,5501,41,1,0
Dailymotion,金萍,x4g735i,ReelShort Movie Shorts,xaeanvq,Owned by the Bad Boy Athlete | Eng Sub #ReelShort,2026-06-10,5071,75,0,0
Dailymotion,金萍,x4g735i,ReelShort Movie Shorts,xae5uti,The Extraordinary Mother of a Billionaire | Eng Sub #ReelShort,2026-06-09,5354,6,0,0
Dailymotion,金萍,x4g735i,ReelShort Movie Shorts,xae5pja,My Fated Deal with the Alpha King | Eng Sub #ReelShort,2026-06-09,5171,524,1,0
Dailymotion,金萍,x4g735i,ReelShort Movie Shorts,xae4akq,The Fake Debutante and the True Billionaire | Eng Sub #ReelShort,2026-06-09,5113,9,0,0
Dailymotion,金萍,x4g735i,ReelShort Movie Shorts,xae3yca,Breaking My Bodyguard Dailymotion Movie | Eng Sub #ReelShort,2026-06-09,5113,963,0,0
Dailymotion,金萍,x4g735i,ReelShort Movie Shorts,xae31fm,Alpha's Regret After His Pregnant Luna's Death Dailymotion Movie | Eng Sub #ReelShort,2026-06-09,4586,9,0,0
Dailymotion,金萍,x4g735i,ReelShort Movie Shorts,xadxpfa,Rejected Luna Is the Alpha Queen Dailymotion Movie👑 | Eng Sub #ReelShort,2026-06-08,4767,1169,0,0
Dailymotion,金萍,x4g735i,ReelShort Movie Shorts,xade0pe,Luna Reborn Alpha's Second Chance Dailymotion Movie 🐺 | Eng Sub #ReelShort,2026-06-05,4583,35,1,0
Dailymotion,金萍,x4g735i,ReelShort Movie Shorts,xadclly,Double Life of a Cell Block King Dailymotion Movie | Eng Sub #ReelShort,2026-06-05,4521,8,0,0
Dailymotion,金萍,x4g735i,ReelShort Movie Shorts,xad5f7k,When Love Departed | She Walked Away and Never Looked Back😎,2026-06-04,3074,7,0,0
Dailymotion,金萍,x4g735i,ReelShort Movie Shorts,xacwsyw,"Your Love Broke My Heart💔 | Eng Sub, HD Movie #ReelShort #Dailymotion",2026-06-03,4042,5522,2,0
Dailymotion,金萍,x4g735i,ReelShort Movie Shorts,xacwqew,I Accidentally Sexted My Enemy 💕 From Enemies to Something More | HD Movie,2026-06-03,5082,93,0,0
Dailymotion,金萍,x4g735i,ReelShort Movie Shorts,xacwn9o,Taming My Bullies 3 💕 Official HD Movie | Eng Sub #ReelShort,2026-06-03,4785,21,0,0
Dailymotion,金萍,x4g735i,ReelShort Movie Shorts,xacwkqe,"Campus Saga Superpower Teen HD Movie |Eng Sub, 2026 #ReelShort⚽",2026-06-03,5149,3,0,0
Dailymotion,金萍,x4g735i,ReelShort Movie Shorts,xacsao0,"The Imperfect Marriage Dailymotion Movie| Eng Sub, Hot💖",2026-06-02,4784,35,0,0
Dailymotion,金萍,x4g735i,ReelShort Movie Shorts,xacs8w2,"Dark Notes 🎵 | Eng Sub, HD Movie, 2026 #ReelShort",2026-06-02,3713,17,0,0
Dailymotion,金萍,x4g735i,ReelShort Movie Shorts,xacrzu4,"Stableboy HD Movie |Eng Sub, Watch Hot Love on ReelShort! ❤️‍🔥",2026-06-02,5287,299,0,0
Dailymotion,金萍,x4g735i,ReelShort Movie Shorts,xacimzm,Alpha Queen Rising Dailymotion Movie[Eng Sub]🐺#ReelShort,2026-06-01,4550,7,0,0
Dailymotion,金萍,x4g735i,ReelShort Movie Shorts,xacidty,"Don't Blink, You'll Miss It 🎬| ReelShort HD Movie[Eng Sub]",2026-06-01,4088,3,0,0
Dailymotion,金萍,x4g735i,ReelShort Movie Shorts,xabmrok,Djinn Under Contract Full Movie [Hot 2026]🔥,2026-05-29,4058,14,0,0
Dailymotion,金萍,x4g735i,ReelShort Movie Shorts,xabpnvc,Carter Reed 🔥 | The Ruthless King Everyone Fears [ENG SUB] #ReelShort,2026-05-29,3830,20,0,0
Dailymotion,金萍,x4g735i,ReelShort Movie Shorts,xabmoda,When Forever Fell Apart  | 2026 Hot Movie🔥,2026-05-29,4823,6,0,0
Dailymotion,金萍,x4g735i,ReelShort Movie Shorts,xabhyso,My Boss Loves Me Too Much [Hot 2026]🔥,2026-05-28,3853,14,0,0
Dailymotion,金萍,x4g735i,ReelShort Movie Shorts,xa66d8y,"She's Not Homeless, She's Healer Goddess | Who's Winning the Hero's Heart? 💖",2026-04-21,3542,9,0,0
Dailymotion,金萍,x4g735i,ReelShort Movie Shorts,xa62fvw,Married The Mafioso I Saved | Secrets of the Underworld 😎,2026-04-20,4724,2303,2,0
Dailymotion,金萍,x4g735i,ReelShort Movie Shorts,xa5q7y8,Hating and Loving My Adopted Brother | A Family's Unexpected Bond,2026-04-17,3469,18,0,0
Dailymotion,金萍,x4g735i,ReelShort Movie Shorts,xa52mls,Corrupting My Billionaire Boss's Heart[Hot 2026] | Forbidden Love at First Sight 😏🔥,2026-04-10,4608,696,1,0
Dailymotion,金萍,x4g735i,ReelShort Movie Shorts,xa2lno4,✨🎶 Breathe | Can Their Love Survive the Spotlight?-【HD Movie】,2026-03-19,5172,75,0,0
Dailymotion,金萍,x4g735i,ReelShort Movie Shorts,xa2lefg,The Cooking Queen: A Recipe for Divorce | From Heartbreak to Culinary Queen Again,2026-03-19,5454,500,1,0
Dailymotion,金萍,x4g735i,ReelShort Movie Shorts,x9z1sms,Fix You HD Movie - ReelShort Sweet Romance💕[English Sub],2026-02-02,5291,36,0,0
Dailymotion,乔艳,x4kmjg6,Daily Reelshort,xa0s530,🚀🧑‍🚀Their Brother Lost in Space | Free Episode ENG SUB,2026-02-26,5400,20,0,0
Dailymotion,乔艳,x4kmjg6,Daily Reelshort,xa0s3nw,💖When Love's Sorrow Plays Again | Bitter Sweet [ENG SUB] Free Episode,2026-02-26,4352,28,0,0
Dailymotion,乔艳,x4kmjg6,Daily Reelshort,xa0s1d0,❤️Secrets and Soulmates❤️Fated Lovers [ENG SUB] Free Episode,2026-02-26,4144,15,0,0
Dailymotion,乔艳,x4kmjg6,Daily Reelshort,xa0pnq0,💵The Billionaire and the Baby Trap🤗ENG SUB Free Episode,2026-02-25,4309,72,0,0
Dailymotion,乔艳,x4kmjg6,Daily Reelshort,xa0pkfm,🥰Backstage Romance with the Popstar🥰 - ENG SUB Free Episode,2026-02-25,3894,9,0,0
Dailymotion,乔艳,x4kmjg6,Daily Reelshort,xa0nipo,💕Find Your Way Back to Me My Childhood Sweetheart [ENG SUB] HD Free Episodes,2026-02-24,5361,1137,2,0
Dailymotion,乔艳,x4k7s0s,ReelShort_GlancePlay,xa0me5o,🎬✨Puck Me Baby One More Time [ENG SUB] 💕,2026-02-24,4812,6,0,0
Dailymotion,乔艳,x4k7s0s,ReelShort_GlancePlay,xa0mh0s,🌸👑 My Sister Is the Warlord Queen [ENG SUB] #reelshort HD Free Episodes No Cut,2026-02-24,6892,55,0,0
Dailymotion,乔艳,x4klm7q,ReelShort Romance Shows,xafl8o6,💫💫The Prank That Broke Us Dailymotion Video- Eleanor Vance High school star student #reelshort,2026-06-14,3452,50,0,0
Dailymotion,乔艳,x4klm7q,ReelShort Romance Shows,xaf7tcu,ENG SUB🖤Rejecting the Five Alphas Dailymotion Video - Elara A She-wolf with miraculous healing blood,2026-06-13,3218,17,0,0
Dailymotion,乔艳,x4klm7q,ReelShort Romance Shows,xaf7rte,💙Don't Miss Me When I'm Gone Dailymotion Video - I have to choose between two sons-the Miller brothers #reelshort,2026-06-13,3892,10,0,0
Dailymotion,乔艳,x4klm7q,ReelShort Romance Shows,xaf7r4a,HOT💥After the Reformatory My Family Begs Me Home Dailymotion Video - A New Life Ruined by Old Schemes #reelshort,2026-06-13,4316,8,0,0
Dailymotion,乔艳,x4klm7q,ReelShort Romance Shows,xaf7omq,NEW💫Rose in Chains Dailymotion Video - Love is the only key #reelshort,2026-06-13,4931,6,0,0
Dailymotion,乔艳,x4klm7q,ReelShort Romance Shows,xaf7ptu,NO CUT🔥Waterboy Second Down Dailymotion Video - Superstar quarterback Donovan Miller is back #reelshort,2026-06-13,3384,3,0,0
Dailymotion,乔艳,x4klm7q,ReelShort Romance Shows,xaf7jam,NEW🎭Caged by His Twisted Love Dailymotion Video - Trapped by the Man She Thought Gone #reelshort,2026-06-13,4178,82,0,0
Dailymotion,乔艳,x4klm7q,ReelShort Romance Shows,xaf7bve,ENG SUB💜The Hockey Captain That Hates Me Dailymotion Video - Rivals Turn Lovers Under Pressure #reelshort,2026-06-13,4157,2,0,0
Dailymotion,乔艳,x4klm7q,ReelShort Romance Shows,xae91xy,💥💥💥Draft Dreams Dailymotion Video - A Game That Changed My Whole Life #reelshort,2026-06-10,3183,6,0,0
Dailymotion,乔艳,x4klm7q,ReelShort Romance Shows,xae48xe,💫💫💫The Fake Debutante and the True Billionaire Dailymotion Video - Olivia Bennett win over wealthy Lian Cullen #reelshort,2026-06-09,3787,128,0,0
Dailymotion,乔艳,x4klm7q,ReelShort Romance Shows,xae489a,HOT🔥Breaking My Bodyguard Dailymotion Video - Vera Marchesa just wants one thing #reelshort,2026-06-09,3820,1545,1,0
Dailymotion,乔艳,x4klm7q,ReelShort Romance Shows,xae0t76,HOT🔥They Called Me Worthless Until My Cards Destroyed Their Academy Dailymotion - The forgotten boy with a mysterious pendant hides a world-shaking secret #reelshort,2026-06-08,3578,4,0,0
Dailymotion,乔艳,x4klm7q,ReelShort Romance Shows,xae0s3u,🔥Broken by My Twin Alphas Dailymotion - Ivy spent three years loving the twin Alphas #reelshort,2026-06-08,3648,56,0,0
Dailymotion,乔艳,x4klm7q,ReelShort Romance Shows,xae0oce,NO CUT✨Worthless to Priceless The Alpha's Rejected Mate Dailymotion Video - Hidden power Deadly secrets and A Forbidden Dark Destiny #reelshort,2026-06-08,3817,280,0,0
Dailymotion,乔艳,x4klm7q,ReelShort Romance Shows,xadmeki,👑👑The Alpha's Dead Luna Dailymotion Video - Aria A wolf-girl  Won Over by Alpha Kane's Five Years of Devotion #reelshort,2026-06-06,3721,23,0,0
Dailymotion,乔艳,x4klm7q,ReelShort Romance Shows,xadme22,NEW🖤My Fated Deal with the Alpha King Dailymotion Video - Alpha King Nicholas & Luna Violet #reelshort,2026-06-06,4117,246,1,0
Dailymotion,乔艳,x4klm7q,ReelShort Romance Shows,xadmdbu,💙💙💙Luna Reborn Alpha's Second Chance Dailymotion Video - Edward A Powerful Alpha #reelshort,2026-06-06,4567,11,0,0
Dailymotion,乔艳,x4klm7q,ReelShort Romance Shows,xadjwxu,🔥🔥🔥Chopping My Way to Immortality Dailymotion Anime - Derek A genius of the Celestial Sect’s Cloud Peak #reelshort,2026-06-06,3727,12,0,0
Dailymotion,乔艳,x4klm7q,ReelShort Romance Shows,xad9ot6,💛💛💛Double Life of a Cell Block King Dailymotion Video - A sudden marriage ties his fate to Sophia #reelshort,2026-06-05,4505,33,0,0
Dailymotion,乔艳,x4klm7q,ReelShort Romance Shows,xad9nw6,💜💜My Alpha Boss Gave Me Triplets Dailymotion Video - Leopold The Ruthless Alpha of the Stonehearth Pack #reelshort,2026-06-05,4479,10,0,0
Dailymotion,乔艳,x4klm7q,ReelShort Romance Shows,xad6944,💥💥💥The Extraordinary Mother of a Billionaire Dailymotion Anime - Billionaire Defends Humble Mother #reelshort,2026-06-04,4263,1869,0,0
Dailymotion,乔艳,x4klm7q,ReelShort Romance Shows,xad5wfg,🔥🔥🔥Reborn Villainess Healing Hearts Breaking Walls Dailymotion - Aria A kind-hearted veterinary intern#reelshort,2026-06-04,3966,4,0,0
Dailymotion,乔艳,x4klm7q,ReelShort Romance Shows,xad2sqy,ENG SUB💥Orc love Dailymotion Anime - Brian and Logan Twin Wolf Beastkin #reelshort,2026-06-04,3444,3,0,0
